title,start,end,raw_string
Symbols and Archetypes,2019-09,2019-12,Symbols and Archetypes (September 2019 - December 2019)
Then & Now: Five Centuries of Woodcuts,2019-01-10,2019-03-01,Then & Now: Five Centuries of Woodcuts (1/10-3/1/2019)
Joyce Tenneson—Botanical Beauty,2018-07-26,2018-08-18,"Joyce Tenneson—Botanical Beauty (July 26-August 18, 2018)"
Prospect.4: The Lotus Despite of the Swamp,2017-11-18,2018-02-25,"Prospect.4: The Lotus Despite of the Swamp, (November 18, 2017-February 25, 2018)"
Who Are We? Identity and the Contemporary Photographic Portrait,2017-09-11,2017-12-07,"Who Are We? Identity and the Contemporary Photographic Portrait (September 11-December 7, 2017)"
"American Artists and the Legacy of the Grand Tour, 1880-1960",2017-06-15,2017-08-26,"American Artists and the Legacy of the Grand Tour, 1880-1960 (June 15 to August 26, 2017)"
American Modernism at Mid-Century: The Work of Morris Davidson,2017-04-28,2017-09-17,"American Modernism at Mid-Century: The Work of Morris Davidson (April 28-September 17, 2017)"
The Dada Effect: An Anti-Aesthetic and Its Influence,2017-03-16,2017-05-27,"The Dada Effect: An Anti-Aesthetic and Its Influence (March 16-May 27, 2017)"
"Race, Sports, and Vanderbilt: 1966-1970",2016-09-23,2016-12-08,"Race, Sports, and Vanderbilt: 1966-1970 (September 23 - December 8, 2016)"
"Pastorals, Landscapes, and the Arcadian Vision",2016-06-10,2016-09-09,"Pastorals, Landscapes, and the Arcadian Vision (June 10 - September 9, 2016)"
Out of the Vault: Stories of People and Things,2016-04-26,2016-09-09,"Out of the Vault: Stories of People and Things (April 26 - September 9, 2016)"
Close Readings: American Abstract Art from the Vanderbilt University Fine Arts Gallery,2016-03-17,2016-05-26,"Close Readings: American Abstract Art from the Vanderbilt University Fine Arts Gallery (March 17 - May 26, 2016)"
Forging Identity - Imagining the Enemy: American Propaganda and the Great War,2015-09-18,2015-12-10,"Forging Identity - Imagining the Enemy: American Propaganda and the Great War, (September 18 - December 10, 2015)"
On the American Home Front; Forging Identity - Imagining the Enemy: American Propaganda and the Great War,2015-09-18,2015-12-10,"On the American Home Front; Forging Identity - Imagining the Enemy: American Propaganda and the Great War, (September 18 - December 10, 2015)"
Selma Freeman Ramsey and the Social Realist Tradition,2015-09-18,2016-01-17,"Selma Freeman Ramsey and the Social Realist Tradition (September 18, 2015 - January 17, 2016)"
Thrills & Chills! The Fantastic World of the American Circus,2015-06-11,2015-09-04,"Thrills & Chills! The Fantastic World of the American Circus (June 11 - September 4, 2015)"
Up Close and Personal: Intimate Devotions and Everyday Objects in Late Antiquity,2015-05-07,2015-09-04,"Up Close and Personal: Intimate Devotions and Everyday Objects in Late Antiquity (May 7 - September 4, 2015)"
Memento Mori - Looking at Death in Art and Illustration,2015-03-12,2015-05-23,"Memento Mori - Looking at Death in Art and Illustration (March 12 - May 23, 2015)"
American Abstract Artists 75th Anniversary Print Portfolio,2015-01-15,2015-02-27,"American Abstract Artists 75th Anniversary Print Portfolio (January 15 - February 27, 2015)"
I Am Unbeatable - Documenting and Celebrating Stories of Empowerment - Photographs by Donna Ferrato,2014-09,2014-12,I Am Unbeatable - Documenting and Celebrating Stories of Empowerment - Photographs by Donna Ferrato (Sept-Dec 2014)
Curiouser and Curiouser: Avant-Garde Polish Theatre Posters from the 1970s,2014-06-19,2014-08-28,"Curiouser and Curiouser: Avant-Garde Polish Theatre Posters from the 1970s (June 19 - August 28, 2014)"
From Tomb to Temple: Unearthing Ancient China through the Vanderbilt Art Collection,2014-06-19,2014-10-12,From Tomb to Temple: Unearthing Ancient China through the Vanderbilt Art Collection (06/19-10/12/14)
History's Shadow: German Art and the Formulation of Identity,2014-03-13,2014-06-05,"History's Shadow: German Art and the Formulation of Identity (March 13 - June 5, 2014)"
Fritz Eichenberg - Artist of the Book,2014-01-16,2014-02-27,"Fritz Eichenberg - Artist of the Book, (January 16 - February 27, 2014)"
Difficult Art and the Liberal Arts Imagination,2013-09-27,2013-12-05,"Difficult Art and the Liberal Arts Imagination (September 27 - December 5, 2013)"
Hans Hinterreiter: A Theory of Form and Color,2013-07-09,2013-09-12,"Hans Hinterreiter: A Theory of Form and Color, (July 9 - September 12, 2013)"
Four Hundred Year of British Art,2013-03-14,2013-06-15,"Four Hundred Year of British Art (March 14, 2013 - June 15, 2013)"
Mark di Suvero–Affinities,2013-01-17,2013-02-28,"Mark di Suvero–Affinities (January 17, 2013–February 28, 2013)"
Reflections of the Dutch Golden Age: Etchings by Adriaen van Ostade from the Vanderbilt University Fine Arts Gallery Collection,2012-03-15,2012-05-11,"Reflections of the Dutch Golden Age: Etchings by Adriaen van Ostade from the Vanderbilt University Fine Arts Gallery Collection (March 15 - May 11, 2012)"
Arts of Japan,2012-01-12,2012-02-26,"Arts of Japan (January 12-February 26, 2012)"
Polar Probings: Sculpture by Gabriel,2011-10-13,2011-12-08,"Polar Probings: Sculpture by Gabriel, (October 13 - December 8, 2011)"
Maria Magdalena Campos-Pons: MAMA/RECIPROCAL ENERGY,2011-10-12,2011-12-08,"Maria Magdalena Campos-Pons: MAMA/RECIPROCAL ENERGY, October 12 - (December 8, 2011)"
Reading Pictures: Text and Image in Contemporary Art,2011-08-25,2011-09-30,Reading Pictures: Text and Image in Contemporary Art (8/25-9/30/11)
10 West Coast Artists,2011-06-09,2011-08-13,"10 West Coast Artists (June 9–August 13, 2011)"
Reflections of War: Selections from the Vanderbilt University Fine Arts Gallery Collection,2011-03-14,2011-05-13,"Reflections of War: Selections from the Vanderbilt University Fine Arts Gallery Collection (March 14-May 13, 2011)"
Bestia contra Bestia/Beast vs. Beast: Photographs by Jose Luis Raymond,2011-01-13,2011-03-17,"Bestia contra Bestia/Beast vs. Beast: Photographs by Jose Luis Raymond (January 13 - March 17, 2011)"
Wide Angle: Photography and its Influence on Contemporary Art - A Selection from the Vanderbilt University Fine Arts Gallery Collection,2011-01-13,2011-02-27,"Wide Angle: Photography and its Influence on Contemporary Art - A Selection from the Vanderbilt University Fine Arts Gallery Collection (January 13-February 27, 2011)"
Five Centuries of Drawing,2010-06-11,2010-09-23,"Five Centuries of Drawing (June 11-September 23, 2010)"
Eye & Mind: A Legacy of Art Collecting at Vanderbilt University,2009-10-01,2010-05-01,"Eye & Mind: A Legacy of Art Collecting at Vanderbilt University (October 1, 2009-May 1, 2010)"
The Printed Page: Selections from the Anna C. Hoyt Collection,2009-03-12,2009-05-09,"The Printed Page: Selections from the Anna C. Hoyt Collection (March 12–May 9, 2009)"
Harmony Korine: Pigxote,2009-01-08,2009-02-26,"Harmony Korine: Pigxote (January 8 - February 26, 2009)"
"Line Up, Strip Down, Fade Out: Polaroid Photographs and Videos by Andy Warhol, Grant Worth, and David Horvitz",2008-08-28,2008-10-10,"Line Up, Strip Down, Fade Out: Polaroid Photographs and Videos by Andy Warhol, Grant Worth, and David Horvitz (August 28 – October 10, 2008)"
Views From The Collection III,2008-04-03,2008-08-15,"Views From The Collection III (April 3-August 15, 2008)"
Views from the Collection I,2006-08-17,2006-10-01,"Views from the Collection I (August 17-October 1, 2006)"
Light & Shadow: The Chiaroscuro Woodcut,2005-06-23,2005-08-13,"Light & Shadow: The Chiaroscuro Woodcut (June 23 - August 13, 2005)"
A Word Made Flesh: Works by Lesley Dill,2003-03-29,2003-06-05,"A Word Made Flesh: Works by Lesley Dill, (3/29/03-6/5/03)"
The Allegorical Impulse,2002-10-17,2002-12-05,"The Allegorical Impulse (October 17-December 5, 2002)"
Disturbing Allegories: New Graphics by Kara Walker,2001-02-08,2001-03-22,"Disturbing Allegories: New Graphics by Kara Walker (February 8 - March 22, 2001)"
Face Value: The Portrait and the Formulation of Identity in Art,2000-10-26,2000-12-08,"Face Value: The Portrait and the Formulation of Identity in Art (October 26-December 8, 2000)"
Heaven & Earth: The Figure in Religious and Secular Art,2000-03-25,2000-05-12,"Heaven & Earth: The Figure in Religious and Secular Art, (March 25, 2000 - May 12, 2000)"
"Ron Adams, Master Printmaker: A Survey of Work, 1984-1999",2000-02-10,2000-03-19,"Ron Adams, Master Printmaker: A Survey of Work, 1984-1999 (February 10-March 19, 2000)"
Light & Dark: The Fantastic World of Werner Wildner,1999-10-28,1999-12-17,"Light & Dark: The Fantastic World of Werner Wildner (October 28 - December 17, 1999)"
"The Satirical Eye: Lithographs by Honoré Daumier, Paul Gavarni & their Contemporaries",1999-09-02,1999-10-18,"The Satirical Eye: Lithographs by Honoré Daumier, Paul Gavarni & their Contemporaries (September 2 - October 18, 1999)"
"ADGFAD: Contemporary Graphic Arts from the Graphic Designers, Art Directors and Illustrators Association of Spain",1999-05-27,1999-08-20,"ADGFAD: Contemporary Graphic Arts from the Graphic Designers, Art Directors and Illustrators Association of Spain (May 27-August 20, 1999)"
Byzantium: Art & Ritual,1999-02-11,1999-03-21,"Byzantium: Art & Ritual (February 11-March 21, 1999)"
In High Bohemia: Photographic Portraits of Artists by Carl Van Vechten from the 1930s,1998-10-29,1998-12-12,"In High Bohemia:  Photographic Portraits of Artists by Carl Van Vechten from the 1930s (October 29- December 12, 1998)"
"Multiplicity: New Directions in Contemporary Printmaking, Artists' Books, and Other Multiples",1998-09-03,1998-10-18,"Multiplicity: New Directions in Contemporary Printmaking, Artists' Books, and Other Multiples (September 3-October 18, 1998)"
"Summer shall come, and with her all delights: Looking at Nature and the Landscape in Art",1998-06-18,1998-08-22,"Summer shall come, and with her all delights: Looking at Nature and the Landscape in Art (June 18-August 22, 1998)"
N4Art: Work by Members of the Nashville African-American Arts Association,1997-11-07,1997-12-12,"N4Art: Work by Members of the Nashville African-American Arts Association (November 7-December 12, 1997)"
Capital Cultures: Hogarth’s London to Hiroshige’s Edo,1997-04-11,1997-06-06,"Capital Cultures: Hogarth’s London to Hiroshige’s Edo (April 11-June 6, 1997)"
Board of Trust Spring Exhibition,1997-04,1997-04,Board of Trust Spring Exhibition (April 1997)
Looking East: Highlights of the Vanderbilt University Fine Arts Gallery's Collection of Asian Art,1997-02-21,1997-03-28,"Looking East: Highlights of the Vanderbilt University Fine Arts Gallery's Collection of Asian Art (February 21-March 28, 1997)"
Fresh Art: Recent Acquisitions by the Fine Arts Gallery,1997-01,1997-02,Fresh Art: Recent Acquisitions by the Fine Arts Gallery (January-February 1997)
On the American Home Front: World War I Posters from the Art Collection of Vanderbilt University,1994-06-19,1994-08-28,"On the American Home Front: World War I Posters from the Art Collection of Vanderbilt University (June 19-August 28, 1994)"
Spleen (After Baudelaire),1994-01-16,1994-02-20,"Spleen (After Baudelaire), (January 16-February 20, 1994)"
The Spirit of France: 500 Years of French Art & Culture,1993-09-05,1993-10-10,"The Spirit of France: 500 Years of French Art & Culture (September 5-October 10, 1993)"
"Gods, Saints, and Rulers",1992-04-12,1992-08-15,"Gods, Saints, and Rulers (April 12-August 15 1992)"
Contemporary West Coast Photographers,1983-02-06,1983-03-04,"Contemporary West Coast Photographers, (February 6-March 4, 1983)"
Italian Art,1983-01,1983-01,Italian Art (January 1983)
Selections from the Permanent Collection,1980-11,1980-11,Selections from the Permanent Collection (Nov. 1980)
The Harold P. Stern Collection of the Vanderbilt Art Collection,1979-04-08,1979-08-15,"The Harold P. Stern Collection of the Vanderbilt Art Collection (April 8 to August 15, 1979)"
The British Point of View,1979-01-15,1979-02-09,"The British Point of View (January 15-February 9, 1979)"
Selections from the Vanderbilt Art Collection,1978-09,1978-10,"Selections from the Vanderbilt Art Collection (September-October, 1978)"
Centennial Club,1978-02,1978-02,Centennial Club (February 1978)
Egypt to Expressionism,1976-10-18,1976-11-05,"Egypt to Expressionism (October 18-Nov. 5, 1976)"
Aspects of Classicism,1976-01,1976-02,Aspects of Classicism (January-February 1976)
Centennial Acquisitions,1975-10-01,1975-11-12,"Centennial Acquisitions (October 1-November 12, 1975)"
Beauty and Power,2007,2007,Beauty and Power (Summer 2007)
More Than One,2007,2007,More Than One (Fall 2007)
Views from the Collection II. Eye & Mind: A Legacy of Art Collecting at Vanderbilt University,2007,2007,Views from the Collection II. Eye & Mind: A Legacy of Art Collecting at Vanderbilt University (Spring 2007)
Inside Out/Outside In: Work by Chris Drury,2006,2006,Inside Out/Outside In: Work by Chris Drury (2006)
Gifts of Chinese Art from the Collections of Chauncey P. Lowe and Naidine Nelson Herring Swayne,1999,1999,Gifts of Chinese Art from the Collections of Chauncey P. Lowe and Naidine Nelson Herring Swayne (Fall 1999)
"A Catalan Perspective: Work by Joan Miró, Antoni Tàpies, and Joaquim Gomis",1995,1995,"A Catalan Perspective: Work by Joan Miró, Antoni Tàpies, and Joaquim Gomis (1995)"
Belle Pitture: Selections from the Samuel K. Kress Collection of Italian Renaissance Painting,1994,1994,Belle Pitture: Selections from the Samuel K. Kress Collection of Italian Renaissance Painting (1994)
Abstract Reality,1993,1993,Abstract Reality (1993)
Artists' Books,1993,1993,Artists' Books (1993)
Legacy of Asian Art,1991,1993,Legacy of Asian Art (1991-1993)
"Byzantine Frescoes of the 12th-15th Centuries from Yugoslavia: Copies by Zdenka Zivkovic, Belgrade",1986,1986,"Byzantine Frescoes of the 12th-15th Centuries from Yugoslavia: Copies by Zdenka Zivkovic, Belgrade (1986)"
Landis Study Show,1985,1985,Landis Study Show (Spring 1985)
Sculpture from the Vanderbilt Art Collection,1982,1982,Sculpture from the Vanderbilt Art Collection (Summer 1982)
Stencil Prints by Sadao Watanabe,1969,1969,Stencil Prints by Sadao Watanabe (1969)
