FACULTY,title,doi,BOOK TITLE,YEAR,PUBLISHER,,
Victor Anderson,,10.2307/j.ctv513ds2,Revives My Soul Again: The Spirituality of Martin Luther King Jr,2018,Fortress Press,,
Victor Anderson,Introduction,10.2307/j.ctv513ds2.6,Revives My Soul Again: The Spirituality of Martin Luther King Jr,2018,Fortress Press,,
Victor Anderson,"Blessed Assurance: Martin Luther King, Jr. and the Consolation of the Soul",10.2307/j.ctv513ds2.7,Revives My Soul Again: The Spirituality of Martin Luther King Jr,2018,Fortress Press,,
Victor Anderson,The Promptings of Some Beneficent Force:,10.2307/j.ctv513ds2.9,Revives My Soul Again: The Spirituality of Martin Luther King Jr,2018,Fortress Press,,
Victor Anderson,,10.5040/9781474287678,Beyond Ontological Blackness: An Essay on African American Religious and Cultural Crticism,2016,Bloomsbury,,
Victor Anderson,Introduction,10.5040/9781474287678.0005,Beyond Ontological Blackness: An Essay on African American Religious and Cultural Crticism,2016,Bloomsbury,,
Victor Anderson,Chapter 1. The Religious Functions of Cultural Criticism,10.5040/9781474287678.ch-001,Beyond Ontological Blackness: An Essay on African American Religious and Cultural Crticism,2016,Bloomsbury,,
Victor Anderson,Chapter 2. Categorical Racism and Racial Apologetics,10.5040/9781474287678.ch-002,Beyond Ontological Blackness: An Essay on African American Religious and Cultural Crticism,2016,Bloomsbury,,
Victor Anderson,Ontological Blackness in Theology,10.5040/9781474287678.ch-003,Beyond Ontological Blackness: An Essay on African American Religious and Cultural Crticism,2016,Bloomsbury,,
Victor Anderson,Explicating and Displacing Ontological Blackness : The Heroic and Grotesque in African American Cultural and Religious Criticism,10.5040/9781474287678.ch-004,Beyond Ontological Blackness: An Essay on African American Religious and Cultural Crticism,2016,Bloomsbury,,
Victor Anderson,Epilogue,10.5040/9781474287678.0006,Beyond Ontological Blackness: An Essay on African American Religious and Cultural Crticism,2016,Bloomsbury,,
Victor Anderson,Pragmatic Naturalism and Public Theology: A Version of Religious Naturalism,10.4324/9781315228907-16,Handbook on Religious Naturalism,2018,Routledge,,
Victor Anderson,For the Beauty of the World: Vision and Moral Order in Martin Luther King’s World House,10.2307/j.ctvfxv9j2.6,"Reclaiming the Great World House: The Global Vision of
Martin Luther King Jr",2019,University of Georgia Press,,
Victor Anderson,Black Cultural Criticism: The New Politics of Difference and Religious Criticism,10.7312/king14542-054,Theory/Religion/Critique: Classical and Contemporary Approaches,2017,Columbia University Press,,
Victor Anderson,Theorizing Black Religious Studies: A Genealogy,10.7312/king14542-055,Theory/Religion/Critique: Classical and Contemporary Approaches,2017,Columbia University Press,,
Victor Anderson,Black Ontology and Theology,10.1093/oxfordhb/9780199755653.013.0028,The Oxford Handbook of African American Theology,2014,Oxford University Press,,
Victor Anderson,The mimesis of salvation and dissimilitude in the scandalous gospel of Jesus,10.4324/9780203106129-21,Christology and Whiteness,2012,Routledge,,
Victor Anderson,An American Public Theology in the Absence of Giants: Creative Conflict and Democratic Longings,10.2307/j.ctt22nm96r.20,"Ethics that Matters: African, Caribbean, and African American Sources",2012,Fortress Press,,
Victor Anderson,The Black Church and the Curious Body of the Black Homosexual,10.1057/9781403980342_17,Loving the Black Body: Black Religious Studies and the Erotic,2004,Palgrave,,
Victor Anderson,African American Religious Ethics,10.1002/9781444367072.wbiee363,"International Encyclopedia of Ethics,",2013,Wiley,,
Ellen Armour,,10.7312/armo17248,Signs and Wonders: Religion After Modernity.,2016,Columbia University Press,,
Ellen Armour,Introduction,10.7312/armo17248-002,Signs and Wonders: Religion After Modernity.,2016,Columbia University Press,,
Ellen Armour,Man and His Others,10.7312/armo17248-003,Signs and Wonders: Religion After Modernity.,2016,Columbia University Press,,
Ellen Armour,Photography and/as Bio-Discipline,10.7312/armo17248-004,Signs and Wonders: Religion After Modernity.,2016,Columbia University Press,,
Ellen Armour,Bio-Discipline and Globalization,10.7312/armo17248-005,Signs and Wonders: Religion After Modernity.,2016,Columbia University Press,,
Ellen Armour,Regarding the Photographs of Others,10.7312/armo17248-006,Signs and Wonders: Religion After Modernity.,2016,Columbia University Press,,
Ellen Armour,Bio-Discipline and the Right of Life,10.7312/armo17248-007,Signs and Wonders: Religion After Modernity.,2016,Columbia University Press,,
Ellen Armour,The perfect Storm,10.7312/armo17248-008,Signs and Wonders: Religion After Modernity.,2016,Columbia University Press,,
Ellen Armour,Conclusion,10.7312/armo17248-009,Signs and Wonders: Religion After Modernity.,2016,Columbia University Press,,
Ellen Armour,"Decolonizing Spectatorship: Photography, Theology, and the New Media",10.2307/j.ctv1m46fsx.9,"Beyond Man: Race, Coloniality and the Philosophy of Religion",2011,Duke University Press,https://doi.org/10.1215/9781478021339-006,https://doi.org/10.1515/9781478021339-007
Ellen Armour,Reponsi/ability After Derrida,10.5422/fordham/9780823249923.003.0007,Living Together: Jacques Derrida’s Communities of Peace and Violence,2012,Fordham University Press,,
Ellen Armour,Visual Theology: Diagnosing Postmodernity,10.4324/9781315261676-21,Between Philosophy and Theology: Contemporary Interpretations of Christianity,2011,Ashgate Press,,
Ellen Armour,"Beyond the God/Man Duo: Globalization, Feminist Theology, and Religious Subjectivity",/9780199273881.003.0018,The Oxford Handbook of Feminist Theology,2011,Oxford University Press,,
Ellen Armour,Planetary Sightings? Negotiating Sexual Differences in Globalization’s Shadow,10.5422/fso/9780823233250.003.0013,"Planetary Loves: Postcoloniality, Gender and Theology",2010,Fordham University Press,,
Ellen Armour,Divining Differences: Irigaray and Religion,10.4324/9781315010823-4,Religion in French Feminist Thought,2003,Routledge,,
Ellen Armour,Queering the Subject.” Invited Contribution to “Forum on Teaching,10.1558/bsor.v39i4.003,Bulletin for the Study of Religion,2010,,,
Ellen Armour,"Performative, Queer Theories of Religion: Judith Butler",10.5040/9781350023772.ch-009,Cultural Approaches to Studying Religion: An Introduction to Theories and Methods,2019,Bloomsbury,,
Ellen Armour,Christianity and Sexuality,10.1007/978-1-4614-6086-2_9040, Encyclopedia of Psychology and Religion,2013,Springer,,
Ellen Armour,God,10.2307/j.ctv1hqdhmw.6,Constructive Theology: A Contemporary Approach to Classical Themes,2004,Fortress Press,,
Annalisa Azzoni,,10.1515/9781575068589,The Private Lives of Women in Persian Egypt,2013,Eisenbrauns,https://doi.org/10.5325/j.ctv1bxgxt8,
Annalisa Azzoni,Introduction,10.5325/j.ctv1bxgxt8.4,,2013,Eisenbrauns,,
Annalisa Azzoni,The Transition from Daughter to Wife,10.1515/9781575068589-003,,2013,Eisenbrauns,,
Annalisa Azzoni,The Rights and Duties of a Wife,10.1515/9781575068589-004,,2013,Eisenbrauns,,
Annalisa Azzoni,Matrimonial Property,10.5325/j.ctv1bxgxt8.7,,2013,Eisenbrauns,,
Annalisa Azzoni,The Law of Divorce,10.1515/9781575068589-006,,2013,Eisenbrauns,,
Annalisa Azzoni,Women's Legal Capacity and Activity,10.1515/9781575068589-007,,2013,Eisenbrauns,,
Annalisa Azzoni,Women and Religion,10.1515/9781575068589-008,,2013,Eisenbrauns,,
Annalisa Azzoni,Private Life,10.1515/9781575068589-009,,2013,Eisenbrauns,,
Annalisa Azzoni,Three Remarkable Women,10.5325/j.ctv1bxgxt8.12,,2013,Eisenbrauns,,
Annalisa Azzoni,PFAT 783: fruit and the bazikara,10.2307/j.ctv1q26jhj.4,Achemenet. Vingt ans après: Études offertes à Pierre Briant à l'occasion des vingt ans du Programme Achemenet,2021,Peeters,,
Annalisa Azzoni,The Empire as Visible in the Aramaic Documents from Persepolis,10.2307/j.ctvckq4gq.13,Die Verwaltung im Achämenidenreich—Imperiale Muster und Strukturen / The Administration of the Achaemenid Empire—Tracing the Imperial Signature,2017,Harrassowitz,,
Annalisa Azzoni,Women at Elephantine and Women in the Land,10.1163/9789004240841_002,"In the Shadow of Bezalel: Aramaic, Biblical and Ancient Near Eastern Studies in Honor of Bezalel Porten",2013,Brill,,
Annalisa Azzoni,Where Will Yehoyišmaʿ Go?” A Reconsideration of TAD B3.8,10.1163/9789004227163_002,Puzzling Out the Past: Studies in Northwest Semitic Languages and Literatures in Honor of Bruce Zuckerman,2012,Brill,,
Stephanie Budwey,“Marian Hymnology in the East and West,10.2307/j.ctv14gpjgt.20,Hymns and Hymnody: Historical and Theological Introductions. Vol. 1: From Asia Minor to Western Europe,2019,Cascade Books,,
James P. Byrd,,10.1093/acprof:oso/9780199843497.001.0001,"Sacred Scripture, Sacred War: The Bible and the American Revolution",2013,Oxford University Press,,
James P. Byrd,Introduction,10.1093/acprof:oso/9780199843497.003.0001,"Sacred Scripture, Sacred War: The Bible and the American Revolution",2013,Oxford University Press,,
James P. Byrd,The Curse of Cowardice,10.1093/acprof:oso/9780199843497.003.0002,"Sacred Scripture, Sacred War: The Bible and the American Revolution",2013,Oxford University Press,,
James P. Byrd,The Lord is a Man of War,10.1093/acprof:oso/9780199843497.003.0003,"Sacred Scripture, Sacred War: The Bible and the American Revolution",2013,Oxford University Press,,
James P. Byrd,Cursed Be He that Keepeth Back his Sword from Blood,10.1093/acprof:oso/9780199843497.003.0004,"Sacred Scripture, Sacred War: The Bible and the American Revolution",2013,Oxford University Press,,
James P. Byrd,"Teacheth My Hands to War, and My Fingers to Fight",10.1093/acprof:oso/9780199843497.003.0005,"Sacred Scripture, Sacred War: The Bible and the American Revolution",2013,Oxford University Press,,
James P. Byrd,The Liberty wherewith Christ hath Made Us Free,10.1093/acprof:oso/9780199843497.003.0006,"Sacred Scripture, Sacred War: The Bible and the American Revolution",2013,Oxford University Press,,
James P. Byrd,The Fierceness and Wrath of Almighty God,10.1093/acprof:oso/9780199843497.003.0007,"Sacred Scripture, Sacred War: The Bible and the American Revolution",2013,Oxford University Press,,
James P. Byrd,Epilogue,10.1093/acprof:oso/9780199843497.003.0008,"Sacred Scripture, Sacred War: The Bible and the American Revolution",2013,Oxford University Press,,
James P. Byrd,,10.1093/oso/9780190902797.001.0001,A Holy Baptism of Fire and Blood,2021,Oxford University Press,,
James P. Byrd,Introduction,10.1093/oso/9780190902797.003.0001,A Holy Baptism of Fire and Blood,2021,Oxford University Press,,
James P. Byrd,His Terrible Swift Sword,10.1093/oso/9780190902797.003.0002,A Holy Baptism of Fire and Blood,2021,Oxford University Press,,
James P. Byrd,The Stone Which the Builders Rejected,10.1093/oso/9780190902797.003.0003,A Holy Baptism of Fire and Blood,2021,Oxford University Press,,
James P. Byrd,The Red Sea of War,10.1093/oso/9780190902797.003.0004,A Holy Baptism of Fire and Blood,2021,Oxford University Press,,
James P. Byrd,This Second War I Consider Equally as Holy as the First,10.1093/oso/9780190902797.003.0005,A Holy Baptism of Fire and Blood,2021,Oxford University Press,,
James P. Byrd,A Covenant of Death,10.1093/oso/9780190902797.003.0006,A Holy Baptism of Fire and Blood,2021,Oxford University Press,,
James P. Byrd,Trust in Providence and Keep Yoru Powder Dry,10.1093/oso/9780190902797.003.0007,A Holy Baptism of Fire and Blood,2021,Oxford University Press,,
James P. Byrd,A Holy Baptism of Fire and Blood,10.1093/oso/9780190902797.003.0008,A Holy Baptism of Fire and Blood,2021,Oxford University Press,,
James P. Byrd,Welcome to the Ransomed,10.1093/oso/9780190902797.003.0009,A Holy Baptism of Fire and Blood,2021,Oxford University Press,,
James P. Byrd,Without Shedding of Blood Is No Remission,10.1093/oso/9780190902797.003.0010,A Holy Baptism of Fire and Blood,2021,Oxford University Press,,
James P. Byrd,The Sword of the Lord,10.1093/oso/9780190902797.003.0011,A Holy Baptism of Fire and Blood,2021,Oxford University Press,,
James P. Byrd,We Cannot Escape History,10.1093/oso/9780190902797.003.0012,A Holy Baptism of Fire and Blood,2021,Oxford University Press,,
James P. Byrd,Of One Blood All Nations,10.1093/oso/9780190902797.003.0013,A Holy Baptism of Fire and Blood,2021,Oxford University Press,,
James P. Byrd,These Dead Have Not Died in Vain,10.1093/oso/9780190902797.003.0014,A Holy Baptism of Fire and Blood,2021,Oxford University Press,,
James P. Byrd,Cursed Be He that Keepeth Back his Sword from Blood,10.1093/oso/9780190902797.003.0015,A Holy Baptism of Fire and Blood,2021,Oxford University Press,,
James P. Byrd,Woe to that Man By Whom the Offense Cometh,10.1093/oso/9780190902797.003.0016,A Holy Baptism of Fire and Blood,2021,Oxford University Press,,
James P. Byrd,Baptized in the Blood of their President,10.1093/oso/9780190902797.003.0017,A Holy Baptism of Fire and Blood,2021,Oxford University Press,,
James P. Byrd,Epilogue,10.1093/oso/9780190902797.003.0018,A Holy Baptism of Fire and Blood,2021,Oxford University Press,,
James P. Byrd,"Jonathan Edwards, War, and the Bible",10.1093/oso/9780190249496.003.0012,Jonathan Edwards and Scripture: Biblical Exegesis in British North America,2018,Oxford University Press,,
James P. Byrd,"The 'New World' of North America and Canada and the Globalization of Critical Biblical Scholarship,”",10.13109/9783666540219.171,"The Hebrew Bible / Old Testament: The History of Its Interpretation. Vol. III, From Modernism to Post-Modernism: the Nineteenth and Twentieth Centuries,",2013,Vandenhoeck & Ruprecht,,
Paul DeHart,On the contrary: Thomistic second thoughts on analogy and Trinity in Eberhard Jüngel,10.5040/9780567659644.ch-004,Indicative of Grace – Imperative of Freedom: Essays in Honor of Eberhard Jünge,2014,T&T Clark,,
Paul DeHart,Absolute Dependence or Infinite Desire? Comparing Soteriological Themes in Schleiermacher and Kierkegaard,10.1515/9783110199642.3.561,Schleiermacher und Kierkegaard: Subjektivität und Wahrheit / Subjectivity and Truth,2006,De Gruyter,,
Paul DeHart,,10.5040/9780567698728,Creation and Transcendence: Theological Essays on the Divine Sublime,2021,Bloomsbury,,
Paul DeHart,Introduction,10.5040/9780567698728-006,Creation and Transcendence: Theological Essays on the Divine Sublime,2021,Bloomsbury,,
Paul DeHart,Can Pascal Forgive Descartes? God's Ambiguous Infiinity,10.5040/9780567698728.ch-001,Creation and Transcendence: Theological Essays on the Divine Sublime,2021,Bloomsbury,,
Paul DeHart,Absolute Dependence or Infinite Desire? Comparing Soteriological Themes in Schleiermacher and Kierkegaard,10.5040/9780567698728.ch-002,Creation and Transcendence: Theological Essays on the Divine Sublime,2021,Bloomsbury,,
Paul DeHart,The Passage from Mind to Heart is So Long: Kierkegaard's Repetition and the Ontology of Agency,10.5040/9780567698728.ch-003,Creation and Transcendence: Theological Essays on the Divine Sublime,2021,Bloomsbury,,
Paul DeHart,f(S)I-s: The Instance of Pattern in Kathryn Tanner's Theology,10.5040/9780567698728.ch-004,Creation and Transcendence: Theological Essays on the Divine Sublime,2021,Bloomsbury,,
Paul DeHart,On the contrary: Thomistic second thoughts on analogy and Trinity in Eberhard Jüngel,10.5040/9780567698728.ch-005,Creation and Transcendence: Theological Essays on the Divine Sublime,2021,Bloomsbury,,
Paul DeHart,John Milbank's Divine Comedy: Not Funny Enough,10.5040/9780567698728.ch-006,Creation and Transcendence: Theological Essays on the Divine Sublime,2021,Bloomsbury,,
Paul DeHart,"Nothing in This Book is True, But It's Exactly How Things Are",10.5040/9780567698728.ch-007,Creation and Transcendence: Theological Essays on the Divine Sublime,2021,Bloomsbury,,
Paul DeHart,Eclipse of the Divine Mind: The Divine Ideas as Anti-Platonic Epistemology,10.5040/9780567698728.ch-008,Creation and Transcendence: Theological Essays on the Divine Sublime,2021,Bloomsbury,,
Paul DeHart,The Creature Makes Itself: The Divine Ideas as Anti-Platonic Soteriology,10.5040/9780567698728.ch-009,Creation and Transcendence: Theological Essays on the Divine Sublime,2021,Bloomsbury,,
Paul DeHart,Improvising the Paradigms: The Divine Ideas as Anti-Platonic Ontology,10.5040/9780567698728.ch-0010,Creation and Transcendence: Theological Essays on the Divine Sublime,2021,Bloomsbury,,
Juan Floyd-Thomas,,10.1057/9780230615823,The Origins of Black Humanism in America: Reverend Ethelred Brown and the Unitarian Church,2008,Palgrave Macmillan,,
Juan Floyd-Thomas,Introduction,10.1057/9780230615823_1,The Origins of Black Humanism in America: Reverend Ethelred Brown and the Unitarian Church,2008,Palgrave Macmillan,,
Juan Floyd-Thomas,Poor Pilgrim of Sorrow: Rev. Ethelred Brown and the Roots of Black Humanism in Harlem,10.1057/9780230615823_2,The Origins of Black Humanism in America: Reverend Ethelred Brown and the Unitarian Church,2008,Palgrave Macmillan,,
Juan Floyd-Thomas,"Building the Church of Tomorrow: Race, Religion, and Social Thought in the Harlem Unitarian Church",10.1057/9780230615823_3,The Origins of Black Humanism in America: Reverend Ethelred Brown and the Unitarian Church,2008,Palgrave Macmillan,,
Juan Floyd-Thomas,"Against Principalities, Against Powers: Racial Uplift and Working-Class Radicalism in the Harlem Unitarian Church",10.1057/9780230615823_4,The Origins of Black Humanism in America: Reverend Ethelred Brown and the Unitarian Church,2008,Palgrave Macmillan,,
Juan Floyd-Thomas,In the Shadow of Egypt: Racial Consciousness and Pan-Caribbean Nationalism in the Harlem Unitarian Church,10.1057/9780230615823_5,The Origins of Black Humanism in America: Reverend Ethelred Brown and the Unitarian Church,2008,Palgrave Macmillan,,
Juan Floyd-Thomas,The Price We Pay: The Demise of the Harlem Unitarian Church,10.1057/9780230615823_6,The Origins of Black Humanism in America: Reverend Ethelred Brown and the Unitarian Church,2008,Palgrave Macmillan,,
Juan Floyd-Thomas,A Unique and Significant Religious Experiment: Rev. Ethelred Brown and the Legacy of Black Humanism,10.1057/9780230615823_7,The Origins of Black Humanism in America: Reverend Ethelred Brown and the Unitarian Church,2008,Palgrave Macmillan,,
Juan Floyd-Thomas,Liberation in African American Theology”,10.1093/oxfordhb/9780199755653.013.0014,Oxford Handbook of African American Theology,2014,Oxford University Press,,
Juan Floyd-Thomas,"“Economic Justice, and Globalization in Black Church Studies: Confronting the ‘Malignant Kinship’ in the Post-Civil Rights Era",10.1057/9781137534552_26,The Black Church Studies Reader,2015,Palgrave Macmillan,,
Juan Floyd-Thomas,,10.5040/9781350041073,Religion in the Age of Obama,2018,Bloomsbury,,
Juan Floyd-Thomas,Introduction,10.5040/9781350041073.0006,Religion in the Age of Obama,2018,Bloomsbury,,
Juan Floyd-Thomas,Black Prophetic Discourse and Just War Theory in the Age of Obama,10.5040/9781350041073.0016,Religion in the Age of Obama,2018,Bloomsbury,,
Juan Floyd-Thomas,"‘Lest We Be Scattered Abroad’: Nimrod, Marcus Garvey, and Black Religious Humanism in Harlem",10.1057/9780230610507_5,African American Religious Life and the Story of Nimrod,2007,Palgrave Macmillan,,
Stacey Floyd-Thomas,"A Field of Study as a Field of Dreams: The Contours of Black Church Studies,”",10.1057/9781137534552_5,Black Church Studies Reader,2016,Palgrave Macmillan,,
Stacey Floyd-Thomas,"I am Black and Beautiful, O Ye Daughters of Jerusalem...’: African American Virtue Ethics and a Womanist Hermeneutics of Redemption",10.1057/9780230610507_4,African American Religious Life and the Story of Nimrod,2007,Palgrave Macmillan,,
Stacey Floyd-Thomas,Religious Thought: Womanist,10.4135/9781608712427.n332,"Encyclopedia of Religion in America, (",2010,CQ Press,,
Jaco J. Hamman,,10.2307/j.ctv1khdp3t,"Just Traveling: God, Leaving Home, and a Spirituality for the Road",2021,Fortress Press,,
Jaco J. Hamman,Traveling: A Paradoxical Practice,10.2307/j.ctv1khdp3t.5,"Just Traveling: God, Leaving Home, and a Spirituality for the Road",2021,Fortress Press,,
Jaco J. Hamman,"Anticipating Planning, Expecting, and Leaving Home",10.2307/j.ctv1khdp3t.6,"Just Traveling: God, Leaving Home, and a Spirituality for the Road",2021,Fortress Press,,
Jaco J. Hamman,Chapter 2 SURRENDERING Longing for Letting Go and Renewal,10.2307/j.ctv1khdp3t.7,"Just Traveling: God, Leaving Home, and a Spirituality for the Road",2021,Fortress Press,,
Jaco J. Hamman,Chapter 3 MEETING Overcoming Distance and Celebrating Difference (pp. 41-66),10.2307/j.ctv1khdp3t.8,"Just Traveling: God, Leaving Home, and a Spirituality for the Road",2021,Fortress Press,,
Jaco J. Hamman,Chapter 4 CARING Redeeming Privileged Irresponsibility and Building Solidarity,10.2307/j.ctv1khdp3t.9,"Just Traveling: God, Leaving Home, and a Spirituality for the Road",2021,Fortress Press,,
Jaco J. Hamman,Chapter 5 RETURNING Remembering Faithfully and Maintaining Relationships,10.2307/j.ctv1khdp3t.10,"Just Traveling: God, Leaving Home, and a Spirituality for the Road",2021,Fortress Press,,
Jaco J. Hamman,WE ARE HOMO ERRABUNDUS Walking with the Earthroamer,10.2307/j.ctv1khdp3t.11,"Just Traveling: God, Leaving Home, and a Spirituality for the Road",2021,Fortress Press,,
Jaco J. Hamman,Playing,10.1002/9781444345742.ch3,The Blackwell companion to practical theology,2011,Blackwell Wiley Press,,
Forest Harris,"Theology, Praxis, and Leadership: Paradigm for Black Churches,",10.5040/9780567675477.ch-024,"T&T Clark Handbook of African American Theology,",2019,T&T Clark,,
Forest Harris,Pursuing American Racial Justice and a Politically and Theologically Informed Black Church Praxis,10.14325/mississippi/9781628462005.003.0010,"Post-Racialism and Conflicted Churches in the United States and South Africa,",2015,,,
James Hudnut-Beumler,,10.5149/northcarolina/9781469640372.001.0001,Strangers and Friends at the Welcome Table: Contemporary Christianities in the American South,2018,university of north carolina press,,
James Hudnut-Beumler,Christianities in the Now South,10.5149/northcarolina/9781469640372.003.0001,Strangers and Friends at the Welcome Table: Contemporary Christianities in the American South,2018,university of north carolina press,,
James Hudnut-Beumler,"1 I Was Hungry, and You Gave Me Something to Eat",10.5149/northcarolina/9781469640372.003.0002,Strangers and Friends at the Welcome Table: Contemporary Christianities in the American South,2018,university of north carolina press,,
James Hudnut-Beumler,"2 The Religion of the Lost Cause, Reloaded",10.5149/northcarolina/9781469640372.003.0003,Strangers and Friends at the Welcome Table: Contemporary Christianities in the American South,2018,university of north carolina press,,
James Hudnut-Beumler,"3 Rattlesnakes, Holiness, and the Nearness of the Holy Spirit",10.5149/northcarolina/9781469640372.003.0004,Strangers and Friends at the Welcome Table: Contemporary Christianities in the American South,2018,university of north carolina press,,
James Hudnut-Beumler,4 Washed in the Blood in the Red States,10.5149/northcarolina/9781469640372.003.0005,Strangers and Friends at the Welcome Table: Contemporary Christianities in the American South,2018,university of north carolina press,,
James Hudnut-Beumler,5 Our Church Is Cleaning Up after Katrina,10.5149/northcarolina/9781469640372.003.0006,Strangers and Friends at the Welcome Table: Contemporary Christianities in the American South,2018,university of north carolina press,,
James Hudnut-Beumler,6 Mississippi Flooding,10.5149/northcarolina/9781469640372.003.0007,Strangers and Friends at the Welcome Table: Contemporary Christianities in the American South,2018,university of north carolina press,,
James Hudnut-Beumler,7 Megachurches and the Reinvention of Southern Church Life,10.5149/northcarolina/9781469640372.003.0008,Strangers and Friends at the Welcome Table: Contemporary Christianities in the American South,2018,university of north carolina press,,
James Hudnut-Beumler,8 The Changing Face of the Catholic South,10.5149/northcarolina/9781469640372.003.0009,Strangers and Friends at the Welcome Table: Contemporary Christianities in the American South,2018,university of north carolina press,,
James Hudnut-Beumler,9 Christian Homeschoolers,10.5149/northcarolina/9781469640372.003.0010,Strangers and Friends at the Welcome Table: Contemporary Christianities in the American South,2018,university of north carolina press,,
James Hudnut-Beumler,"10 Southern, Christian, and Gay",10.5149/northcarolina/9781469640372.003.0011,Strangers and Friends at the Welcome Table: Contemporary Christianities in the American South,2018,university of north carolina press,,
James Hudnut-Beumler,Conclusion Southern Christianities in Harmony and Conflict,10.5149/northcarolina/9781469640372.003.0012,Strangers and Friends at the Welcome Table: Contemporary Christianities in the American South,2018,university of north carolina press,,
James Hudnut-Beumler,,10.7312/hudn18360,The Future of Mainline Protestantism,2018,columbia University Press,,
James Hudnut-Beumler,Introduction,10.7312/hudn18360-002,,,columbia University Press,,
James Hudnut-Beumler,Conclusion: The Quakerization of Mainline Protestantism,10.7312/hudn18360-008,,,columbia University Press,,
James Hudnut-Beumler,Afterword,10.1093/oso/9780190280192.001.0001,r The Business Turn in American Religious History,2017,oxford University Press,,
James Hudnut-Beumler,Economics,10.1002/9781444324082.ch8,The Blackwell Companion to Religion in America,2010,Wiley,,
James Hudnut-Beumler,Suburbanization and Religion,10.1017/chol9780521871082.006,The Cambridge History of Religions in America,2009,Cambridge University press,,
Paul Lim,,10.1093/acprof:oso/9780195339468.001.0001,Mystery Unveiled: The Crisis of the Trinity in Early Modern England.,2012,oxford University Press,,
