Title,Url,yes/no
Faith on Earth: An Inquiry into the Structure of Human Faith,,
Dialogical Interrogations,,
The Pragmatic Secularization of Theology,,
Is Cornel West also among the Theologians?,,
Secularization and the worldliness of theology,,
Ontological Blackness in Theology,,
Ontological Blackness in Theology,,
Introduction,,
Theorizing African American Religion,,
Is America Possible?,,
The mimesis of salvation and dissimilitude in the scandalous gospel of Jesus,http://site.ebrary.com/lib/vanderbilt/detail.action?docID=10603716,
"Responsibility, Vengeance and the Death Penalty",,
The Black Church and the Curious Body of the Black Homosexual,http://site.ebrary.com/lib/vanderbilt/Doc?id=10135726,
Frustrated Fellowship: The Black Baptist Quest for Social Power,http://search.ebscohost.com/login.aspx?direct=true&db=rfh&AN=ATLA0000549721&site=ehost-live,
Soul theology: the heart of American black culture,http://search.ebscohost.com/login.aspx?direct=true&db=rfh&AN=ATLA0000560637&site=ehost-live,
Face to face : becoming a pastor to children,,
"The Legacy of Pragmatism in the Theologies of D. C. MacIntosh, H. Richard Niebuhr, and James M. Gustafson",,
The search for public theology in the United States,,
Pragmatic theology: negotiating the intersections of an American philosophy of religion and public theology,,
The Wrestle of Christ and Culture in Pragmatic Public Theology,,
African American Religious Thought and Pragmatism,,
The Narrative Turn in Christian Ethics : A Critical Appraisal,,
Changing conversions: religious reflection and cultural analysis,http://search.ebscohost.com/login.aspx?direct=true&db=rfh&AN=ATLA0000357749&site=ehost-live,
Contour of an African American public theology,,
Critical reflection on the problems of history and narrative in a recent African-American research program,,
Three paths to empowerment in recent African American theology and ethics,http://search.ebscohost.com/login.aspx?direct=true&db=rfh&AN=ATLA0001401530&site=ehost-live,
Pragmatic theology and the natural sciences at the intersection of human interests,http://search.ebscohost.com/login.aspx?direct=true&db=rfh&AN=ATLA0001287781&site=ehost-live,
A relational concept of race in African American religious thought,http://search.ebscohost.com/login.aspx?direct=true&db=rfh&AN=ATLA0001365253&site=ehost-live,
Spirituality and capitalism,,
Theology and modern physics,http://search.ebscohost.com/login.aspx?direct=true&db=rfh&AN=ATLA0001625456&site=ehost-live,
Creative exchange: a constructive theology of African American religious experience,,
Making a way out of no way: a womanist theology,,
Telling God's stories with power,,
The Christian imagination: theology and the origins of race,,
Black scholarly aesthetics and the religious critic: black experience as manifolds of manifestations and powers of presentations,,
Beyond ontological blackness : an essay on African religious and cultural criticism,,
Abominations of a million men : reflection on a silent minority,,
African American Church Tradition,,
African American Religious Ethics,https://doi.org/10.1002/9781444367072 ,
"African American Theologies; Black Theology; Dewey,John; Du Bois, W.E.B.; Pragmatism and Christian Theologies; Introductory Entry: Racism and Christianity: Ethnocentrism; Thurman, Howard",http://dx.doi.org/10.1017/CBO9780511780165,
"Liberation Theologies, Postmodernity, and the Americas",http://search.ebscohost.com/login.aspx?direct=true&db=rlh&AN=2438373&site=ehost-live,
The Christian Imagination: Theology and the Origins of Race,http://search.ebscohost.com/login.aspx?direct=true&db=rlh&AN=65828645&site=ehost-live,
Masculinities Beyond Good and Evil: Representations of the Down Low in the Fictional Imagination of Alphonso Morgan's Sons,http://ejournals.library.vanderbilt.edu/ojs/index.php/ameriquests/article/view/137/154,
Why Lord?: suffering and evil in Black theology,http://search.ebscohost.com/login.aspx?direct=true&db=rfh&AN=ATLA0000358781&site=ehost-live,
Deadly silence: reflections on homosexuality and human rights,,
Rousseau on order,,
An American Public Theology in the Absence of Giants: Creative Conflict and Democratic Longings,,
Ontological Inquiry and Black Existence,,
Mimetic Reflections: The Religious Critic between the Church and Empire,,
Three theories of sexuality,,
Augustine,,
"""We see through a glass darkly"": black narrative theology and the opacity of African American religious thought",,
Response,,
Fear and Trembling in the Everyday of Richard Wright’s Black Boy: A Quare Reading,,
A Reasonable Belief: Why God and Faith Make Sense by William Greenway (review),https://muse.jhu.edu/article/685077,
Foreword,,
Theorizing Black Religious Studies: A Genealogy,,
"Black Cultural Criticism, the New Politics of Difference, and Religious Criticism",,
“Black Religion and Culture Studies”,,
Revives my soul again: the spirituality of Martin Luther King Jr. / Lewis V. Baldwin and Victor Anderson.,,
A Response: Narrative Renewed,,
"Matthew 3:7-12, Matthew 3:13-17, Matthew 4:1-11",,
African American Practical Theology,,
Teaching preaching as a Christian practice: a new approach to homiletical pedagogy,http://search.ebscohost.com/login.aspx?direct=true&db=rfh&AN=ATLA0001933219&site=ehost-live,
Seeking restoration,http://search.ebscohost.com/login.aspx?direct=true&db=rfh&AN=ATLA0001553341&site=ehost-live,
African American Biblical Interpretation,,
Do you know your proper place? Is there a crisis in black preaching?,,
Foreword,,
Preaching a Just Word in Privileged Pulpits: Healing Affluenza,,
Black Preaching Praxis,,
"Job 42, Ruth 1, Wisdom of Solomon 3",,
"Hebrews 10, Titus 2, Hebrews 1",,
African American Apprenticeship,,
African American Preaching and Sermonic Traditions,,
Race and Racism,,
"New Proclamation: Advent through Holy Week, Year A 2004-2005",,
Practical theology for Black churches: bridging Black theology and African American folk religion,,
"Preaching God's transforming justice: a lectionary commentary, year C",,
"Preaching God's transforming justice: a lectionary commentary, year B",,
Epiphany,,
Advent 3,,
The Boy Wonder (Luke 2:41051),,
The Lure of Cotton Candy,,
Author's Reply Article,,
Losing Our Minds!,,
Preaching the Lesson,,
On Theology and Praxis,,
Reaching Out Without Overtaking,,
Teaching Black Preaching: Encounter and Re-encounter,,
Teaching Black Preaching: Homiletic Instruction as Pre-Encounter,,
Hope in pastoral care and counseling,http://search.ebscohost.com/login.aspx?direct=true&db=rfh&AN=ATLA0001544153&site=ehost-live,
Faithful change: the personal and public challenges of postmodern life,http://search.ebscohost.com/login.aspx?direct=true&db=rfh&AN=ATLA0000342540&site=ehost-live,
Another day's journey: Black churches confronting the American crisis,http://search.ebscohost.com/login.aspx?direct=true&db=rfh&AN=ATLA0000350378&site=ehost-live,
The heart of Black preaching,,
"Listen, my son: St. Benedict for fathers",http://search.ebscohost.com/login.aspx?direct=true&db=rfh&AN=ATLA0001285721&site=ehost-live,
Culturally conscious worship,http://search.ebscohost.com/login.aspx?direct=true&db=rfh&AN=ATLA0001424509&site=ehost-live,
Encounters and being,http://search.ebscohost.com/login.aspx?direct=true&db=rfh&AN=ATLA0001453688&site=ehost-live,
Children of color: psychological interventions with culturally diverse youth,http://search.ebscohost.com/login.aspx?direct=true&db=rfh&AN=ATLA0001519170&site=ehost-live,
Measuring grace? Mark 7:24-30,http://search.ebscohost.com/login.aspx?direct=true&db=rfh&AN=ATLA0001473801&site=ehost-live,
Transforming ministry,http://search.ebscohost.com/login.aspx?direct=true&db=rfh&AN=ATLA0001524843&site=ehost-live,
Stand by me: the risks and rewards of mentoring today's youth,http://search.ebscohost.com/login.aspx?direct=true&db=rfh&AN=ATLA0001524853&site=ehost-live,
Backward and forward,http://search.ebscohost.com/login.aspx?direct=true&db=rfh&AN=ATLA0001590109&site=ehost-live,
"Being human: race, culture, and religion",http://search.ebscohost.com/login.aspx?direct=true&db=rfh&AN=ATLA0001628489&site=ehost-live,
Possibly a Porcupine Problem,,
Lent 2,,
What's faith got to do with it? Black bodies/Christian souls,http://search.ebscohost.com/login.aspx?direct=true&db=rfh&AN=ATLA0001628488&site=ehost-live,
More power in the pulpit: how America's most effective black preachers prepare their sermons,http://search.ebscohost.com/login.aspx?direct=true&db=rfh&AN=ATLA0001822678&site=ehost-live,
Global Conflict and the Preaching Tradition of Martin Luther King Jr.,,
Spirit speech: lament and celebration in preaching,http://search.ebscohost.com/login.aspx?direct=true&db=rfh&AN=ATLA0001871785&site=ehost-live,
A tower of pulpits,,
"Preaching God's transforming justice: a lectionary commentary, year A",,
A covenant model of ecclesiology for black practical theology: spanning the chasm between black theology and African American folk religion,,
Black practical theology,,
"Introduction: Afrofuturism in Black Theology – Race, Gender, Sexuality, and the State of Black Religion in the Black Metropolis",http://dx.doi.org/10.1080/14769948.2015.1131499,
Queering the Subject,https://journal.equinoxpub.com/BSOR/article/view/15042,
"Crossing the Boundaries Between Deconstruction, Feminism and Religion",,
On Diversity and Conflict,,
Sallie McFague,,
American/French Intersections: The Play of Race/Class/Politics in Irigaray,,
"""Through flame or ashes"": Traces of Difference in Geist's Return",,
Beyond Belief?: Sexual Difference and Religion After Ontotheology,,
Divining Differences: Irigaray and Religion,,
A Post-Structuralist Approach,,
Touching Transcendence: Sexual Difference and Sacrality in Derrida's Le Toucher,,
Toward an Elemental Theology: A Constructive Proposal,,
Planetary Sightings? Negotiating Sexual Differences in Globalization’s Shadow,,
Visual Theology: Diagnosing Postmodernity,,
Thinking Otherwise: Derrida’s Contribution to the Philosophy of Religion,,
Reading From This Place: Resources for Sexual Justice,,
"Queer Bibles, Queer Scriptures?: An introductory response",,
"Beyond the God/Man Duo: Globalization, Feminist Theology, and Religious Subjectivity",,
Sallie McFague,,
Recent French feminist works,http://search.ebscohost.com/login.aspx?direct=true&db=rfh&AN=ATLA0000840740&site=ehost-live,
Questions of Proximity: “Woman's Place” in Derrick and Irigaray,http://onlinelibrary.wiley.com/doi/10.1111/j.1527-2001.1997.tb00171.x/abstract,
"""Man"" and his ""Others""",http://jffp.pitt.edu/ojs/index.php/jffp/article/view/248,
Response to Paul J. Griffiths,,
Reply to [Peter J.] Ochs.,,
Theology in Modernity's Wake,,
Christianity and Sexuality,,
Feminist Theology and Racism,,
Border Crossing,http://muse.jhu.edu.proxy.library.vanderbilt.edu/journals/philosophia/v003/3.2.armour.html,
"Deconstruction, feminist theology, and the problem of difference : subverting the race/gender divide",,
Deconstruction and feminist theology : toward forging an alliance with Derrida and Irigaray,,
Reponsi/ability After Derrida,,
God,,
"Blinding me with (queer) science: religion, sexuality, and (post?) modernity",http://search.proquest.com.proxy.library.vanderbilt.edu/docview/847097084?accountid=14816,
"Writing/reading Selves, Writing/reading Race",https://www.questia.com/library/journal/1P3-32576490/writing-reading-selves-writing-reading-race,
Essentialism,,
Spiritual geography,http://go.galegroup.com/ps/i.do?id=GALE%7CA20968464&v=2.1&u=tel_a_vanderbilt&it=r&p=AONE&sw=w&asid=8fdf50beea5f73e5e3fe17af82617712,
Feminist Theology in Retrospect and in Anticipation,http://www.journals.uchicago.edu/doi/full/10.1086/683834,
Signs and wonders: theology after modernity,,
Review of Transcending Boundaries: Multi-Disciplinary Approaches to the Study of Gender,http://proxy.library.vanderbilt.edu/login?url=http://search.ebscohost.com/login.aspx?direct=true&db=rfh&AN=ATLAS000151982&site=ehost-live,
Review of Knowing Other-wise,http://proxy.library.vanderbilt.edu/login?url=http://search.ebscohost.com/login.aspx?direct=true&db=rfh&AN=ATLAS000152007&site=ehost-live,
Review of Feminist Interpretations of Søren Kierkegaard,http://proxy.library.vanderbilt.edu/login?url=http://search.ebscohost.com/login.aspx?direct=true&db=rfh&AN=ATLAS000152007&site=ehost-live,
"Review of Feminism, Sexuality and the Return of Religion",http://ndpr.nd.edu/news/36868-feminism-sexuality-and-the-return-of-religion/,
Review of Eros for the other: retaining truth in a pluralistic world,http://search.ebscohost.com/login.aspx?direct=true&db=rfh&AN=ATLA0000345033&site=ehost-live,
Review of Feminist theory and Christian theology: cartographies of grace,http://proxy.library.vanderbilt.edu/login?url=http://search.ebscohost.com/login.aspx?direct=true&db=rfh&AN=ATLA0001412625&site=ehost-live,
"Review of Powers and Submissions: Spirituality, Philosophy, and Gender",http://www.jstor.org/stable/4139891,
"Questioning ""Woman"" in Feminist/Womanist Theology: Irigaray, Ruether and Daly",,
Jacques Derrida on Religion,,
"'The End of Man: Foucault, Derrida, and the Auto-Bio-Graphical'",,
Bodily citations: religion and Judith Butler,,
Artful Self-Reflection as Bio-medical Intervention: Some Theological Musings,http://ebookcentral.proquest.com/lib/vand/detail.action?docID=5325025,
"Justice for Alan Kurdi? Philosophy, Photography, and the (Cosmo)Politics of Life and Death - ProQuest",https://www.pdcnet.org/collection/authorizedshow?id=philtoday_2019_0999_8_1_267&pdfname=philtoday_2019_0999_8_1_267.pdf&file_type=pdf&googlescholar=true,
"Performative, Queer Theories of Religion: Judith Butler",,
Transing the Study of Religion: A (Christian) Theological Response,https://www.jstor.org/stable/10.2979/jfemistudreli.34.1.07,
"For Inspiration, Look Not in Obvious Places",,
Review: Feminist Theory and Christian Theology: Cartographies of Grace,https://doi.org/10.1093/jaar/71.1.212,
The private lives of women in Persian Egypt,,
An Achaemenid Loanword in the Legal Code of Hermopolis: 3bykrm,,
Un giuramento ebraico ad Elefantina d’Egitto,,
Women and Property in Persian Egypt and Mesopotamia,https://archive.chs.harvard.edu/CHS/article/display/1304,
"From the Persepolis Fortification Archive Project, 5:	The Aramaic Epigraph ns(y)ḥ on Elamite Persepolis Fortification Documents",www.achemenet.com/pdf/arta/ARTA_2015.004-Azzoni-Stolper.pdf,
"Review of Filologia storica della Bibbia ebraica. Vol. 1, Da Origene al Medioevo; Filologia storica della Bibbia ebraica. Vol. 2, Dall'età moderna ai nostri giorni",http://search.ebscohost.com/login.aspx?direct=true&db=rfh&AN=ATLA0001482176&site=ehost-live,
The Bowman MS and the Aramaic Tablets,http://www.academia.edu/6805494/The_Bowman_MS_and_the_Aramaic_Tablets,
Persepolis Fortification Aramaic Tablet Seal 0002 and the Keeping of Horses,,
Women at Elephantine and Women in the Land,,
Elephantine Papyri,,
Where Will Yehoyišmaʿ Go?: A Reconsideration of TAD B3.8,,
A Demotic Tablet or Two in the Persepolis Fortification Archive,http://www.achemenet.com/pdf/arta/ARTA_2019_003_Azzoni.pdf,
From Mari to Jerusalem and back: Assyriological and Biblical studies in honor of Jack Murad Sasson,,
The Empire as Visible in the Aramaic Documents from Persepolis,https://catalog.library.vanderbilt.edu/discovery/fulldisplay/WorldCat1197391350/01VAN_INST:vanui,
Betraying the Text: Their Creation Story and Ours,https://catalog.library.vanderbilt.edu/discovery/fulldisplay/WorldCat920832598/01VAN_INST:vanui,
"Persepolis Administrative Archives: two groups of clay tablets, fragments, and sealings produced and stored by administrative agencies based at Persepolis",http://www.iranicaonline.org/articles/persepolis-admin-archive,
Marriage and Divorce: Hebrew Bible”,,
Family Life and Law at Elephantine,http://ebookcentral.proquest.com/lib/vand/detail.action?docID=6935234,
PFAT 783: fruit and the bazikara,http://ebookcentral.proquest.com/lib/vand/detail.action?docID=6533486,
Comeback Cities: A Blueprint for Urban Neighborhood Revival,,
Black Intimacies: A Gender Perspective on Families and Relationships,,
"Thomas, Clarence (1948- )",,
Kwanzaa,,
Malcolm X (1925-1965),,
One-Drop Rule,,
"Parks, Rosa (1913- )",,
Race Matters,,
Racial Difference in Poverty Rate,,
Racial Ghettoes,,
Redlining,,
"Douglass, Frederick (1817-1895)",,
"Farrakhan, Louis (1933- )",,
Culture of Poverty Thesis,,
Repositioning race: prophetic research in a post-racial Obama age,,
"The cost of being poor: a comparative study of life in poor urban neighborhoods in Gary, Indiana",,
Black mother-daughter narratives about sexuality : the influence of black religious symbolism on attitudes and behavior,,
Live long and prosper: how Black megachurches address HIV/AIDS and poverty in the age of prosperity theology,,
Subverting the power of prejudice: resources for individual and social change,,
On the market: strategies for a successful academic job search,,
The effect of child care on employment tardiness and absences for mothers: does marital status matter?,,
"Positive Homeownership Attitudes, Homeownership Behavior, and Neighborhood Ties in Poor Urban Neighborhoods",,
Achievement or Ascription Ideology? An Analysis of Attitudes about Future Success for Residents in Poor Urban Neighborhoods,http://search.proquest.com/socabs/docview/60448412/87F29F70DDF54883PQ/1?accountid=14816,
"Too Poor to Get Sick? The Implications of Place, Race, and Costs on the Health Care Experiences of Residents in Poor Urban Neighborhoods",http://search.proquest.com/socabs/docview/60549870/C6BEB668113C48A1PQ/30?accountid=14816,
A Case Study of the Working Poor Single Mother Experience: An Analysis of the Structure versus Agency Discourse,http://search.proquest.com/socabs/docview/61740966/C6BEB668113C48A1PQ/27?accountid=14816,
The Least of These: Black Church Children's and Youth Outreach Efforts,http://search.proquest.com/socabs/docview/61763270/C6BEB668113C48A1PQ/26?accountid=14816,
Practicing What You Preach: An Analysis of Racial Attitudes of Two Christian Churches,http://search.proquest.com/socabs/docview/61510113/C6BEB668113C48A1PQ/25?accountid=14816,
Debunking Deficiency Theories: Evaluating Non-Traditional Attitudes and Behavior among Residents in Poor Urban Neighborhoods,http://search.proquest.com/socabs/docview/60398696/C6BEB668113C48A1PQ/24?accountid=14816,
"Stressors and Strengths: A Theoretical and Practical Examination of Nuclear, Single-Parent, and Augmented African American Families",http://search.proquest.com/socabs/docview/60077677/C6BEB668113C48A1PQ/23?accountid=14816,
"The ""American Dream"" in Poor Urban Neighborhoods: An Analysis of Home Ownership Attitudes and Behavior and Financial Saving Behavior",http://search.proquest.com/socabs/docview/60467904/C6BEB668113C48A1PQ/21?accountid=14816,
The Ebonics Enigma: An Analysis of Attitudes on an Urban College Campus,http://search.proquest.com/socabs/docview/60482598/C6BEB668113C48A1PQ/20?accountid=14816,
Determinants of Individual Neighborhood Ties and Social Resources in Poor Urban Neighborhoods,http://search.proquest.com/socabs/docview/60463972/C6BEB668113C48A1PQ/19?accountid=14816,
"The Clustering of Poor Urban, Chicago Residents: An Empirical Analysis of Social Differentiation",http://search.proquest.com/socabs/docview/61749106/C6BEB668113C48A1PQ/18?accountid=14816,
An Analysis Of Black Church Usage Of Black Liberation And Womanist Theologies: Implications For Inclusivity,http://search.proquest.com/socabs/docview/61689150/C6BEB668113C48A1PQ/17?accountid=14816,
An Intra-Ethnic Analysis of Social Affiliations Among Latinos in the United States,http://search.proquest.com/socabs/docview/61631087/C6BEB668113C48A1PQ/16?accountid=14816,
Enter into His Gates: An Analysis of Black Church Participation Patterns,http://search.proquest.com/socabs/docview/61739556/C6BEB668113C48A1PQ/15?accountid=14816,
Welfare and Women in Poor Urban Neighborhoods: The Effect of Dependency on Attitudinal Indicators,http://search.proquest.com/socabs/docview/60394082/C6BEB668113C48A1PQ/14?accountid=14816,
Ebonics and Public Awareness: Who Knows? Who Cares?,http://search.proquest.com/socabs/docview/61561240/C6BEB668113C48A1PQ/11?accountid=14816,
"Attitudes, Behavior, and Social Networks in Poor Urban Neighborhoods: Challenges for More Comprehensive Research and Teaching",http://search.proquest.com/socabs/docview/61749955/C6BEB668113C48A1PQ/10?accountid=14816,
Priestly and Prophetic Influences on Black Church Social Sciences,http://search.proquest.com/socabs/docview/60103498/C6BEB668113C48A1PQ/9?accountid=14816,
Black Church Culture and Community Action,http://search.proquest.com/socabs/docview/60050515/C6BEB668113C48A1PQ/8?accountid=14816,
"Theological, Denominational, and Organizational Influences on Ecumenical Involvement between Black and White Churches",http://search.proquest.com/socabs/docview/754039710/C6BEB668113C48A1PQ/6?accountid=14816,
Black on the Block: The Politics of Race and Class in the City,http://search.proquest.com/socabs/docview/59968119/C6BEB668113C48A1PQ/5?accountid=14816,
Streets of Glory: Church and Community in a Black Urban Neighborhood,http://search.proquest.com/socabs/docview/60103847/C6BEB668113C48A1PQ/4?accountid=14816,
The Black Family: Essays and Studies (6th edition),http://search.proquest.com/socabs/docview/60459006/C6BEB668113C48A1PQ/2?accountid=14816,
Black megachurch culture: models for education and empowerment,,
Whosoever will let her come: social activism and gender inclusivity in the Black church,,
Then and now: a comparative analysis of the urban black church in America,http://search.ebscohost.com/login.aspx?direct=true&db=rfh&AN=ATLA0001338668&site=ehost-live,
Du Bois on religion,,
"Religion in the lives of African Americans: social, psychological, and health perspectives",,
Religion and rap music: an analysis of Black church usage,http://search.ebscohost.com/login.aspx?direct=true&db=rfh&AN=ATLA0001656609&site=ehost-live,
Black church sponsorship of economic programs: a test of survival and liberation strategies,http://search.ebscohost.com/login.aspx?direct=true&db=rfh&AN=ATLA0001929171&site=ehost-live,
Black Family Instability Thesis,,
"""Black English"" (Ebonics)",,
American Dream Ideology,,
A Sociological Examination of Du Bois's The Souls of Black Folk,http://www.princeton.edu/~jweisenf/northstar/volume6/barnes.html,
Black Church Culture: How Clergy Frame Social Problems and Solutions,,
Chinese Megachurch Persecution: Application of an Indigenous Resource Framework,http://redfame.com/journal/index.php/ijsss/article/view/12,
Voices among the Vulnerable: An Analysis of Native American Newspaper Articles,,
"To Welcome or Affirm: Black Clergy Views About Homosexuality, Inclusivity, and Church Leadership",http://dx.doi.org/10.1080/00918369.2013.819204,
Ghetto,http://go.galegroup.com/ps/i.do?id=GALE%7CCX3045300923&v=2.1&u=nash87800&it=r&p=GVRL&sw=w&asid=405870010d237644dc0401ebb7d4020e,
An Examination of the Sexual Behavior of Middle-Class African American Female College Freshmen,http://www.jstor.org/stable/10.5406/blacwomegendfami.4.2.0001,
Romantic and Familial Relationships with Black Males:,http://www.jstor.org/stable/10.5406/blacwomegendfami.3.2.0001,
Black Megachurches: Social Gospel Usage and Community Empowerment,http://search.proquest.com/socabs/docview/1364699999/C6BEB668113C48A1PQ/35?accountid=14816,
Abolitionist Movement,,
"""The alpha and omega of our people"" : a sociological examination of the promise and problems of the contemporary Black church",,
Religion and Rap Music: An Analysis of Black Church Usage,,
The Black Church Revisited: Toward a New Millennium DuBoisian Mode of Inquiry,http://socrel.oxfordjournals.org/content/early/2014/09/15/socrel.sru056,
The Influence of Black Church Culture: How Black Church Leaders Frame the HIV/AIDS Discourse,https://irstudies.org/index.php/jirs/article/view/33,
Black Church Giving,http://sgo.sagepub.com/content/3/2/2158244013490706,
"To Educate, Equip, and Empower: Black Church Sponsorship of Tutoring or Literary Programs",http://link.springer.com/article/10.1007/s13644-014-0173-2,
Black Church Electoral and Protest Politics from 2002 to 2012: a Social Media Analysis of the Resistance Versus Accommodation Dialectic,http://link.springer.com/article/10.1007/s12111-013-9263-4,
Is Motherhood Important? Imprisoned Women’s Maternal Experiences Before and During Confinement and Their Postrelease Expectations,http://fcx.sagepub.com/content/9/1/3,
Exiles in a Foreign Land A Comparative Analysis of the Historical Role of Religion for African Americans and Irish Immigrants,http://has.sagepub.com/content/early/2014/12/05/0160597614560567,
"Gary, Indiana: A Tale of Two Cities",,
Youth ministry in the Black church: centered in hope,,
"Where ‘Difference is the Norm’: Exploring Refugee Student Ethnic Identity Development, Acculturation, and Agency at Shaw Academy",http://jrs.oxfordjournals.org/content/early/2014/02/12/jrs.fet050,
"Toward a History of Slavery in Small Places: Agrarian Diversity, Demographic Expansion, and Economic Stability in Fajardo, Puerto Rico, 1812-1838",http://search.proquest.com/socabs/docview/61660431/C6BEB668113C48A1PQ/36?accountid=14816,
The Negro Church: An Introduction,,
"Private Regard, Identity Protection and Perceived Racism among African American Males",http://search.proquest.com/socabs/docview/61760846/C6BEB668113C48A1PQ/37?accountid=14816,
"Observing Privilege: Examining Race, Class, and Gender in Health and Human Service Organizations",,
Mothering While Imprisoned: The Effects of Family and Child Dynamics on Mothering Attitudes,http://onlinelibrary.wiley.com/doi/10.1111/j.1741-3729.2011.00696.x/abstract,
"Competition, Race, and the Measurement of Female Labor Activity",http://search.proquest.com/socabs/docview/60493258/C6BEB668113C48A1PQ/34?accountid=14816,
"Carmichael, Stokely (1941-1998)",,
Blaming-the-Victim Argument,,
"Black sexualities: probing powers, passions, practices, and policies",,
