Title,Url,yes/no
The psychopathology of everyday Vienna: Psychoanalysis and Freud's familiars,http://onlinelibrary.wiley.com.proxy.library.vanderbilt.edu/doi/10.1516/QDNQ-D1F4-99CE-JUEF/abstract,
Spinoza's Election of the Jews: The Problem of Jewish Persistence,http://www.jstor.org.proxy.library.vanderbilt.edu/stable/4467723,
'A State within a State': Freud's Disavowal of Anti-Semitism,,
Eidola or Eidechsen? Kafka Asks Brod Asks Kraus Asks Heine a Jewish Question,,
Leaping Lizards Max: Kafka Asks Brod Asks Kraus Asks Heine a Jewish Question: and Not Judith Butler's,http://www.studienverlag.at/page.cfm?vpath=buecher/buchdetail&bookclass=&titnr=%205089,
"Gifting the other, or why are nineteenth-century German bourgeois men acting like Trobriand Islanders?",http://crr.sagepub.com/content/1/3/293,
Feminine Soul: the Fate of an Ideal,http://search.ebscohost.com/login.aspx?direct=true&db=rfh&AN=ATLA0000546704&site=ehost-live,
"Disciplines of faith : studies in religion, politics and patriarchy",,
Dual Allegiance: Freud as a Modern Jew,http://search.ebscohost.com/login.aspx?direct=true&db=rfh&AN=ATLA0000315685&site=ehost-live,
"Idols, Fetishes and Foreskins : The Other of Religion",,
"Identifying ""Someone Who Is Himself One of Them"" : Recent Studies of Freud's Jewish Identity",http://search.ebscohost.com/login.aspx?direct=true&db=rfh&AN=ATLA0001027396&site=ehost-live,
"The Godfather of Psychoanalysis : Circumcision, Antisemitism, Homosexuality, and Freud's ""Fighting Jew""",http://search.ebscohost.com/login.aspx?direct=true&db=rfh&AN=ATLA0000995503&site=ehost-live,
Trauma,,
En jeu: Lincoln logs or pick-up sticks,http://search.ebscohost.com/login.aspx?direct=true&db=rfh&AN=ATLA0001521481&site=ehost-live,
The death of Sigmund Freud: the legacy of his last days,http://search.ebscohost.com/login.aspx?direct=true&db=rfh&AN=ATLA0001682260&site=ehost-live,
"Betrayal of spirit: Jew-hatred, the Holocaust, and Christianity",http://search.ebscohost.com/login.aspx?direct=true&db=rfh&AN=ATLA0001699977&site=ehost-live,
"Contested rituals: circumcision, kosher butchering, and Jewish political life in German, 1843-1933",,
Jewish women in fin de siècle Vienna,,
The philosopher as witness: Fackenheim and responses to the Holocaust,http://search.ebscohost.com/login.aspx?direct=true&db=rfh&AN=ATLA0001790637&site=ehost-live,
The other Jewish question: identifying the Jew and making sense of modernity,,
"Roots of theological anti-Semitism: German biblical interpretation and the Jews, from Herder and Semler to Kittel and Bultmann",http://search.ebscohost.com/login.aspx?direct=true&db=rfh&AN=ATLA0001821755&site=ehost-live,
Table Dancing in an Opium Den: Marx’s Conjuration of Criticism out of “Criticism of Religion” in 1844,http://booksandjournals.brillonline.com.proxy.library.vanderbilt.edu/content/journals/10.1163/15700682-12341263,
Tolerating Prejudice,,
"Hegel, Schlegel, and the Sexual Division of Labor",,
"The Aromatics of Jewish Difference: Or, Benjamin's Allegory of Aura",,
Un avenir sans Juifs. Les écrits prézionists du jeune Nordau,,
Circumcision and Jewish Women's Identity: Rahel Levin Varnhagen's Failed  Assimilation,,
Teaching about Language and the Holocaust,,
Teaching Film in the Holocaust Curriculum,,
Freud and/as a Jew in the Multicultural University,,
"Freud, Blüher, and the Secessio Inversa: Männerbünde, Homosexuality, and Freud's  Theory of Cultural Formation",,
Fetishism,,
"It’s ‘Alimentary’: Feuerbach, and the Dietetics of Antisemitism",,
"Hairy Heine, or the Braiding of Gender and Ethnic Difference",,
"The Queerest Cut of All: Freud, Beschneidung, Homosexualität und maskulines  Judentum",,
"Kafka’s ‘Schakale und Araber’ and the Question of Genre: ‘Gleichnis,’ ‘Tiergeschichte,’ or ‘dialektisches Bild’?",,
On Freud's Jewish body : mitigating circumcisions,,
"A Paleontological View of Freud's Study of Religion: Unearthing the ""Leitfossil"" Circumcision",http://www.jstor.org.proxy.library.vanderbilt.edu/stable/1396484,
Sigmund Freud,http://www.degruyter.com/view/product/20285,
"Review of Kaplan, Marion; Meyer, Beate, Jüdische Welten: Juden in Deutschland vom 18. Jahrhundert bis in die Gegenwart",http://www.h-net.org/reviews/showrev.php?id=12399,
"Review of Hollander, Dana, Exemplarity and Chosenness: Rosenzweig and Derrida on the Nation of Philosophy",http://www.h-net.org/reviews/showrev.php?id=24044,
"Review of Bilski, Emily D.; Braun, Emily, Jewish Women and Their Salons: The Power of Conversation",http://www.h-net.org/reviews/showrev.php?id=12398,
"Steven Beller, Antisemitism: A Very Short Introduction",http://go.galegroup.com/ps/i.do?id=GALE%7CA189052040&v=2.1&u=tel_a_vanderbilt&it=r&p=AONE&sw=w&asid=84a09ab722516b9259f1e9489f9a39d8,
"Not a Geist of a chance: laying to rest an ""unlaid ghost""?",http://go.galegroup.com/ps/i.do?id=GALE%7CA179387802&v=2.1&u=tel_a_vanderbilt&it=r&p=AONE&sw=w&asid=a6ab019922bcc916891ac2f94fe2af44,
The Rites of Responsibility: The Cinematic Rhetoric of Claude Lanzmann's Shoah (1985),,
The unmanning of the Wandering Jew,http://go.galegroup.com/ps/i.do?id=GALE%7CA12519772&v=2.1&u=tel_a_vanderbilt&it=r&p=AONE&sw=w&asid=86f67fb4d8c994e278fa242ea2ca4eaa,
(G)nos(e)ology : the cultural construction of the other,,
Film and the Teaching of the Holocaust,http://rsnonline.org/indexc2e4.html?option=com_content&view=article&id=1110&Itemid=1226,
Sigmund Freud und die Religion: Überlegungen zum Verhältnis von psychoanalytischem Denken und jüdischem Glauben,,
The Wilkomirski Case: Fragments or Figments?,http://muse.jhu.edu/journals/american_imago/v059/59.3geller01.html,
"On Eliza Slavet’s ‘Freud’s Theory of Jewishness,’",http://divinity.uchicago.edu/religion-and-culture-web-forum-archive-20112010,
Blood Sin: Syphilis and the Construction of Jewish Identity,,
Bestiarium Judaicum:  unnatural histories of the Jews,,
Postmemories of the Holocaust,,
Genocide in Jewish Thought by David Patterson (review),https://muse.jhu.edu/article/554206,
"Kafka’s ‘Schakale und Araber’ and the Question of Genre: ‘Gleichnis,’ ‘Tiergeschichte,’ or ‘dialektisches Bild’",https://www.degruyter.com/document/doi/10.1515/9783110339109.124/html?lang=en,
Freud v. Freud: Freud's Readings of the Denkwürdigkeiten eines Nervenkranken,,
Feuerbach on Religion,,
Reading Freud's Reading,http://proxy.library.vanderbilt.edu/login?url=http://search.ebscohost.com/login.aspx?direct=true&db=nlebk&AN=48398&site=ehost-live,
Jewish identification and critical theory: The political significance of conceptual categories,http://crr.sagepub.com/content/2/2/165,
‘Der Volf’ or the Jew as Out(side of the)law,,
"""A Horse is a Horse, Of Course, Of Course,"" or Some Nagging Suspicions about Some Jewish Writers",http://proxy.library.vanderbilt.edu/login?url=http://search.ebscohost.com/login.aspx?direct=true&db=rlh&AN=136244728&site=ehost-live&scope=site,
Hitler's Monsters: A Supernatural History of the Third Reich. By Eric Kurlander.,http://www.cambridge.org/core/journals/central-european-history/article/hitlers-monsters-a-supernatural-history-of-the-third-reich-by-eric-kurlander-new-haven-ct-yale-university-press-2017-pp-xxii-422-cloth-3500-isbn-9780300189452-paper-2000-isbn-9780300234541/86C1DC6C9A1E5D81D9EC6209245A1E16,
Long Contact with Significations,http://public.eblib.com/choice/PublicFullRecord.aspx?p=6176733,
Space and Spatiality in Modern German-Jewish History eds. by Simone Lässig and Miriam Rürup (review) - ProQuest,https://search-proquest-com.proxy.library.vanderbilt.edu/docview/2130840504/33A9B14B7D374025PQ/30?accountid=14816,
The Jewish Animot: Of Jews As Animals,,
"""Of snips... and puppy dog tails"": Freud's sublimation of 'Judentum'",https://www.jstor.org/stable/26305495#metadata_info_tab_contents,
"Review of Glorious, Accursed Europe. An Essay on Jewish Ambivalence (Tauber Institute Series for the Study of European Jewry)",https://www.jstor.org/stable/41303780,
Preface,https://www.jstor.org/stable/26304675,
The Discipline of Philosophy and the Invention of Modern Jewish Thought by Willi Goetschel (review),,
The Jewish Animot: Of Jews As Animals,,
"'Odradek: Judeophobia and Other Sorgen' (Feeling Beyond the Human: Animals, AI, Machines",,
A Genealogy of How He Changed His Mind or Not,,
Circumcision and Male Jewish Survival during the Holocaust” (XX Century: “If this is a woman…”,,
"‘Only an animal’: Antisemitism, Racism, and the Human-Animal Great Divide",,
"Jay Geller, “Bestiarium Judaicum: Unnatural Histories of the Jews” (Fordham UP, 2017)",https://newbooksnetwork.com/jay-geller-bestiarium-judaicum-unnatural-histories-of-the-jews-fordham-up-2017,
Hitler's monsters: a supernatural history of the Third Reich,https://search.ebscohost.com/login.aspx?direct=true&scope=site&db=nlebk&db=nlabk&AN=1527319,
Space and Spatiality in Modern German-Jewish History,http://ebookcentral.proquest.com/lib/vand/detail.action?docID=4873541,
"""A Horse is a Horse, Of Course, Of Course,"" or Some Nagging Suspicions about Some Jewish Writers",http://proxy.library.vanderbilt.edu/login?url=http://search.ebscohost.com/login.aspx?direct=true&db=rlh&AN=136244728&site=ehost-live&scope=site,
Authorial Intentions,https://www.library.vanderbilt.edu/divinity/faculty-staff/interviews/authorialintentions.php,
Bestiarium Judaicum,,
Circumcision and Male Jewish Survival during the Holocaust,,
"A Puerto Rican Decolonial Theology: Prophesy Freedom, by Teresa Delgado. Palgrave McMillan, 2017. xv + 204 pages. $99.99.",https://perspectivasonline.com/books/a-puerto-rican-decolonial-theology-prophesy-freedom-by-teresa-delgado-palgrave-mcmillan-2017-xv-204-pages-99-99-2/,
"Ariel, just fighting to get above water…by Yara González-Justiniano",https://feminismandreligion.com/2019/03/12/ariel-just-fighting-to-get-above-waterby-yara-gonzalez-justiniano/,
Book Review: God and Community Organizing: A Covenantal Approach by Hak Joon Lee,https://doi.org/10.1177/00405736211062842b,
"Just traveling: God, leaving home, and a spirituality for the road",,
A Brief Pastoral Topography for Migrating People,https://doi.org/10.1007/s11089-022-01010-6,
Pastoral care and an imago Dei for the Technological Age,,
The Image of God: A Theology for Pastoral Care and Counseling,http://proxy.library.vanderbilt.edu/login?url=http://search.ebscohost.com/login.aspx?direct=true&db=rfh&AN=ATLA0000330562&site=ehost-live,
Book Review: Transforming Spirituality: Integrating Theology and Psychology,http://search.proquest.com/docview/202734004/abstract/5254B26F3D1341FFPQ/15,
A Review of Kirk A. Bingaman’s The Power of Neuroplasticity for Pastoral and Spiritual Care,http://link.springer.com/article/10.1007/s11089-015-0668-y,
The Church and the Crisis of Community: A Practical Theology of Small-Group Ministry by Theresa F. Latini,http://ttj.sagepub.com/content/70/3/351,
On Getting away with It: Jesus and the Temptation in the Desert,http://link.springer.com/article/10.1007/s11089-013-0511-2,
"The Rod of Discipline: Masochism, Sadism, and the Judeo-Christian Religion",https://link.springer.com/article/10.1023/A:1010356918097,
When steeples cry : leading congregations through loss and change,,
Resistance to Women in Ministry and the Psychodynamics of Sadness,http://link.springer.com/article/10.1007/s11089-010-0299-2,
Revisiting Forgiveness as a Pastoral Theological “Problem”,http://link.springer.com/article/10.1007/s11089-012-0435-2,
Becoming a pastor : forming self and soul for ministry,,
A play-full life : slowing down and seeking peace,,
Seeing Things Differently and Not Being Looked At,http://link.springer.com/article/10.1007/s11089-009-0237-3,
Playing,,
Self-care and community,,
Don't and can't get up: Serious depression,,
The search to be real: Why psychotherapists become therapists,https://link.springer.com/article/10.1023/A:1012516915840,
Review of : Doing theology in context : South African perspectives,,
Cura Vitae: The Cure of Life and the Search to be Real,https://www.acpe.edu/ACPE/Psychotherapy/Sacred_Spaces_Archive/ACPE/Psychotherapy/SacredSpacesArchive.aspx?hkey=518c5a22-8bd1-490c-8d54-0066edb84f5b,
The Memory of Feeling: Envy and Happiness,http://link.springer.com/article/10.1007/s11089-013-0555-3,
"Calvinism, Donald Woods Winnicott, Masochism, and Protestantism",,
Paranoia,,
Religious  metaphors and symbols in a psychiatric setting,,
"Review of : Lament: Reclaiming Practices in Pulpit, Pew, and Public Square.",https://journals.sagepub.com/doi/abs/10.1177/002096430606000339,
"Becoming a pastor: forming self and soul for ministry / Cole, Allan Hugh.",,
"The Organ of Tactility: Fantasy, Image, and Male Masturbation",https://link.springer.com/article/10.1007/s11089-017-0797-6,
Growing down:  theology and human nature in the virtual age,,
Foreword,,
The millennial narrative participant guide: sharing a good life,,
The millennial narrative: sharing a good life with the next generation,,
"Being a Chaplain: call, conversation and charity",https://repository.westernsem.edu/pkp/index.php/rr/article/view/10,
"Proper 18, Twenty-Third Sunday in Ordinary Time: September 7, 2008",http://proxy.library.vanderbilt.edu/login?url=http://search.ebscohost.com/login.aspx?direct=true&db=lsdar&AN=ATLAiC9Y160711001758&site=ehost-live&scope=site,
"Proper 19, Twenty-Fourth Sunday in Ordinary Time: September 14, 2008",http://proxy.library.vanderbilt.edu/login?url=http://search.ebscohost.com/login.aspx?direct=true&db=lsdar&AN=ATLAiC9Y160711001759&site=ehost-live&scope=site,
"Proper 20, Twenty-Fifth Sunday in Ordinary Time: September 21, 2008",http://proxy.library.vanderbilt.edu/login?url=http://search.ebscohost.com/login.aspx?direct=true&db=lsdar&AN=ATLAiC9Y160711001760&site=ehost-live&scope=site,
"Proper 21, Twenty-Sixth Sunday in Ordinary Time: September 28, 2008",http://proxy.library.vanderbilt.edu/login?url=http://search.ebscohost.com/login.aspx?direct=true&db=lsdar&AN=ATLAiC9Y160711001761&site=ehost-live&scope=site,
Reclaiming caritas in a hyper-masculine world: a response to Dr. Rivera-Pagán's Doing pastoral theology in a post-colonial context: some observations from the Caribbean,http://proxy.library.vanderbilt.edu/login?url=http://search.ebscohost.com/login.aspx?direct=true&db=lsdar&AN=ATLA0001681181&site=ehost-live&scope=site,
Remembering the Dismembered: Teaching for Transformation and Restoration,https://doi.org/10.1080/10649867.2006.11745277,
The church is a house of mourning,https://repository.westernsem.edu/pkp/index.php/rr/article/view/1478,
Towards a Postmodern Methodology for Pastoral Counseling,,
Developing a capacity for concern: the Million Man March as transitional object,,
Fragile connections: memoirs of mental illness for pastoral care professionals,http://proxy.library.vanderbilt.edu/login?url=http://search.ebscohost.com/login.aspx?direct=true&db=lsdar&AN=ATLA0001692992&site=ehost-live&scope=site,
Open-hearted ministry: play as key to pastoral leadership,http://proxy.library.vanderbilt.edu/login?url=http://search.ebscohost.com/login.aspx?direct=true&db=lsdar&AN=ATLA0001747846&site=ehost-live&scope=site,
The church and the crisis of community: a practical theology of small-group ministry,http://proxy.library.vanderbilt.edu/login?url=http://search.ebscohost.com/login.aspx?direct=true&db=lsdar&AN=ATLAn3771816&site=ehost-live&scope=site,
Toys: a Man Has His Reasons. Winnicottian Perspectives on the Playing of Men,https://doi.org/10.1007/s11089-021-00937-6,
The Psychodynamics of Conversion: Winnicottian Perspectives on the Transformation of Job,https://doi.org/10.1007/s11089-020-00910-9,
The Cultivation of Technological Intelligence,https://doi.org/10.1177/1542305020905541,
"Podcast: ""Religion and Politics in the 2008 Election: A Look into the Future""",,
"Race, Religion and Politics: Evangelicals, Conservatives and Liberals Look for Common Ground",,
Review of Mrs. Russell Sage: Women's activism and philanthropy in Gilded Age and Progressive Era America,,
"Review of Original sin and everyday protestants: The theology of Reinhold Niebuhr, Billy Graham, and Paul Tillich in an age of anxiety",,
Ecumenical Protestantism’s Battle for Hearts and Knees – By James Hudnut-Beumler,https://themarginaliareview.com/ecumenical-protestantisms-battle-hearts-knees/,
History of Christianity » Blog Archive » New Books in Religious History: Hudnut-Beumler’s In Pursuit of the Almighty’s Dollar,http://www.churchhistory.org/blogs/blog/new-books-in-religious-history-hudnut-beumlers-in-pursuit-of-the-almightys-dollar/,
"Review of Friends of the unrighteous mammon: Northern Christians and Market Capitalism, 1815–1860.",,
"Church and State at the Turn of the Century: Missions and Imperialism, Bureaucratization, and War, 1898-1920",,
"America Emerges as a World Power: Re ligion, Politics and Nationhood, 1940-1960",,
Tradition and Change: Curricular Trends in the Recent History of Theological Education,,
American churches and U.S. interventionism,,
The Church in North America,,
Economy and Christianity: Economic studies of the history of Christianity in the United States,,
Suburbanization and religion,https://www.cambridge.org/core/books/abs/cambridge-history-of-religions-in-america/suburbanization-and-religion/2B4D49DBC3444E7DF24096EF4863D272,
Economics,,
Market models for understanding religion,,
"Review of Between Athens and Berlin: The Theological Education Debate; By David H. Kelsey; Grand Rapids, Eerdmans, 1993. 235 pp. $18.99",,
"Review of Houses of God: Region, Religion, and Agriculture in the United States",http://search.proquest.com/docview/229943146/55F10A605F6C47A0PQ/32?accountid=14816,
Myths and Realities in the Financing of American Religion,,
The history of the Riverside Church in the city of New York,,
Protestants and giving: The tithes that bind?,https://onlinelibrary.wiley.com/doi/abs/10.1002/pf.41219950707,
Presbyterian Church (USA) decision expands the meaning and malleability of marriage,http://theconversation.com/presbyterian-church-usa-decision-expands-the-meaning-and-malleability-of-marriage-39207,
Christianity in the United States Since 1900,https://rowman.com/ISBN/9781442244320/Encyclopedia-of-Christianity-in-the-United-States-5-Volumes,
James Hudnut-Beumler on Religion in the Now South,http://www.researchonreligion.org/christianity/james-hudnut-beumler-on-religion-in-the-now-south,
Review of A History of Religion in America: From the First Settlements through the Civil War (Vol. 1) and From The End of The Civil War to the Twenty-First Century (Vol 2),http://readingreligion.org/books/history-religion-america,
"Review of Hard, Hard Religion: Interracial Faith in the Poor South, HayesJohn",https://www.jstor.org/stable/26538024,
"Review of Religion, Art, and Money: Episcopalians and American Culture from the Civil War to the Great Depression",http://readingreligion.org/books/religion-art-and-money,
Review of Surge of Piety: Norman Vincent Peale and the Remaking of American Religious Life,http://onlinelibrary.wiley.com/doi/abs/10.1111/hisn.12942,
Strangers and friends at the welcome table: contemporary Christianities in the American South,,
"""Strangers and Friends at the Welcome Table""",http://page99test.blogspot.com/2018/05/james-hudnut-beumlers-strangers-and.html,
The future of mainline Protestantism in America,,
More Evidence of a Leaking Ship,,
Work and Faith in the Kentucky Coal Fields: Subject to Dust,http://proxy.library.vanderbilt.edu/login?url=http://search.ebscohost.com/login.aspx?direct=true&db=rlh&AN=47575866&site=ehost-live&scope=site,
“Money  | Christianity  | Modern Europe  and  America“  and  “Moneylending  |  Christianity | Modern  Europe and America”,,
Commentary: Second Thoughts on Biblegate,https://tennesseelookout.com/2020/06/08/commentary-second-thoughts-on-biblegate/,
The story of religion in America: an introduction,,
Afterward,,
Perspective | Why cash remains sacred in American churches,https://www.washingtonpost.com/news/acts-of-faith/wp/2017/07/06/why-cash-remains-sacred-in-american-churches/,
Why cash remains sacred in American churches,http://theconversation.com/why-cash-remains-sacred-in-american-churches-79167,
Book Review of Shaker Fever: America's Twentieth-Century Fascination with a Communitarian Sect,https://doi.org/10.1093/jahist/jaac076,
Book Review of The Puritans : A Transatlantic History,https://readingreligion.org/9780691151397/the-puritans,
Cosmogony and order in the Hebrew tradition,,
The People Called: The Growth of Community in the Bible,http://search.ebscohost.com/login.aspx?direct=true&db=rfh&AN=ATLA0000562305&site=ehost-live,
Revelation through tradition,,
Canon and the history of tradition : a critique of Brevard S Childs' Introduction to the Old Testament as scripture,,
Jeremiah and the dimensions of the moral life,,
Wellhausen and the interpretation of Israel's literature,http://search.ebscohost.com/login.aspx?direct=true&db=rfh&AN=ATLA0000934419&site=ehost-live,
Secret system: a study in the chronology of the Old Testament,http://search.ebscohost.com/login.aspx?direct=true&db=rfh&AN=ATLA0000463263&site=ehost-live,
Prophet und Tradition: Versuch einer Problemstellung,,
"The understanding of ""Sitz im Leben"" in form criticism",,
Humanizing America's iconic book,,
Justice and the holy : essays in honor of Walter Harrelson,,
Rediscovering the traditions of Israel,,
"Law, power, and justice in ancient Israel",,
Tradition and Theology,,
James Barr,,
Tradition History,,
"Reflections on Archaeology, Historiography, and Ancient Israel: A Response to William G.  Dever",,
Politics and Biblical Scholarship in the United States,,
"Hebrews (pp. 273–74); Idols, Idolatry (pp. 297–98)",,
Foreword to the Reprint Edition,,
Erobring og okkupasjon: Krig ifølge Josvaboken,,
"Cosmology (pp. 175–76); Ethics in the Old Testament (pp. 267–70); Family (pp. 294–95);  Genre, Old Testament (pp. 322–23); Sources, Literary (pp. 852–53); Tradition in the Old  Testament (pp. 927–28)",,
Ancient Israelite Cosmology: Images and Evaluations,,
Perspectives on Aging and the Elderly in the Hebrew Bible,http://search.proquest.com/docview/1511966191/4B088B526287454APQ/5?accountid=14816,
James Barr 20 March 1924 · 14 October 2006,http://www.jstor.org.proxy.library.vanderbilt.edu/stable/40541593,
Tradition et Théologie dans l'Ancien Testament,,
Tradition and theology in the Old Testament,,
Academic freedom and the plight of German theological studies,,
Deuteronomy and the Deuteronomists,,
"Herrens bud- elitens interesser? Lov, makt og rettferdighet i Det gamle testamente",,
Village law and the book of the covenant,,
Whose agony? Whose ecstasy? The politics of Deuteronomic law,,
Joshua 22 and the ideology of space,,
The ethics of human life in the Hebrew Bible,,
Discovering Eve: Ancient Israelite Women in Context,http://search.ebscohost.com/login.aspx?direct=true&db=rfh&AN=ATLA0000605472&site=ehost-live,
"La création dans l'Orient ancien: Congrès de l'ACFEB, Lille (1985)",,
The social basis of morality and religion in ancient Israel,,
The Bible and the politics of exegesis : essays in honor of Norman K Gottwald on his sixty-fifth birthday,,
Har gammeltestamentlig tradisjonshistorie en fremtid?,,
Traditio-historical criticism: the development of the Covenant Code,,
Ethics,,
La révélation par la tradition,,
Tradition et  théologie,,
Editors' Preface,,
The Pentateuch,,
The Hebrew Bible and its modern interpreters,,
Rediscovering the traditions of Israel,,
"Rediscovering the traditions of Israel, rev ed",,
Academic Freedom and the Plight of German Theological Studies,,
"Oral Materials, Sources and Traditions",,
Sociology of Law,,
Studies in the Hebrew Bible / Old Testament in the Americas of the Twentieth Century,,
Political Rights and Powers in Monarchic Israel,,
Why study the Bible,http://search.ebscohost.com/login.aspx?direct=true&db=rfh&AN=ATLA0000777329&site=ehost-live,
The meaning of the Bible : what the Jewish scriptures and Christian Old Testament can teach us,,
"Let Justice Roll Down: The Old Testament, Ethics, and Christian Life/Review",https://journals.sagepub.com/doi/abs/10.1177/002096430004800107?journalCode=intc,
Feminist interpretation of the Bible,,
Paul and the Law,http://search.ebscohost.com/login.aspx?direct=true&db=rfh&AN=ATLA0000604011&site=ehost-live,
The Understanding Scribe: Matthew and the Apocalyptic Ideal,http://search.ebscohost.com/login.aspx?direct=true&db=rfh&AN=ATLA0000606417&site=ehost-live,
"Seventy Times Seven: Sin, Judgment, and Forgiveness in Matthew",,
Towards a Feminist Critical Reading of the Gospel according to Matthew,,
No Longer Be Silent: First Century Jewish Portraits of Biblical Women: Studies in Pseudo-Philo's Biblical Antiquities and Josephus's Jewish Antiquities,http://search.ebscohost.com/login.aspx?direct=true&db=rfh&AN=ATLA0000642625&site=ehost-live,
But SHE said: feminist practices of biblical interpretation,http://search.ebscohost.com/login.aspx?direct=true&db=rfh&AN=ATLA0000280479&site=ehost-live,
Women in late antiquity: pagan and Christian lifestyles,http://search.ebscohost.com/login.aspx?direct=true&db=rfh&AN=ATLA0000289601&site=ehost-live,
The New Moses: A Matthean Typology,http://search.ebscohost.com/login.aspx?direct=true&db=rfh&AN=ATLA0000301556&site=ehost-live,
Paul and Hellenism,,
Matthew's Christian-Jewish community,http://search.ebscohost.com/login.aspx?direct=true&db=rfh&AN=ATLA0000308908&site=ehost-live,
Matthew 1-13,http://search.ebscohost.com/login.aspx?direct=true&db=rfh&AN=ATLA0000314474&site=ehost-live,
The Jewish novel in the ancient world,http://search.ebscohost.com/login.aspx?direct=true&db=rfh&AN=ATLA0000325783&site=ehost-live,
Ruth: a commentary,,
The mystery of Romans: the Jewish context of Paul's letter,,
"Review of Luke, Judaism and the scholars: critical approaches to Luke-Acts",,
Jesus and the politics of interpretation,http://search.ebscohost.com/login.aspx?direct=true&db=rfh&AN=ATLA0001477217&site=ehost-live,
