Title,Url,yes/no
The Church in the Power of the Spirit: A Contribution to Messianic Ecclesiology,http://search.ebscohost.com/login.aspx?direct=true&db=rfh&AN=ATLA0000475339&site=ehost-live,
Gott und die Ökonomie des Heiligen Geistes,,
The Holy Spirit and human needs : toward a Trinitarian view of economics,http://search.ebscohost.com/login.aspx?direct=true&db=rfh&AN=ATLA0000780686&site=ehost-live,
Hope and the ministry of planning and management,http://search.ebscohost.com/login.aspx?direct=true&db=rfh&AN=ATLA0000793974&site=ehost-live,
John Wesley's heritage and the future of systematic theology,,
The future of the Methodist theological traditions,,
Political theology and political economy,,
The farm crisis and the rural economy in the perspective of God's economy,http://search.ebscohost.com/login.aspx?direct=true&db=rfh&AN=ATLA0001882457&site=ehost-live,
The Creative Suffering of God,http://search.ebscohost.com/login.aspx?direct=true&db=rfh&AN=ATLA0000580403&site=ehost-live,
Conversion: what shall we teach?,http://search.ebscohost.com/login.aspx?direct=true&db=rfh&AN=ATLA0001880566&site=ehost-live,
The public character of the resurrection,http://search.ebscohost.com/login.aspx?direct=true&db=rfh&AN=ATLA0000837304&site=ehost-live,
Justice : God's Power For Life Against Death,http://search.ebscohost.com/login.aspx?direct=true&db=rfh&AN=ATLA0000919285&site=ehost-live,
Religion and the Ambiguities of Capitalism,http://search.ebscohost.com/login.aspx?direct=true&db=rfh&AN=ATLA0000309287&site=ehost-live,
Jürgen Moltmann's Systematic Contributions to Theology,http://search.ebscohost.com/login.aspx?direct=true&db=rfh&AN=ATLA0001018351&site=ehost-live,
Sanctification and economy : a Wesleyan perspective on stewardship,,
God's Oikonomia and the new world economy,,
Dogmatics as discipleship : the theological journey of Frederick Herzog,,
Wesleyan theology in a postmodern era: the spirit of life in an age of the nihil,http://search.ebscohost.com/login.aspx?direct=true&db=rfh&AN=ATLA0001877060&site=ehost-live,
The household of Jesus Christ in the age of access,,
"A passion for God's reign: theology, Christian learning and the Christian self",,
Proclaiming the gospel: from Guttenberg to cyberspace,,
Being human in the market society,,
The fourth great awakening and the future of egalitarianism,http://search.ebscohost.com/login.aspx?direct=true&db=rfh&AN=ATLA0001353995&site=ehost-live,
Divine economy: theology and the market,http://search.ebscohost.com/login.aspx?direct=true&db=rfh&AN=ATLA0001327906&site=ehost-live,
The market economy and Christian ethics,http://search.ebscohost.com/login.aspx?direct=true&db=rfh&AN=ATLA0001439749&site=ehost-live,
Proclaiming the Lord's favor: preaching on economics in an election year,http://search.ebscohost.com/login.aspx?direct=true&db=rfh&AN=ATLA0001442231&site=ehost-live,
The social Trinity and property,,
The economy of grace: human dignity in the market system,,
"A home for the homeless: vocation, mission, and church in Wesleyan perspective",,
The Babylonian captivity of the church -- the American edition,,
Global neighbors: Christian faith and moral obligation in today's economy,http://search.ebscohost.com/login.aspx?direct=true&db=rfh&AN=ATLA0001786558&site=ehost-live,
The peril of usury in the Christian tradition,http://search.ebscohost.com/login.aspx?direct=true&db=rfh&AN=ATLA0001835650&site=ehost-live,
Economia global & economia de Deus,,
Peace and Justice: The Eucharistic Community of Gifting,http://dx.doi.org/10.1080/0458063X.1996.10392325,
Love: the foundation of hope: the theology of Jürgen Moltmann and Elisabeth Moltmann-Wendel,,
Our calling to fulfill: Wesleyan views of the church in mission,,
Wesleyan perspectives on the new creation,,
In essentials unity: reflections on the nature and purpose of the church: in honor of Frederick R. Trost,,
"Trinity, community, and power: mapping trajectories in Wesleyan theology",,
The portion of the poor: good news to the poor in the Wesleyan tradition,,
What should Methodists teach?: Wesleyan tradition and modern diversity,,
Theology & corporate conscience: essays in honor of Frederick Herzog,,
Christ and Culture Reconsidered: Globalization in the Market Society,http://www.abebooks.com/Christ-Culture-Sino-American-Dialogue-October-23-25/6621216567/bd,
Three lectures on the Theology of Hope,,
Economy and the future of liberation theology in North America,,
The future of theology in a commodity society,,
God's oikonomia and the New World Economy,,
Global economy and the globalization of theological education,,
Globalization and the oikoumene in theological education,,
Liberation theology and the United Church of Christ,,
Love and the hope for a just society,,
The Future of the Methodist Theological Traditions,,
Christian social ethics in a global era,,
The passion for life: a messianic lifestyle,,
Origins of the theology of hope [by] M. Douglas Meeks. Foreword by Jürgen Moltmann,,
Review Essays,http://onlinelibrary.wiley.com/doi/10.1111/j.1748-0922.1996.tb00312.x/abstract,
God the economist: the doctrine of God and political economy,,
Comment,http://dx.doi.org/10.1007/BF02779045,
Gott und Ökonomie: Kann das Gemeinwesen die Freihe it gegenüber dem Diktat der Wirtschaft Züruckgewinnen?,,
Die Zukunft der Theologie in der Gütergesellschaf,,
Human Identity in Christian Faith,,
"On human dignity: political theology and ethics / Meeks, M. Douglas.",,
The experiment hope,,
Introduction to Systematic Theology,,
Economics in the Christian scriptures,,
Gott der Ökonom :  Gotteslehre und politische Ökonomie.,,
Weltgesellschaft aus christlicher Perspektive,,
Foreword,,
Hope for the church : Moltmann in dialogue with practical theology / Jürgen Moltmann with M. Douglas Meeks ... [et al.] ; edited and translated by Theodore Runyon.,,
Hope,,
Foreword,,
Foreword,,
Hanŭnim ŭi kyŏngjehak: sinnon kwa chongchʻikyŏngjehak,,
"La Perpétuité de la Foi: the appeal to Eastern Christianity of Jean Claude's eucharistic polemics, viewed in its French Reformation and Counter Reformation contexts",http://www.tren.com/e-docs/search.cfm?oid=x&action=query&title=Perpetuite,
Women in purple: rulers of medieval Byzantium,http://search.ebscohost.com/login.aspx?direct=true&db=rfh&AN=ATLA0001529483&site=ehost-live,
The evolution of the late antique world,http://search.ebscohost.com/login.aspx?direct=true&db=rfh&AN=ATLA0001529481&site=ehost-live,
The Thousand Lives of Charlemagne: How Medieval Poets Turned a Border Skirmish into a Foundational Medieval Legend,https://www.christianhistoryinstitute.org/magazine/article/thousand-lives-of-charlemagne/,
Charlemagne’s Furniture: Whatever Happened to the Holy Roman Empire,https://www.christianhistoryinstitute.org:443/magazine/article/charlemagnes-furniture/,
‘It is not the custom of our Syriac language…’: Reconsidering the Role of Translation in the Polemics of Philoxenos of Mabbug,,
Philoxenos of Mabbug,http://onlinelibrary.wiley.com/book/10.1002/9781444338386;jsessionid=43D33A5A4F44F765A236E16B43E25577.f02t03,
Philoxenos of Mabbug,,
The sepulchre of Christ and the medieval West: from the beginning to 1600,http://www.cro3.org/content/43/08/43-4611,
Gateway to the heavenly city: crusader Jerusalem and the Catholic West (1099-1187),http://www.cro3.org/content/43/02/43-1127,
"‘Though He cannot be eaten, we consume Him’: Appeals to Liturgical Practice in the Christological Polemic of Philoxenos of Mabbug",,
Introduction to Hugoye 13: A Double Issue on Philoxenos of Mabbug,http://syrcom.cua.edu/Hugoye/Vol13No1/HV13N1Introduction.pdf,
A Bibliographic Clavis to the Works of Philoxenos of Mabbug,http://syrcom.cua.edu/hugoye/Vol13No2/HV13N2Michelson.pdf,
The practical Christology of Philoxenos of Mabbug,,
Irreconcilable Differences? Name Authority Control & Humanities Scholarship,http://hangingtogether.org/?p=2621,
"The Syriac Gazetteer, The Syriac Reference Portal",http://syriaca.org/geo/index.html,
Basil of Caesarea: A Guide to His Life and Doctrine (Book review),,
Philoxenos of Mabbug and the Simplicity of Evagrian Gnosis Competing Uses of Evagrius in the Early Sixth Century,https://www.jstor.org/stable/j.ctvpj7dsk,
Caesarea-Maritima.org,https://caesarea-maritima.org/index.html,
Using Linked Open Data to Model Cultural Heritage Information: The Research Questions and Data Structures of the Syriaca.org Knowledge Graph,http://dlib.nyu.edu/awdl/isaw/isaw-papers/20-10/,
Index of Maps,,
“Online Resources for the Study of the Syriac World,,
“Diachronic Maps of Syriac Cultures and their Geographic Contexts,,
The Hidden Excellence of Lectio Divina: The Ambiguities of Reading as an Elite Marker in East Syrian Monasticism of the Sixth and Seventh Centuries,,
The Rise and Contribution of Monasteries and Monasticism,http://www.vlebooks.com/vleweb/product/openreader?id=none&isbn=9781538124185,
Faith and Community around the Mediterranean: In Honor of Peter R. L. Brown,https://ir.vanderbilt.edu/handle/1803/16320,
Introduction: Dynamics of Faith and Community around the Mediterranean,https://ir.vanderbilt.edu/handle/1803/16324,
“Salutary Vertigo”: Peter R.L. Brown’s Impact on the Historiography of Christianity,https://ir.vanderbilt.edu/handle/1803/16321,
Srophé App,https://srophe.app/,
New Handbook of Syriac Literature,https://syriaca.org/nhsl/index.html,
A Guide to Syriac Authors,https://syriaca.org/authors/index.html,
Qadishe: Guide to the Syriac Saints,https://syriaca.org/q/index.html,
Bibliotheca Hagiographica Syriaca Electronica,https://syriaca.org/bhse/index.html,
Digital Syriac Corpus,https://syriaccorpus.org/index.html,
"e-GEDSH, Gorgias Encyclopedic Dictionary of the Syriac Heritage",https://gedsh.bethmardutho.org/index.html,
Beth Qaṭraye Gazetteer,https://bqgazetteer.bethmardutho.org/index.html,
From manuscript catalogues to a handbook of Syriac literature: Modeling an infrastructure for Syriaca.org,https://jdmdh.episciences.org/1395/pdf,
Using Linked Open Data to Model Cultural Heritage Information: The Research Questions and Data Structures of the Syriaca.org Knowledge Graph,http://dlib.nyu.edu/awdl/isaw/isaw-papers/20-10/,
Mixed Up by Time and Chance? Using Digital Methods to “Re-Orient” the Syriac Religious Literature of Late Antiquity,http://brill.com/view/journals/rmdc/5/1/article-p136_136.xml,
Syriaca.org as a Test Case for Digitally Re-Sorting the Ancient World,https://brill.com/view/book/edcoll/9789004325234/B9789004325234_005.xml,
Philoxenos of Mabbug: A Cappadocian Theologian on the Banks of the Euphrates? | Motions of Late Antiquity,https://www.brepolsonline.net/doi/abs/10.1484/M.CELAMA-EB.5.108243,
Philoxenos of Mabbug and the Simplicity of Evagrian Gnosis: Competing Uses of Evagrius in Early Sixth-Century Polemical Theology,,
Modeling a Body of Literature in TEI: Bibliotheca Hagiographica Syriaca Electronica,http://tei2016.acdh.oeaw.ac.at/poster-gallery,
Encoding Western and Non-Western Names for Ancient Syriac Authors,http://www.balisage.net/Proceedings/vol16/html/Gibson01/BalisageVol16-Gibson01.html,
"Syriaca.org: New Digital Tools for the Study of the Medieval Middle East,",,
"READ THIS BOOK, On Asetical Life – October 2014",https://my.vanderbilt.edu/vanderbiltdivinity/2014/10/read-this-book-october-2014-2/,
Taught by God: teaching and spiritual formation,http://search.ebscohost.com/login.aspx?direct=true&db=rfh&AN=ATLA0001619692&site=ehost-live,
"The ""clerical paradigm"": a fallacy of misplaced concreteness?",http://search.ebscohost.com/login.aspx?direct=true&db=rfh&AN=ATLA0001618967&site=ehost-live,
The Rule of Family Faith: Practicing the Presence of God in Our Outward Lives,http://www.lifelongfaith.com/uploads/5/1/6/4/5164069/lifelong_faith_journal_1.2.pdf,
Wisdom in pastoral care and counseling: what does it entail?,,
Whither the children? Childhood in religious education,http://search.ebscohost.com/login.aspx?direct=true&db=rfh&AN=ATLA0001544416&site=ehost-live,
"Children and religion in the public square: ""too dangerous and too safe, too difficult and too silly""",http://search.ebscohost.com/login.aspx?direct=true&db=rfh&AN=ATLA0001539458&site=ehost-live,
Motherhood as 24/7 Calling: a Cultural Lie We Keep Telling Ourselves,,
Psychology for Christian Ministry,,
"Hitting home: feminist ethics, women's work, and the betrayal of 'family values'",http://search.ebscohost.com/login.aspx?direct=true&db=rfh&AN=ATLA0001524777&site=ehost-live,
Converging on culture: theologians in dialogue with cultural analysis and criticism,http://search.ebscohost.com/login.aspx?direct=true&db=rfh&AN=ATLA0001524759&site=ehost-live,
Family: a Christian social perspective,http://search.ebscohost.com/login.aspx?direct=true&db=rfh&AN=ATLA0000647520&site=ehost-live,
"Seeing Children, Seeing God:  A Practical Theology of Children and Poverty",,
"From Bedlam to Shalom:  Toward a Practical Theology of Human Nature, Interpersonal Relationships and Mental Health Care",,
Everyday knowledge and uncommon truths: women of the academy,,
Feminist studies in psychology: an overview,http://search.ebscohost.com/login.aspx?direct=true&db=rfh&AN=ATLA0000011313&site=ehost-live,
The Ontological Status of God and Other Small Questions,,
"Religion and psychology in transition: psychoanalysis, feminism, and theology",http://search.ebscohost.com/login.aspx?direct=true&db=rfh&AN=ATLA0000357770&site=ehost-live,
Theology and pastoral counseling: a new interdisciplinary approach,http://search.ebscohost.com/login.aspx?direct=true&db=rfh&AN=ATLA0000368517&site=ehost-live,
"Faith, Family, and Feminism : Irreconcilable Differences?",,
Eros for the other: retaining truth in a pluralistic world,http://search.ebscohost.com/login.aspx?direct=true&db=rfh&AN=ATLA0000521767&site=ehost-live,
The arts of ministry: feminist-womanist approaches,http://journals.ptsem.edu/id/PSB1997181/dmd008?page=26,
Religious imagination and the body: a feminist analysis,http://search.ebscohost.com/login.aspx?direct=true&db=rfh&AN=ATLA0000521839&site=ehost-live,
Giving Birth: Reclaiming Biblical Metaphor for Pastoral Practice,,
Will the Real Pro-Family Contestant Please Stand Up?  Another Look at Families and Pastoral Care,http://search.ebscohost.com/login.aspx?direct=true&db=rfh&AN=ATLA0000895199&site=ehost-live,
Representations of Motherhood,http://search.ebscohost.com/login.aspx?direct=true&db=rfh&AN=ATLA0000299260&site=ehost-live,
Reclaiming Space in Contested Terrain: The Role of the Congregation,http://search.ebscohost.com/login.aspx?direct=true&db=rfh&AN=ATLA0000905912&site=ehost-live,
Assessing Spiritual Needs: A Guide for Caregivers; Spiritual Assessment in Pastoral Care: A Guide to Selected Resources,http://search.ebscohost.com/login.aspx?direct=true&db=rfh&AN=ATLA0000291201&site=ehost-live,
"Blessed Are the Poor: Women's Poverty, Family Policy, and Practical Theology",http://search.ebscohost.com/login.aspx?direct=true&db=rfh&AN=ATLA0000631762&site=ehost-live,
Women Respond to the Men's Movement: A Feminist Collection,http://search.ebscohost.com/login.aspx?direct=true&db=rfh&AN=ATLA0000640975&site=ehost-live,
Epistemology or bust : a maternal feminist knowledge of knowing,http://search.ebscohost.com/login.aspx?direct=true&db=rfh&AN=ATLA0000851309&site=ehost-live,
"The Bonds of Love: Psychoanalysis, Feminism & the Problem of Domination",http://search.ebscohost.com/login.aspx?direct=true&db=rfh&AN=ATLA0000618624&site=ehost-live,
Loving and Working: Reweaving Women's Public and Private Lives,http://search.ebscohost.com/login.aspx?direct=true&db=rfh&AN=ATLA0000621237&site=ehost-live,
Brave New Families: Stories of Domestic Upheaval in Late 20th Century America,http://search.ebscohost.com/login.aspx?direct=true&db=rfh&AN=ATLA0000620152&site=ehost-live,
Thinking theologically about modern medicine,,
Produce or perish : generativity and new reproductive technologies,http://search.ebscohost.com/login.aspx?direct=true&db=rfh&AN=ATLA0000844771&site=ehost-live,
Dictionary of Pastoral Care and Counseling,,
The Moral Revolution: A Christian Humanist Vision,http://search.ebscohost.com/login.aspx?direct=true&db=rfh&AN=ATLA0000590235&site=ehost-live,
Mortal Gods: Ernest Becker and Fundamental Theology,,
The sting of death,http://search.ebscohost.com/login.aspx?direct=true&db=rfh&AN=ATLA0000810888&site=ehost-live,
"Women's Ways of Knowing: The Development of Self, Voice, and Mind",,
Religious insanity : history of a diagnosis : Comment : Bonnie J. Miller-Mclemore,,
Co-Creating: A Feminist Vision of Ministry,http://search.ebscohost.com/login.aspx?direct=true&db=rfh&AN=ATLA0000570088&site=ehost-live,
Teologia pastoral como teologia pública,http://periodicos.est.edu.br/index.php/estudos_teologicos/article/view/253/328,
Tribute to Don S. Browning (1934–2010),,
Guess who's coming to the classroom ? Postmodernity and doctoral programs in religion and personality,http://search.ebscohost.com/login.aspx?direct=true&db=rfh&AN=ATLA0000010821&site=ehost-live,
"Christian Constructions of Children and Youths: Gift, Task, and Agent",,
Setting Limits: Medical Goals in an Aging Society,http://search.ebscohost.com/login.aspx?direct=true&db=rfh&AN=ATLA0000565859&site=ehost-live,
Words made flesh: writings in pastoral and practical theology,http://search.ebscohost.com/login.aspx?direct=true&db=rfh&AN=ATLA0001878950&site=ehost-live,
Word among Us: A Curriculum of the United Church of Christ,http://search.ebscohost.com/login.aspx?direct=true&db=rfh&AN=ATLA0000296145&site=ehost-live,
"Women's Ways of Knowing: The Development of Self, Voice, and Mind",,
Women Respond to the Men's Movement: A Feminist Collection,http://search.ebscohost.com/login.aspx?direct=true&db=rfh&AN=ATLA0000640975&site=ehost-live,
Toward greater understanding of practical theology,http://search.ebscohost.com/login.aspx?direct=true&db=rfh&AN=ATLA0001920382&site=ehost-live,
Through the Landscape of Faith: Christian Life Maps,http://search.ebscohost.com/login.aspx?direct=true&db=rfh&AN=ATLA0000549502&site=ehost-live,
Thinking about children: Christian faith and popular psychology,http://search.ebscohost.com/login.aspx?direct=true&db=rfh&AN=ATLA0001472985&site=ehost-live,
The social structure of Christian families: a historical perspective,http://search.ebscohost.com/login.aspx?direct=true&db=rfh&AN=ATLA0001495649&site=ehost-live,
The public character of the university-related divinity school,http://search.ebscohost.com/login.aspx?direct=true&db=rfh&AN=ATLA0001363970&site=ehost-live,
The pastoral psychotherapist in Disciple ministry : anomaly or needed partner?,http://search.ebscohost.com/login.aspx?direct=true&db=rfh&AN=ATLA0000845151&site=ehost-live,
Theology and pastoral counseling: a new interdisciplinary approach,,
Theology and families,http://search.ebscohost.com/login.aspx?direct=true&db=rfh&AN=ATLA0001699961&site=ehost-live,
The mystery of the child,http://search.ebscohost.com/login.aspx?direct=true&db=rfh&AN=ATLA0001611913&site=ehost-live,
The Moral Revolution: A Christian Humanist Vision,http://search.ebscohost.com/login.aspx?direct=true&db=rfh&AN=ATLA0000590235&site=ehost-live,
The human web : Reflections on the state of pastoral theology,http://search.ebscohost.com/login.aspx?direct=true&db=rfh&AN=ATLA0000862109&site=ehost-live,
The family in theological perspective,http://search.ebscohost.com/login.aspx?direct=true&db=rfh&AN=ATLA0000345780&site=ehost-live,
The doctorate of ministry as an exercise in practical theology : qualitative research with living human documents,,
The death and dying movement : psychologies and the formation of culture,,
"The Bonds of Love: Psychoanalysis, Feminism & the Problem of Domination",http://search.ebscohost.com/login.aspx?direct=true&db=rfh&AN=ATLA0000618624&site=ehost-live,
The arts of ministry : feminist-womanist approaches,,
Taught by God: teaching and spiritual formation,http://search.ebscohost.com/login.aspx?direct=true&db=rfh&AN=ATLA0001619692&site=ehost-live,
Story hour,http://search.ebscohost.com/login.aspx?direct=true&db=rfh&AN=ATLA0001538608&site=ehost-live,
Setting Limits: Medical Goals in an Aging Society,http://search.ebscohost.com/login.aspx?direct=true&db=rfh&AN=ATLA0000565859&site=ehost-live,
Scholars for the church: preparing seminary teachers,http://search.ebscohost.com/login.aspx?direct=true&db=rfh&AN=ATLA0001634765&site=ehost-live,
"Returning to the ""mother's house"" : a feminist look at Orpah",http://search.ebscohost.com/login.aspx?direct=true&db=rfh&AN=ATLA0000836936&site=ehost-live,
Representations of Motherhood,http://search.ebscohost.com/login.aspx?direct=true&db=rfh&AN=ATLA0000299260&site=ehost-live,
Religious imagination and the body: a feminist analysis,http://search.ebscohost.com/login.aspx?direct=true&db=rfh&AN=ATLA0000521839&site=ehost-live,
"Religion and psychology in transition: psychoanalysis, feminism, and theology",http://search.ebscohost.com/login.aspx?direct=true&db=rfh&AN=ATLA0000357770&site=ehost-live,
Regarding children: a new respect for childhood and families,http://search.ebscohost.com/login.aspx?direct=true&db=rfh&AN=ATLA0000341077&site=ehost-live,
Produce or perish : a feminist critique of generativity,http://search.ebscohost.com/login.aspx?direct=true&db=rfh&AN=ATLA0000822914&site=ehost-live,
"Motherhood in the balance: children, career, me, and God",http://search.ebscohost.com/login.aspx?direct=true&db=rfh&AN=ATLA0001413765&site=ehost-live,
Mortal Gods: Ernest Becker and Fundamental Theology,,
Loving and Working: Reweaving Women's Public and Private Lives,http://search.ebscohost.com/login.aspx?direct=true&db=rfh&AN=ATLA0000621237&site=ehost-live,
Living alone,http://search.ebscohost.com/login.aspx?direct=true&db=rfh&AN=ATLA0000341218&site=ehost-live,
Let the children come,http://search.ebscohost.com/login.aspx?direct=true&db=rfh&AN=ATLA0000840666&site=ehost-live,
Leaving home,http://search.ebscohost.com/login.aspx?direct=true&db=rfh&AN=ATLA0000341075&site=ehost-live,
Hospital Ministry: The Role of the Chaplain Today,http://search.ebscohost.com/login.aspx?direct=true&db=rfh&AN=ATLA0000560339&site=ehost-live,
"Hitting home: feminist ethics, women's work, and the betrayal of ""family values""",http://search.ebscohost.com/login.aspx?direct=true&db=rfh&AN=ATLA0001524777&site=ehost-live,
Giving Birth: Reclaiming Biblical Metaphor for Pastoral Practice,,
"Family and Work : Can Anyone ""Have It All""?",http://search.ebscohost.com/login.aspx?direct=true&db=rfh&AN=ATLA0000905911&site=ehost-live,
Everyday knowledge and uncommon truths: women of the academy,,
Eros for the other: retaining truth in a pluralistic world,http://search.ebscohost.com/login.aspx?direct=true&db=rfh&AN=ATLA0000521767&site=ehost-live,
Epistemology or Bust : Where Are We Really Headed?,http://search.ebscohost.com/login.aspx?direct=true&db=rfh&AN=ATLA0000869516&site=ehost-live,
"Doing wrong, getting sick, and dying",http://search.ebscohost.com/login.aspx?direct=true&db=rfh&AN=ATLA0000798871&site=ehost-live,
Dictionary of Pastoral Care and Counseling,,
Death and the moral life : Odd bedfellows in our postmodern age,,
Converging on culture: theologians in dialogue with cultural analysis and criticism,http://search.ebscohost.com/login.aspx?direct=true&db=rfh&AN=ATLA0001524759&site=ehost-live,
Contemporary Psychoanalysis and Religion: Transference and Transcendence,http://search.ebscohost.com/login.aspx?direct=true&db=rfh&AN=ATLA0000613421&site=ehost-live,
Co-Creating: A Feminist Vision of Ministry,http://search.ebscohost.com/login.aspx?direct=true&db=rfh&AN=ATLA0000570088&site=ehost-live,
Can One Be Faithful While Teaching Research Methods to DMin Students,,
Brave New Families: Stories of Domestic Upheaval in Late 20th Century America,http://search.ebscohost.com/login.aspx?direct=true&db=rfh&AN=ATLA0000620152&site=ehost-live,
Body theology,http://search.ebscohost.com/login.aspx?direct=true&db=rfh&AN=ATLA0000285300&site=ehost-live,
"Blessed Are the Poor: Women's Poverty, Family Policy, and Practical Theology",http://search.ebscohost.com/login.aspx?direct=true&db=rfh&AN=ATLA0000631762&site=ehost-live,
Assessing Spiritual Needs: A Guide for Caregivers,http://search.ebscohost.com/login.aspx?direct=true&db=rfh&AN=ATLA0000291201&site=ehost-live,
"""Also a Mother"" : Beyond Family Values",http://search.ebscohost.com/login.aspx?direct=true&db=rfh&AN=ATLA0001018746&site=ehost-live,
"Sandwiched but Not Smashed: Connection, Loss, and Responsibility in the Middle Years",https://rsn.aarweb.org/columns/sandwiched-not-smashed-connection-loss-and-responsibility-middle-years,
The Hubris and Folly of Defining a discipline: Reflections on the Evolution of The Wiley-Blackwell Companion to Practical Theology,http://www.metapress.com/content/g62m0053jv317164/fulltext.pdf,
Introduction : the contributions of practical theology,,
"Feminism, children, and mothering : three books and three children later",www.svenskakyrkan.se/forskning/e-bocker,
"Mutuality matters: family, faith, and just love",,
Faith's wisdom for daily living,,
Marriage debate,http://search.ebscohost.com/login.aspx?direct=true&db=rfh&AN=ATLA0001678173&site=ehost-live,
Christianity teaches forgiveness - and that includes you,http://archives.umc.org/interior.asp?mid=5378,
Spiritual contemplation in the chaos of parenthood,http://www.disciplesworldmagazine.com/node/6536,
Birthing and mothering as powerful rites of passage,,
Shaping the future of religion and psychology: feminist transformations in pastoral theology,,
"Health, Christian marriage traditions, and the ethics of marital therapy",,
Generativity and gender : the politics of care,,
Feminismus/Feministische Theologie: VI Praktische Theologie,,
"Pastoral theology as public theology : revolutions in the ""Fourth Area""",,
Religious rites of passage,,
Protestantism,,
Practical theology,,
"Pastoral perspectives for 7th Sunday of Easter, 1 John 5:9-13",,
"Pastoral perspective for 6th Sunday of Easter, 1 John 5:1-6; Ascenion of the lord 1:15-23",,
Christian Discipline of Children,https://divinity.uchicago.edu/sightings/articles/christian-discipline-children,
