Title,Url,yes/no
A Sermon,https://catalog.library.vanderbilt.edu,
Between God and the Poor: Rethinking the Means of Grace in the Wesleyan Tradition,https://catalog.library.vanderbilt.edu,
Gemeinsam sind wir stärker: „Tiefe Solidarität,https://catalog.library.vanderbilt.edu,
Fé e viagens no mundo globalizado,,
Graça sob Pressão: Negociando o Coração das Tradições Metodistas,,
Globalizzazione e Teologia,,
La religion del Mercado: Una aproximación crítica a la acumulación y la probreza,,
Para além do espírito do Império: Novas perspectivas em política e religião,,
Más allá del espiritu imperial: Nuevas perspectivas en política y religión,,
Christus und das Imperium : von Paulus bis zum Postkolonialismus,,
Cristo e Império: de Paulo aos tempos pós-coloniais,,
Lembrar-se dos Pobres: o desafio da teologia no século XXI,,
"Encyclopedia of activism and social justice Gary Anderson and Kathryn Herr, eds.",,
Opting for the margins postmodernity and liberation in Christian theology,,
Deep solidarity: Broadening the basis of transformation,http://link.gale.com/apps/doc/A541490108/AONE?u=tel_a_vanderbilt&sid=zotero&xid=49eab677,
Theologie der Multitude,,
National Capitalism: Religious Resonances and Alternatives,,
The Executed God—Syndicate Theology,https://syndicate.network/symposia/theology/the-executed-god/,
Theology of the Multitude,https://catalog.library.vanderbilt.edu,
"Empire, Deep Solidarity, and the Future of Liberation Theology",https://doi.org/10.1080/1462317X.2017.1311060,
Divine Currency: The Theological Power of Money in the West,https://doi.org/10.1080/1462317X.2020.1734282,
Why Movements Matter Most: A Conversation with the New Materialism,,
Religion and Class,https://digitalcommons.fiu.edu/classracecorporatepower/vol4/iss1/3,
From Mechanic to Organic Thinking and Beyond,,
Awake to the moment: an introduction to theology,,
Religion and Class: Ongoing Concerns and Issues,,
Why Movements Matter Most: Rethinking the New Materialism for Religion and Theology,,
Methodism and Liberation Theology,,
"Klassenkampf und Religion: Karl Barth, Sabine Plonz und aktuelle Alternativen zur bürgerlichen Theologie",,
Materialism,,
Alternative Images of God in the Global Economy,,
Original Sin,,
Liberty,,
Schleiermacher and Empire,,
Christian Theology and Empires,,
Option for the Poor,,
"Economics, Religion, and Nature",,
Christ’s Offices Reconsidered,,
Ausgebrannte Christen? Die neue Schöpfung und die Ökonomie der Gnade im globalen Kaptalismus,,
Twentieth-Century Theology,,
Liberation Theology,,
Theology and the Power of the Margins in a Postmodern World,,
Theology and economics,http://proxy.library.vanderbilt.edu/login?url=http://search.ebscohost.com/login.aspx?direct=true&db=lsdar&AN=ATLA0001416654&site=ehost-live&scope=site,
"Contemporary Issues and Models of Ministry with the Poor, the Underrepresented, and the Ignored: Introductory Comments",https://catalog.library.vanderbilt.edu,
A Palestinian Theology of Liberation | Reading Religion,https://readingreligion.org/books/palestinian-theology-liberation,
Just Capitalism: A Christian Ethic of Globalization. By Brent Waters,https://academic.oup.com/jcs/article/60/1/141/4732609,
Imagining Life Beyond Capital: Joerg Rieger on Thomas Piketty’s Capital in the Twenty-First Century,https://themarginaliareview.com/imagining-life-beyond-capital/,
Controversies in Political Theology: Development or Liberation? – By Thia Cooper,http://onlinelibrary.wiley.com/doi/abs/10.1111/j.1748-0922.2009.01360_6.x,
The Theological and the Political: On the Weight of the World d by Mark Lewis Taylor,http://link.gale.com/apps/doc/A337817349/AONE?u=tel_a_vanderbilt&sid=zotero&xid=5959ecee,
Theologie aus asiatischen Quellen: Der theologische Weg Choan-Seng Songs vor dem Hintergrund der asiatischen okumenischen Diskussion by Karl H. Federschmidt,http://link.gale.com/apps/doc/A19793255/AONE?u=tel_a_vanderbilt&sid=zotero&xid=934dba99,
Review Discussion of A Postcolonial Commentary on the New Testament Writings,http://proxy.library.vanderbilt.edu/login?url=http://search.ebscohost.com/login.aspx?direct=true&db=lsdar&AN=ATLA0001833153&site=ehost-live&scope=site,
With the Grain of the Universe: The Church's Witness and Natural Theology. (Major Reviews),http://link.gale.com/apps/doc/A89023460/AONE?u=tel_a_vanderbilt&sid=zotero&xid=3520bd44,
Wirtschaftliche Ungerechtigkeit als Anfrage an Markttheorie und methodistische Wirtschaftsethik.,https://catalog.library.vanderbilt.edu,
Toward a new heaven and a new Earth: essays in honor of Elisabeth Schüssler Fiorenza,http://proxy.library.vanderbilt.edu/login?url=http://search.ebscohost.com/login.aspx?direct=true&db=lsdar&AN=ATLA0001445239&site=ehost-live&scope=site,
Soul of a citizen: living with conviction in a cynical time by Paul Rogat Loeb,http://proxy.library.vanderbilt.edu/login?url=http://search.ebscohost.com/login.aspx?direct=true&db=lsdar&AN=ATLA0001276058&site=ehost-live&scope=site,
Praktisch-theologische Hermeneutik: Ansätze-Anregungen-Aufgaben,http://proxy.library.vanderbilt.edu/login?url=http://search.ebscohost.com/login.aspx?direct=true&db=lsdar&AN=ATLA0000311914&site=ehost-live&scope=site,
"Faith, class, and labor: intersectional approaches in a global context",,
"Theologies on the move: religion, migration, and pilgrimage in the world of neoliberal capital",,
The Ill-Fated Impasse of United Methodist Theology,https://um-insight.net/api/content/85b2baae-7ac9-11eb-999f-1244d5f7c7c6/,
"The Multiple Intersections of Faith, Labor, and Class",,
Introduction,,
Reclaiming Theology and Religious Traditions in the Tensions of Neoliberal Globalization: The Challenges of Pilgrimage and Migration,,
Afterword,,
Hoping against Hope: Dealing with Hopelessness in Ancient Times and Today †,https://www.mdpi.com/2077-1444/11/7/331,
Capitalism and Christian theology,https://onlinelibrary.wiley.com/doi/abs/10.1111/rec3.12350,
Engaging whiteness (more) constructively: Conversations with James Cone and Frederick Herzog on the future of race and class in theology,https://doi.org/10.1177/0034637320903301,
Working with Environmental Economists.,,
Keine Religion außer sozialer Religion: Zum befreienden Charakter wesleyanischer Theologie,,
Deep Solidarity: Dealing with Oppression and Exploitation beyond Charity and Advocacy,https://doi.org/10.1515/9780271085593,
Restructuring Interreligious Dialogue from the Bottom Up through the Lenses of Deep Solidarity and the Multitude,https://onlinelibrary.wiley.com/doi/abs/10.1111/erev.12468,
"Socialism, Religion, and That Pesky Working Class",https://syndicate.network/symposia/theology/social-democracy-in-the-making/,
"Religion, Labor, Class, and Justice: Buddhist—Christian Dialogue in Fresh Perspective",https://muse.jhu.edu/article/735301,
The Bible in the German Empire,https://www.oxfordhandbooks.com/view/10.1093/oxfordhb/9780190888459.001.0001/oxfordhb-9780190888459,
"Empire, Deep Solidarity, and the Future of Resistance",,
Kein Imperium ist Endgültig,,
Book Review of Divine Currency: The Theological Power of Money in the West,https://doi.org/10.1080/1462317X.2020.1734282,
What Have Socialism and Christianity to Do With Each Other,https://www.religionandjustice.org/interventions-forum-engaging-christianities-and-socialisms,
Liberating Christmas 2020,https://www.religionandjustice.org/blog/liberating-christmas-2020,
For the Transformation of the World: Worker Cooperatives and Faith Communities,https://www.religionandjustice.org/interventions-forum-coops,
"Fooling Americans is Becoming More Difficult: COVID-19, Black Lives, Matter, and What Is and Isn’t Essential",https://www.religionandjustice.org/interventions-forum-covid19,
The Ugly Truth of a Pandemic and the Logic of Downturn,https://um-insight.net/api/content/fef34eae-7e50-11ea-bab6-1244d5f7c7c6/,
Tongue-Tied: Class Struggle Is Damaging the Church,,
Class Struggle and Religion: Staying Neutral Isn’t An Option,,
Justice Revisited,,
"Scripture, Authority, and Power",,
God and Creation—with a Twist,,
What is Jesus Doing,,
Rethinking Religion and Economics.,,
Santa Claus Theology,,
Jesus is Lord?!,,
The Gospel of Prosperity,,
Tripp Fuller - Joerg Rieger: Jesus vs Caesar,https://podcasts.google.com/feed/aHR0cDovL3RyaXBwZnVsbGVyLmNvbS8_ZmVlZD1wb2RjYXN0/episode/aHR0cHM6Ly90cmlwcGZ1bGxlci5jb20vP3A9MzE5MzA,
Faith Panel | The Christian Left,https://soundcloud.com/cheri-dinovo/the-christian-left,
Religion and Labor Webinars,https://www.religionandjustice.org/labor-and-religion,
Liberating People and the Planet Webinars,https://www.religionandjustice.org/liberating,
Listen to the latest interview with Dr. Rieger on The Quest!,https://www.joergrieger.com/blog-home/watch-the-latest-interview-with-dr-rieger-on-the-quest,
"029 | Malignant Faith, Class Struggle, and Social Justice with Joerg Rieger",https://www.stitcher.com/show/faith-and-capital/episode/029-malignant-faith-class-struggle-and-social-justice-with-joerg-rieger-66890500,
Joerg Rieger on Jesus vs. Caesar,https://soundcloud.com/user-673959570/joerg-rieger-on-jesus-vs-caesar,
From Charity to Advocacy and Deep Solidarity,https://www.patheos.com/topics/charitable-giving/from-charity-to-advocacy-and-deep-solidarity-joerg-rieger-12-09-2015,
Why Consumerism Is Not the Problem: Reshaping Desire from the Bottom Up,https://www.patheos.com/topics/consumerism/why-consumerism-is-not-the-problem-joerg-rieger-11-18-2015,
Methodist revolutions: Evangelical engagements of church and world,,
The Cooperative Way to Fix the Supply Chain,https://www.proquest.com/docview/2652911960/abstract/7843A84BB320483BPQ/1,
"Rethinking religion, theology, and what really matters: the ultimate concerns of essential work",https://ojs.reformedjournals.co.za/stj/article/view/2199,
"Divide and Conquer: Cutting Taxes, Religion, and Relationships of Race and Class",,
"Kapitalismus, Christentum, und die Zukunft der Religion in den USA und Europa: Fragen des zwanzigsten Jahrhunderts im Einundzwanzigsten",,
Interreligious Dialogue beyond Dialogue: Revisiting Truth and Power from a Christian Perspective under the Conditions of Empire,https://www.oikoumene.org/resources/publications/faiths-seeking-justice,
Mission as Solidarity: Transforming the World Beyond Advocacy and Charity,,
"Mobilizing, Organizing, and Religion: On the Relevance and Irrelevance of Christianity",https://doi.org/10.1080/1462317X.2021.1899703,
National Capitalism and Religion in the United States: Challenges and Opportunities.”,,
"Book Review: Divine Currency: The Theological Power of Money in the West: by Devin Singh,",http://proxy.library.vanderbilt.edu/login?url=https://search.ebscohost.com/login.aspx?direct=true&db=rlh&AN=142425842&site=ehost-live&scope=site,
Interventions Forum Climate Change and Capitalism,https://www.religionandjustice.org/interventions-forum-climate-change-and-capitalism,
Slavery was the ultimate labor distortion – empowering workers today would be a form of reparations,http://theconversation.com/slavery-was-the-ultimate-labor-distortion-empowering-workers-today-would-be-a-form-of-reparations-162334,
Class Power and Human Suffering: Resisting the Idolatry of the Market in Religious Practice and Pastoral Theology,,
Women in (Class) Conflict - by Bruce Rogers-Vaughn | Reflections,https://reflections.yale.edu/article/sex-gender-power-reckoning/women-class-conflict-bruce-rogers-vaughn,
Powers and Principalities: Initial Reflections Toward a Post-Capitalist Pastoral Theology,http://proxy.library.vanderbilt.edu/login?url=http://search.ebscohost.com/login.aspx?direct=true&db=lsdar&AN=ATLAiC9Y160718001563&site=ehost-live&scope=site,
Recovering grief in the age of grief recovery,http://proxy.library.vanderbilt.edu/login?url=http://search.ebscohost.com/login.aspx?direct=true&db=lsdar&AN=ATLA0001425418&site=ehost-live&scope=site,
Introduction: Preface to a Post-Capitalist Pastoral Theology,https://doi.org/10.1057/978-1-137-55339-3_1,
"The road to Vanderbilt (Inaugural address, Mary Jane Werthan Professor of Judaic and Religious Studies)",,
Gilgamesh Epic,,
Divine Providence or Human Plan?,,
Mari Historiography and the Yakhdun-Lim Disc Inscription,,
Artisans…Artists: Documentary Perspectives from Mari,,
Afterthoughts on Writing a Bible Commentary,,
The Numerical Progression in Keret I:15-20: Yet Another Suggestion,,
Ruth: a new translation with a philological commentary and a formalist-folklorist interpretation,,
Ruth : a new translation with a philological commentary and a formalist-folklorist interpretation / Jack M. Sasson.,,
Zimri-Lim's Letter to Tish-ulme,,
Marriage entre grandes familles,http://ancientworldonline.blogspot.com/2012/06/newly-open-access-journal-nabu.html,
"La cultura de Mari, crocevia per molti popoli",,
The posting of letters with divine messages,,
Water beneath Straw. Adventures of a Prophetic Phrase in the Mari Archives,,
In the Time of Hammurabi: King Zimri-Lim of Mari,,
The Ancient Near East : an encyclopedia for students,,
The Road to Vanderbilt,,
Absalom’s Daughter: An Essay in Vestige Historiography,,
On Reading the Diplomatic Letters in the Mari Archives,,
On the Use of Images in Israel and the Ancient Near East,,
"Mold: ""tsara'at,"" Leviticus, and the history of a confusion",,
"Hebrew origins: historiography, history, faith of ancient Israel",,
Mari,,
The Eyes of Eli: An Essay in Motif Accretion,,
Forcing Morals on Mesopotamian Society?,,
Of Time & Immortality: How Genesis Created Them,,
Comparative Observations on the Near Eastern Epic Traditions,,
Wooing Rebekah :  how Isaac got a wife,,
The Servant’s Tale: How Rebekah Found a Spouse,,
Some literary motifs in the composition of the Gilgamesh epic,https://www.jstor.org/stable/4173765,
Another wrinkle on Old Adapa,https://citeseerx.ist.psu.edu/viewdoc/download?doi=10.1.1.1038.375&rep=rep1&type=pdf,
Oracle Inquiries in Judges,,
Time is Pressing,http://sepoa.fr/wp/wp-content/uploads/2012/05/1992-3.pdf,
Gilgamesh Epic,,
"Adapa, Halab, Zimri-Lim",,
Zimri-Lim’s Letter to Tish-ulme,http://sepoa.fr/?page_id=134,
Ruth: A New Translation. With a Philological Commentary and a Folkloristic-Formalist Interpretation,,
Shunukhra-Khalu,,
Who cut Samson's hair : (and other trifling issues raised by Judges 16),http://search.ebscohost.com/login.aspx?direct=true&db=rfh&AN=ATLA0000806504&site=ehost-live,
The Numerical Progression in Keret I:15-20: Yet Another Suggestion,http://www.sel.cchs.csic.es/sites/default/files/17sasson_f6ff31a2.pdf,
Ruth and Naomi,,
Yasmakh-Addu’s letter to God (ARM I:3),http://sepoa.fr/?page_id=121,
ARM X 97,http://sepoa.fr/?page_id=121,
"ARM IV, 20",http://sepoa.fr/?page_id=121,
A Satisfying Oath,http://sepoa.fr/?page_id=121,
A major contribution to Song of Songs scholarship,,
Ruth,,
Esther,,
Time and Mortality: Creation Narratives in Ancient Israel and in Mesopotamia,https://www.eisenbrauns.com/ECOM/_48C0KN3X3.HTM,
`Year: Zimri-Lim Dedicated his Statue to the God Addu of Halab’: Locating a Year in the Reign of Zimri-Lim,,
Ethically Cultured Interpretations: The Case of Eglon’s Murder (Judges 3),https://www.eisenbrauns.com/ECOM/_48C0KFZRS.HTM,
On Recently Published Administrative Tablets,https://poj-peeters-leuven-be.proxy.library.vanderbilt.edu/content.php?url=journal&journal_code=BIOR,
The Trouble with Nūr-Sin: Zimri-Lim’s Purchase of Alaḫtum,https://www.eisenbrauns.com/ECOM/_48C0K167G.HTM,
[Remarks on Ikribum Vows at Mari],,
`Year: Zimri-Lim Offered a Throne to Shamash of Mahanum’; An Overview of One year at Mari. Part I: The Presence of the King,,
Waters of bitterness,,
Mari,,
Mara,,
Mahlon,,
Eliphelet,,
Elimelech,,
Chilion,,
Chileab,,
boundary stones,,
Where angels fearlessly tread: Mari insights on Genesis 19,https://www.eisenbrauns.com/ECOM/_48C0JMZOZ.HTM,
Boaz,,
Welō' yitbōšāšû (Gen 2:25) and its implications,,
Unlocking the Poetry of Love in the Song of Songs,https://www.baslibrary.org/bible-review/1/1/3,
On the Jonah’s Two Missions,,
Thoughts of Zimri-Lim,http://search.ebscohost.com/login.aspx?direct=true&db=rfh&AN=ATLA0000941941&site=ehost-live,
"On Relating ""Religious"" Texts to the Old Testament",http://www.maarav.com/issue3_2.shtml,
Why should someone who knows something conceal it? Cuneiform Studies in Honor of David I. Owen on His 70th Birthday,,
Musical Settings for Cuneiform Literature: A Discography,,
Mari dreams,,
An Apocalyptic vision from Mari? Speculations on ARM X:9,,
On choosing models for recreating Israelite pre-monarchic history,http://search.ebscohost.com/login.aspx?direct=true&db=rfh&AN=ATLA0000787746&site=ehost-live,
Oriental wisdom: six essays on the sapiential traditions of Eastern civilizations [issue of the Journal of the American Oriental Society],,
Two Recent Works on Mari,http://www.jstor.org/stable/41636423,
"The ""Tower of Babel"" as a clue to the redactional structuring of the primeval history (Genesis 1:1-11:9)",,
"Numbers 5 and the ‘Waters of Judgment""",,
A Further Cuneiform Parallel to the Song of Songs,,
Beyond Babylon: closing remarks,https://my.vanderbilt.edu/jacksasson/files/2013/08/Sasson_final-Beyond-Babylon.pdf,
Zimri-Lim's March to Victory,,
"Short note on a ""mayor"" subject",http://search.ebscohost.com/login.aspx?direct=true&db=rfh&AN=ATLA0000765699&site=ehost-live,
Ruth III: a Response,http://jot.sagepub.com/content/3/5/49,
The issue of ge'ullāh in Ruth,http://search.ebscohost.com/login.aspx?direct=true&db=rfh&AN=ATLA0000781237&site=ehost-live,
"Genealogical ""convention"" in biblical chronography",http://search.ebscohost.com/login.aspx?direct=true&db=rfh&AN=ATLA0000767760&site=ehost-live,
Breeder or two for each leader: On Mothers in Judges 4 and 5,,
Nothing so swift as Calumny: Slander and justification at the Mari court,,
Treatment of Criminals at Mari: A Survey,http://www.jstor.org/stable/3632052,
Farewell to Mr. So-and So (Ruth 4:1),,
Isaiah Lxvi 3-4a,,
Wordplay in the OT,,
“Twins,,
“Mari,,
Generation; seventh,,
Ass,,
Hurrians and Hurrian Personal Names in the Mari Texts,,
Biographical Notices on Some Royal Ladies from Mari,http://www.jstor.org/stable/1359419,
Prologues and poets: on the opening lines of the Gilgamesh Epic,,
Jephthah: Chutzpah and overreach in a Hebrew judge,https://www.degruyter.com/document/doi/10.1515/9781575068671-025/html,
"""It is for this reason that i have not come down to my lord ...” visit obligations and vassal pretexts in the Mari archives",http://www.cairn.info/article.php?ID_ARTICLE=ASSY_107_0119,
"Judges 1-12. A New Translation, With introduction and Commentary",,
English Akkadian analytical index to the Chicago Assyrian dictionary / compiled by Jack M. Sasson.,,
The military establishments at Mari [by] Jack M. Sasson.,,
Remarks on Two ‘Anatolian’ Personal Names from Mari,,
An Early King of Assyria: Shamsi-Adad,http://www.historytoday.com/jack-m-sasson/king-early-assyria-shamsi-adad,
Instances of Mobility among Mari Artisans,,
Bovine Symbolism in the Exodus Narrative,,
A Sketch of North Syrian Economic Relations in the Middle Bronze Age,,
Word-play in Gen 6:8-9,http://search.ebscohost.com/login.aspx?direct=true&db=rfh&AN=ATLA0000749763&site=ehost-live,
"Flora, Fauna, and Minerals",,
The Worship of the Golden Calf,,
Time…to Begin,,
The ENGAR/ikkarum at Mari,,
The Calendar and Festivals of Mari during the time of Zimri-Lim,,
"Literary Criticism, Folklore Scholarship and Ugaritic Literature",,
Accounting Discrepancies in the Mari NÌ.GUB [NÍG.DU],,
The Biographic Mode in Hebrew Historiography,,
Yarim-Lim’s War Declaration,,
Akkadian Documents from Mari and Babylonia (Old Babylonian Period),,
"The Vow of Mutiya, King of Shekhna",,
"The Lord of Hosts, Seated over the Cherubs",,
The Mother of All… Etiologies,,
Ancestors Divine,https://my.vanderbilt.edu/jacksasson/files/2020/07/Sasson-VeenhofFs-1.pdf,
The Burden of Scribes,,
Ritual Wisdom? On ‘Seething a Kid in its Mother’s Milk,https://ir.vanderbilt.edu/handle/1803/4755,
Scruples: Extradition in the Mari Archives,,
"Texts, Trade and Travelers",,
"On the ‘Išḫi-Addu’ Seal from Qatna, with Comments on Qatna Personal Names in OB Period",,
Coherence and Fragments: Reflections on the SKL and the Book of Judges,,
Another look at the tenth commandment,,
The Treatment of Criminals in the Ancient Near East,,
"Studies in literature from the ancient Near East by members of the American Oriental Society, dedicated to Samuel Noah Kramer",,
Civilizations of the ancient Near East,,
Mari Apocalypticism Revisited,,
Mari Theomorphism: Intimation of Sacrality in the Royal Correspondence,https://ir.vanderbilt.edu/handle/1803/4958,
Doeg's Job,,
"The ""Tower of Babel"" as a clue to the redactional structuring of the primeval history (Gen 1-11:9)",,
The Blood of Grapes: Viticulture and Intoxication in the Hebrew Bible,,
Mari and the Holy Grail,,
Casus Belli in the Mari archives,,
The King’s Table: Food and Fealty in Old Babylonian Mari,,
Utopian and Dystopian Images in Mari Prophetic Texts,,
"Jonah : a new translation with introduction, commentary, and interpretations",,
"Idrimi and Šarruwa, the Scribe",,
Canaanite Maritime Involvement in the Second Millennium B. C.,,
Circumcision in the Ancient Near East,,
Some Comments on Archive Keeping at Mari,,
A Note On Sarbit,,
Reflections on an Unusual Practice Reported in ARM X:4,,
On Pope’s Song of Songs (AB 7c),http://www.maarav.com/issue1_2.shtml,
Hurrian Personal Names in the Rimaḥ Archives,,
The Old Babylonian Tablets from Al-Rimaḥ,,
Albright as an Orientalist,,
The King and I: a Mari King in Changing Perceptions,http://www.jstor.org/stable/604782,
About Mari and the Bible,,
"Canaan-Phoenicia, Religions of,” and “Inanna",,
From the Mari archives: an anthology of Old Babylonian letters,,
Mari Notes,http://www.jstor.org/stable/23283439,
Rechōvōt ʻîr,http://proxy.library.vanderbilt.edu/login?url=http://search.ebscohost.com/login.aspx?direct=true&db=lsdar&AN=ATLA0000935253&site=ehost-live&scope=site,
Should cheeseburgers be kosher?: a different interpretation of five Hebrew words,,
Towards A New Direction in Johannine Scholarship: The Fourth Gospel from a Literary  Perspective,,
The Journey(s) of the Word: A Reading of the Plot of the Fourth Gospel,,
The Final Farewell of Jesus: A Reading of John 20:30-21:25,,
Reading the Bible in the Ecclesial Base Communities of Latin America: A  Discussion regarding the Meaning of Social Location,,
Social Location and Biblical Interpretation: A Tropical Reading,,
Reading from this place,,
The Hermeneutics of Liberation: Toward A Communitarian Reading of the Bible,,
Theologizing from a Puerto Rican Perspective,,
A reading of the story of the Tower of Babel from the perspective of non-identity : Genesis 11:1-9 in the context of its production,,
A Feminist Theology of Liberation: A Latin American Perspective with a View  toward the Future,,
"Paper is Patient, History is Not: Readings and Unreadings of the Bible in Latin  America (1985-2005)",,
The theology of liberation: perspectives and tasks,,
Recovering the goddess: reflections on god-talk,,
Two places and no place on which to stand : mixture and otherness in Hispanic American theology,,
Towards Intercultural Criticism: Interpretation from the Diaspora,,
The Gospel at the Close of the Century: Engagement from the Diaspora,,
Reading Readers Reading John: An Exercise in Intercultural Criticism,,
Reading Readers of the Fourth Gospel and Their Readings: An Exercise in Intercultural  Criticism,,
Pedagogical Discourse and Practices in Contemporary Biblical Criticism,,
Inclusion and Exclusion in John 17,,
In the World but Not of It: A Theology of Exile,,
Cultural Studies and Contemporary Biblical Criticism: Ideological Criticism as Mode of  Discourse,,
Cultural Studies and Biblical Pedagogy: Toward a Contextual Biblical Pedagogy,,
Aliens in the Promised Land: The Manifest Destiny of U.S. Hispanic American  Theology,,
Reading-Across: Reading Strategy and Textual Posture in Intercultural Criticism,,
Reading beyond Borders: Postcolonial Studies and Diasporic Studies in Biblical  Criticism,,
"Postcolonial Biblical Criticism: Beginnings, Trajectories, Intersections",,
Minority Studies and Christian Studies,,
Melting and Dreaming in America: Visions and Re-visions,,
Mapping the Postcolonial Optic in Biblical Criticism: Meaning and Scope,,
Liberation Hermeneutics: Revisiting the Foundations in Latin America,,
Cultural Criticism: Expanding the Scope of Biblical Criticism,,
The dynamics of globalization and the university: toward a radical democratic-emancipatory transformation,,
"The Vision of Matthew: Christ, Church, and Morality in the First Gospel",http://search.ebscohost.com/login.aspx?direct=true&db=rfh&AN=ATLA0000488077&site=ehost-live,
The love and hatred of Jesus and Johannine sectarianism,http://search.ebscohost.com/login.aspx?direct=true&db=rfh&AN=ATLA0000784721&site=ehost-live,
"Exégesis de Mateo, 27, 51b-53",http://search.ebscohost.com/login.aspx?direct=true&db=rfh&AN=ATLA0000495429&site=ehost-live,
The theology and provenance of John 15:1-17,http://search.ebscohost.com/login.aspx?direct=true&db=rfh&AN=ATLA0000792358&site=ehost-live,
"La parabole du ""Pasteur"" et ses explications: Jean 10:1-18",http://search.ebscohost.com/login.aspx?direct=true&db=rfh&AN=ATLA0000498572&site=ehost-live,
John 15:18-16:4a : a first addition to the original farewell discourse?,http://search.ebscohost.com/login.aspx?direct=true&db=rfh&AN=ATLA0000929990&site=ehost-live,
La resistencia judía contra Roma en la Época de Jesús,http://search.ebscohost.com/login.aspx?direct=true&db=rfh&AN=ATLA0000511070&site=ehost-live,
La fiesta de liberación de los oprimidos: Relectura de Jn 7:1-20:21,http://search.ebscohost.com/login.aspx?direct=true&db=rfh&AN=ATLA0000513091&site=ehost-live,
Anatomy of the Fourth Gospel: A Study in Literary Design,http://search.ebscohost.com/login.aspx?direct=true&db=rfh&AN=ATLA0000524601&site=ehost-live,
The Epistles of John,http://search.ebscohost.com/login.aspx?direct=true&db=rfh&AN=ATLA0000522487&site=ehost-live,
