qid,label_en,editor_uuid,editor,editor_stated_as,editor_series_ordinal,editor_ref1_hash,editor_ref1_referenceUrl,editor_ref1_stated_in,editor_ref1_retrieved_nodeId,editor_ref1_retrieved_val,editor_ref1_retrieved_prec
Q115564467,Dialogical Interrogations,03735056-42CD-428B-BDFF-BD1202F88822,Q94854010,G Kasimu Baker-Fletcher,,b040a097b08bf1314c9e2647912dbb7f119015cf,,Q114403967,5ea0cbca-1dcc-4c66-a0bb-25919d016945,2022-12-02T00:00:00Z,11
Q115649458,"Preaching God's transforming justice: a lectionary commentary, year C",8562FD2C-3884-4936-9D34-C5611A9AA134,Q92216692,Dale P Andrews,1,5c24f402bce15202bbea33c9ae4fd10580eac57a,,Q114403967,d03ea39c-1b1b-482d-9068-1a045f9e8257,2022-12-09T00:00:00Z,11
Q115649458,"Preaching God's transforming justice: a lectionary commentary, year C",C18150A6-0677-494E-B08E-193CAB8CD2CF,Q92207288,Ronald J Allen,2,5c24f402bce15202bbea33c9ae4fd10580eac57a,,Q114403967,6e23a182-0b11-4872-82ed-46059b837446,2022-12-09T00:00:00Z,11
Q115649458,"Preaching God's transforming justice: a lectionary commentary, year C",CA97AB18-2E6B-4A3C-93FD-8F1E967F87FA,Q92207043,Dawn Ottoni-Wilhelm,3,5c24f402bce15202bbea33c9ae4fd10580eac57a,,Q114403967,71e615ef-caf7-498c-8ecf-ce805c22c229,2022-12-09T00:00:00Z,11
Q115649460,"Preaching God's transforming justice: a lectionary commentary, year B",202CA7AC-E624-4E49-9B9D-35E8112DE195,Q92216692,Dale P Andrews,1,5c24f402bce15202bbea33c9ae4fd10580eac57a,,Q114403967,b65ef28e-6bc8-4ed6-824c-d8c07c9891c4,2022-12-09T00:00:00Z,11
Q115649460,"Preaching God's transforming justice: a lectionary commentary, year B",76DF5BA1-74AD-42E3-B2E3-4EF03B7C28AE,Q92207288,Ronald J Allen,2,5c24f402bce15202bbea33c9ae4fd10580eac57a,,Q114403967,9eb1beb3-27c2-4327-a07a-aa63d38dd3d1,2022-12-09T00:00:00Z,11
Q115649460,"Preaching God's transforming justice: a lectionary commentary, year B",B1203024-9F46-4E15-8694-54D44CB277FE,Q92207043,Dawn Ottoni-Wilhelm,3,5c24f402bce15202bbea33c9ae4fd10580eac57a,,Q114403967,5b3c05f4-87af-4496-a4ad-3df06ac20f70,2022-12-09T00:00:00Z,11
Q115649894,Black practical theology,BEAA6523-D37E-4B99-B52E-08779EEA7252,Q92216692,Dale P Andrews,1,5c24f402bce15202bbea33c9ae4fd10580eac57a,,Q114403967,0baccda7-aecd-4958-b9d2-23ce1bc80812,2022-12-09T00:00:00Z,11
Q115650150,Bodily citations: religion and Judith Butler,80001474-DDA6-452B-A9B6-F364723D4967,Q83432379,Ellen T Armour,1,5c24f402bce15202bbea33c9ae4fd10580eac57a,,Q114403967,774bc663-fd9b-40db-b2eb-12e75aadf401,2022-12-09T00:00:00Z,11
Q115650150,Bodily citations: religion and Judith Butler,D43B58F0-CC8C-4B05-AB66-38556D823E50,Q113802120,Susan M St Ville,2,5c24f402bce15202bbea33c9ae4fd10580eac57a,,Q114403967,7354a309-734a-400e-9a4d-319ce069cb52,2022-12-09T00:00:00Z,11
Q115650674,Repositioning race: prophetic research in a post-racial Obama age,3BD621DF-2241-4CE5-8F17-57F745D5DE05,Q67554073,Sandra L Barnes,1,5c24f402bce15202bbea33c9ae4fd10580eac57a,,Q114403967,34f5dd11-8f1e-44df-981e-e25d35a8f682,2022-12-09T00:00:00Z,11
Q115650674,Repositioning race: prophetic research in a post-racial Obama age,184F5566-6036-47A7-BA27-B2C44A8BCFEF,Q84076727,Zandria F Robinson,2,5c24f402bce15202bbea33c9ae4fd10580eac57a,,Q114403967,102d14bb-1700-4f85-9e76-e814c910e4b0,2022-12-09T00:00:00Z,11
Q115650747,“The alpha and omega of our people” : a sociological examination of the promise and problems of the contemporary Black church,C871CD58-5732-44D1-A81F-5F25912DA26B,Q26465444,Juan Battle,1,5c24f402bce15202bbea33c9ae4fd10580eac57a,,Q114403967,c88e7fc9-12f1-4b9f-94d6-b6cdd72e2bf1,2022-12-09T00:00:00Z,11
Q115650701,"Black sexualities: probing powers, passions, practices, and policies",F34D0A55-4DC7-46D2-B2F3-7017DDECF4A1,Q67554073,Sandra L Barnes,,5c24f402bce15202bbea33c9ae4fd10580eac57a,,Q114403967,8e77dc0a-fde5-4904-9254-7aea7fd1bf1d,2022-12-09T00:00:00Z,11
Q115673395,Review of Resonant Witness: Conversations between Music and Theology,EA9D79B8-177C-46A6-B94D-F035EB6C4409,Q6181107,Jeremy S Begbie,1,b28cb9a8d37b22ba6cdc18b6f70a67dd52927e7c,http://www.theorderofsaintluke.com/ojs/index.php/doxology/article/view/8,,e6b8dbe9-9e04-474d-84cd-7dfea17096d3,2022-12-11T00:00:00Z,11
Q115674378,Deeper shades of purple: womanism in religion and society,7B7272DD-9030-4C80-98CB-F3F24B44924C,Q7595851,Stacey M Floyd-Thomas,,414bf63fef4c79a78a6ed6df5413c21c51afb127,,Q114403967,b4d53adc-0ee3-47fc-b227-386e7285c7d8,2022-12-11T00:00:00Z,11
Q115674381,Liberation theologies in the United States an introduction,B2140704-BD16-42EF-8CD6-7584B1921810,Q7595851,Stacey M Floyd-Thomas,1,414bf63fef4c79a78a6ed6df5413c21c51afb127,,Q114403967,a65da7ff-d231-41bc-a09c-327edc0da54b,2022-12-11T00:00:00Z,11
Q115674381,Liberation theologies in the United States an introduction,8D1310FC-321E-4DB8-B116-F4636A526D88,Q4772041,Anthony B Pinn,2,414bf63fef4c79a78a6ed6df5413c21c51afb127,,Q114403967,33f4b982-54f2-457b-8835-e365fce6aa69,2022-12-11T00:00:00Z,11
Q115678344,Postmemories of the Holocaust,D88125C5-C8AC-436F-816F-0CA0879898EB,Q83389821,Jay Geller,,ee5b3c703ea5aa7c335ebfcde40253125834d12c,,Q114403967,6040a30a-74f6-482d-9087-990bbc183e10,2022-12-12T00:00:00Z,11
Q115678347,Reading Freud's Reading,C64E2726-1191-48E9-BB3E-B48BBDA8CC32,Q83389821,Jay Geller,1,ee5b3c703ea5aa7c335ebfcde40253125834d12c,,Q114403967,2e6e4321-73c8-4609-8255-2b62122b18d6,2022-12-12T00:00:00Z,11
Q115678347,Reading Freud's Reading,5B4AC0E3-19B2-43EE-A69F-F34E2717B11D,Q111995042,Valerie Greenberg,2,ee5b3c703ea5aa7c335ebfcde40253125834d12c,,Q114403967,bb91996a-2502-43cf-93f6-43481db18236,2022-12-12T00:00:00Z,11
Q115678347,Reading Freud's Reading,0FA1193C-1A04-46B8-993A-F52C432954AF,Q325219,Sander L Gilman,3,ee5b3c703ea5aa7c335ebfcde40253125834d12c,,Q114403967,9a061547-ae1a-45de-ac60-0b1c5e39164d,2022-12-12T00:00:00Z,11
Q115681985,Tradition et Théologie dans l'Ancien Testament,1911739C-F783-49D9-B31A-86463965F173,Q87480821,Douglas A Knight,,ee5b3c703ea5aa7c335ebfcde40253125834d12c,,Q114403967,ad4d9847-85a1-4f5f-9c90-89c9e95e80a3,2022-12-12T00:00:00Z,11
Q115682374,Tradition and theology in the Old Testament,BC46624E-F01E-462D-AE67-5217C68B1A30,Q87480821,Douglas A Knight,,ee5b3c703ea5aa7c335ebfcde40253125834d12c,,Q114403967,4ae10336-54e3-4135-8797-c42217c75f27,2022-12-12T00:00:00Z,11
Q115682375,The Hebrew Bible and its modern interpreters,DCEBD273-5BA0-4123-9BBB-D2D7A92C2313,Q87480821,Douglas A Knight,1,ee5b3c703ea5aa7c335ebfcde40253125834d12c,,Q114403967,c6baeafa-9147-4a91-aada-4c406c4fe13d,2022-12-12T00:00:00Z,11
Q115682375,The Hebrew Bible and its modern interpreters,546E6F52-2082-44F5-83AF-BAB3807FC523,Q61482585,Gene M Tucker,2,ee5b3c703ea5aa7c335ebfcde40253125834d12c,,Q114403967,60a0c087-fc92-4e36-96df-e6189fb1d90d,2022-12-12T00:00:00Z,11
Q115682386,A feminist companion to the New Testament Apocrypha,2D3628ED-58E7-4379-8082-1101745B7140,Q4749053,Amy-Jill Levine,,ee5b3c703ea5aa7c335ebfcde40253125834d12c,,Q114403967,fe19922a-2f8c-4ed3-97a4-f9e0825a2f85,2022-12-12T00:00:00Z,11
Q115682387,A feminist companion to the Catholic Epistles and Hebrews,9F0FBF3C-7A27-427B-8E4A-FBF051A0D7A5,Q4749053,Amy-Jill Levine,,ee5b3c703ea5aa7c335ebfcde40253125834d12c,,Q114403967,1153fdf1-f21c-44ce-b2ca-e403045941a1,2022-12-12T00:00:00Z,11
Q115682388,A feminist companion to the Acts of the Apostles,654ABC12-9AA6-4E8B-84EE-5870263DD857,Q4749053,Amy-Jill Levine,,ee5b3c703ea5aa7c335ebfcde40253125834d12c,,Q114403967,58f2d4e6-a094-485c-9972-786e2b33c725,2022-12-12T00:00:00Z,11
Q115682389,A feminist companion to Paul,D790EEFD-8BAD-4B6B-B5F4-53916B74B570,Q4749053,Amy-Jill Levine,,ee5b3c703ea5aa7c335ebfcde40253125834d12c,,Q114403967,25aa9f94-b074-4170-b4c7-3d339ac84540,2022-12-12T00:00:00Z,11
Q115682390,A feminist companion to Mark,163ABDC7-6A78-44E0-93CF-9C84A8A9C4D4,Q4749053,Amy-Jill Levine,,ee5b3c703ea5aa7c335ebfcde40253125834d12c,,Q114403967,c2f60370-3879-4ebc-b136-8d3e4db6de0a,2022-12-12T00:00:00Z,11
Q115682391,The Jewish annotated New Testament : New Revised Standard Version Bible translation,E20E21DD-5548-450A-ACE2-54EC0A1D9AD5,Q4749053,Amy-Jill Levine,1,ee5b3c703ea5aa7c335ebfcde40253125834d12c,,Q114403967,6c5e7efd-94e8-40bc-ade6-c094f84dc29b,2022-12-12T00:00:00Z,11
Q115682391,The Jewish annotated New Testament : New Revised Standard Version Bible translation,C1851465-037E-44B9-8D38-69F41C1D6F6C,Q6755973,Marc Zvi Brettler,2,ee5b3c703ea5aa7c335ebfcde40253125834d12c,,Q114403967,29f5da05-7d72-4ca3-adac-f6143f5a2017,2022-12-12T00:00:00Z,11
Q115682417,A feminist companion to Mariology,FA4C2146-5D2D-4461-AE3C-607CF0C8FB6B,Q4749053,Amy-Jill Levine,,ee5b3c703ea5aa7c335ebfcde40253125834d12c,,Q114403967,d41336c0-0bc9-42cb-9855-c3fccdd598c6,2022-12-12T00:00:00Z,11
Q115682418,A feminist companion to John,4A2FC581-39A0-48A9-B7EB-EC82CB9E66CE,Q4749053,Amy-Jill Levine,,ee5b3c703ea5aa7c335ebfcde40253125834d12c,,Q114403967,1696342b-0628-45dc-b001-1a86a52a6bbe,2022-12-12T00:00:00Z,11
Q115682420,The Jewish annotated New Testament:  New Revised Standard Version Bible translation,0771098C-199F-470C-AEEB-865510A972FF,Q4749053,Amy-Jill Levine,1,ee5b3c703ea5aa7c335ebfcde40253125834d12c,,Q114403967,e6b7d6b9-8c7d-466a-95c2-67625e3d0582,2022-12-12T00:00:00Z,11
Q115682420,The Jewish annotated New Testament:  New Revised Standard Version Bible translation,619DC51E-1E89-439D-941F-0CA2B994F416,Q6755973,Marc Zvi Brettler,2,ee5b3c703ea5aa7c335ebfcde40253125834d12c,,Q114403967,92da07a0-30ee-49ac-8912-8d77410cda74,2022-12-12T00:00:00Z,11
Q115682422,A feminist companion to Matthew,AACC19F8-4A00-47EE-B5D0-FF8F526D3536,Q4749053,Amy-Jill Levine,,ee5b3c703ea5aa7c335ebfcde40253125834d12c,,Q114403967,f1462e3d-9473-45b8-8869-4605e0e014c5,2022-12-12T00:00:00Z,11
Q115682522,"The Earth Moved: Jesus, Sex, and Eschatology",C58D4C04-B3BB-44FC-90F7-072CB0A8D06E,Q4119137,John S Kloppenborg,1,ee5b3c703ea5aa7c335ebfcde40253125834d12c,,Q114403967,778d568a-1297-4b74-a93f-154555ba6bf5,2022-12-12T00:00:00Z,11
Q115682522,"The Earth Moved: Jesus, Sex, and Eschatology",7FEAF503-13E1-4D6F-8FFD-3302A1403116,Q86836030,John W Marshall,2,ee5b3c703ea5aa7c335ebfcde40253125834d12c,,Q114403967,d7ea5a67-c981-463a-bcb7-b8c317745719,2022-12-12T00:00:00Z,11
Q115683707,"Religious writings and religious systems : systemic analysis of holy books in Christianity, Islam, Buddhism, Greco-Roman religions, ancient Israel, and Judaism",A204559F-60E5-4A81-BC8A-CF8B87E2B8D4,Q4749053,Amy-Jill Levine,1,ee5b3c703ea5aa7c335ebfcde40253125834d12c,,Q114403967,3a985f8c-d81a-4b18-8a58-52cb057cb17b,2022-12-12T00:00:00Z,11
Q115683707,"Religious writings and religious systems : systemic analysis of holy books in Christianity, Islam, Buddhism, Greco-Roman religions, ancient Israel, and Judaism",C55A618D-84BF-4061-9BB2-AEEB7D04A940,Q1384317,Jacob Neusner,2,ee5b3c703ea5aa7c335ebfcde40253125834d12c,,Q114403967,bcd17fd5-20a0-4a7d-a8aa-df2f6bb9120c,2022-12-12T00:00:00Z,11
Q115683707,"Religious writings and religious systems : systemic analysis of holy books in Christianity, Islam, Buddhism, Greco-Roman religions, ancient Israel, and Judaism",4D889635-1FC3-48ED-B3F7-55C1307843D5,Q93268561,Ernest S Frerichs,3,ee5b3c703ea5aa7c335ebfcde40253125834d12c,,Q114403967,df83b210-bc54-4375-9157-68a9da93a6e7,2022-12-12T00:00:00Z,11
Q115683711,Exploring Biblical Kinship: Festschrift in Honor of John J. Pilch,983539B8-3624-4ADE-91E9-CFF080AC326B,Q93226737,Joan Cecelia Campbell,1,ee5b3c703ea5aa7c335ebfcde40253125834d12c,,Q114403967,7259d1a5-b215-41e7-9e57-a9b01c278ca1,2022-12-12T00:00:00Z,11
Q115683711,Exploring Biblical Kinship: Festschrift in Honor of John J. Pilch,06FA6388-136E-41C1-91CD-CA87710F40BF,Q93225230,Patrick J Hartin,2,ee5b3c703ea5aa7c335ebfcde40253125834d12c,,Q114403967,fb61519f-65c0-4169-8344-07b3726e5d97,2022-12-12T00:00:00Z,11
Q115683723,Gospels: narrative and history,2CB97D92-616A-4A70-ABA2-CA31F4A21869,Q4749053,Amy-Jill Levine,,ee5b3c703ea5aa7c335ebfcde40253125834d12c,,Q114403967,68abf809-0722-49e6-bc05-679561e47a87,2022-12-12T00:00:00Z,11
Q115683724,A feminist companion to the Deutero-Pauline epistles,77FCCE3D-3E50-439C-A0CA-6146A95E6CD9,Q4749053,Amy-Jill Levine,,ee5b3c703ea5aa7c335ebfcde40253125834d12c,,Q114403967,2edad61a-440e-4dbe-9df4-4fca8134501a,2022-12-12T00:00:00Z,11
Q115683725,A Feminist Companion to the Apocalypse of John,2AF05B9F-2812-42E7-BA4B-84F8DE296088,Q4749053,Amy-Jill Levine,,aa756959c469d81793f3b71fef3ddbf24b94dfb1,http://www.bloomsbury.com/us/a-feminist-companion-to-the-apocalypse-of-john-9780826466518/,,8d569758-32de-42e6-9c9f-07337e0d9b88,2022-12-12T00:00:00Z,11
Q115683726,A Feminist Companion to Patristic Literature,3B0D4B4C-DAF0-41FF-B0D7-1EBF548AB581,Q4749053,Amy-Jill Levine,,6132160fcd2455f2abcfe59aff808607d3f748ca,http://www.bloomsbury.com/us/a-feminist-companion-to-patristic-literature-9780567045553/,,ceb4e2a2-8539-4df2-94b4-bc6da91357f3,2022-12-12T00:00:00Z,11
Q115683727,Women Like This: New Perspectives on Jewish Women in the Greco-Roman World,BA982259-265A-4AB0-A1DE-E10712B7EF2C,Q4749053,Amy-Jill Levine,,ee5b3c703ea5aa7c335ebfcde40253125834d12c,,Q114403967,819a08e0-4466-493a-bfc6-14da8b7e7c45,2022-12-12T00:00:00Z,11
Q115683746,A feminist companion to Luke,96D9DC6B-0B40-4373-B9E2-7BDD8FD04BC4,Q4749053,Amy-Jill Levine,,ee5b3c703ea5aa7c335ebfcde40253125834d12c,,Q114403967,717d8f1f-78a7-4a96-92cd-7e5281c12297,2022-12-12T00:00:00Z,11
Q115683747,The Gospel of Matthew,60342C01-2FB7-4051-8C9B-EECEB492B438,Q93232940,Sharon H Ringe,2,ee5b3c703ea5aa7c335ebfcde40253125834d12c,,Q114403967,e3695ddc-d805-44fd-b77f-b2019ebc25f0,2022-12-12T00:00:00Z,11
Q115684169,"Religious writings & religious systems, 1: Islam, Buddhism, Greco-Roman religions, Ancient Israel, Judaism",30A8967E-82BF-4C94-8AE8-31396F392E67,Q4749053,Amy-Jill Levine,1,ee5b3c703ea5aa7c335ebfcde40253125834d12c,,Q114403967,cb5defaa-71cd-42a3-be71-3b0366daaa0e,2022-12-12T00:00:00Z,11
Q115684204,The Pharisees,1BD86204-C279-4D60-A3C9-0B5E6B40191E,Q4749053,Amy-Jill Levine,1,ee5b3c703ea5aa7c335ebfcde40253125834d12c,,Q114403967,edadd72f-d11b-4d30-bccf-fdd2de71a002,2022-12-12T00:00:00Z,11
Q115684204,The Pharisees,36197CBA-0B0B-4898-B981-53A12308E804,Q112472096,Joseph Sievers,2,ee5b3c703ea5aa7c335ebfcde40253125834d12c,,Q114403967,6610bf40-7708-45a6-a9b3-2596d5f2f215,2022-12-12T00:00:00Z,11
Q115687816,Under the oak tree: the church as community of conversation in a conflicted and pluralistic world,C5C77730-6DD3-49EC-BDE8-EFD1EED00C8E,Q92207288,Ronald J Allen,1,245100ac7e6f8d1a619d79cb386c24ef56919eae,,Q114403967,3a9153f1-1a61-4a0a-a5ee-337793bcc38b,2022-12-13T00:00:00Z,11
Q115687816,Under the oak tree: the church as community of conversation in a conflicted and pluralistic world,F0CE59A6-DDD7-4E85-8456-B92D9B2FF333,Q83505844,John S McClure,2,245100ac7e6f8d1a619d79cb386c24ef56919eae,,Q114403967,ad57bdfd-2c44-47bd-93d0-d5e7e3e61256,2022-12-13T00:00:00Z,11
Q115688792,The Future of the Methodist Theological Traditions,75041CBE-4F7C-4E0C-A91D-9949712355C0,Q83505989,M Douglas Meeks,,245100ac7e6f8d1a619d79cb386c24ef56919eae,,Q114403967,21cd7dde-3706-4fe8-adf9-b1371957eedf,2022-12-13T00:00:00Z,11
Q115688793,Christian social ethics in a global era,D5C3026A-141E-4133-AAF6-341A9EE23F7B,Q83505989,M Douglas Meeks,1,245100ac7e6f8d1a619d79cb386c24ef56919eae,,Q114403967,88304269-1ce2-4ed7-bbd5-9ea0c27e959b,2022-12-13T00:00:00Z,11
Q115688793,Christian social ethics in a global era,28577A95-4CAB-4929-9F6C-DFE68F202D1F,Q6794986,Max L Stackhouse,2,245100ac7e6f8d1a619d79cb386c24ef56919eae,,Q114403967,34484b52-7c25-4b85-9ab6-c787616bbd9f,2022-12-13T00:00:00Z,11
Q115688793,Christian social ethics in a global era,140ACEC6-AD48-4D94-B3F2-5CEDADAFA397,Q84486,Peter L Berger,3,245100ac7e6f8d1a619d79cb386c24ef56919eae,,Q114403967,e9c43879-b3c5-4905-b981-3735011f7ebb,2022-12-13T00:00:00Z,11
Q115688793,Christian social ethics in a global era,46C2FC47-CDA5-4C5A-9746-4B484E3235CE,Q16973499,Dennis P McCann,4,245100ac7e6f8d1a619d79cb386c24ef56919eae,,Q114403967,17ba1ab0-1117-4500-94a8-137e11cd3275,2022-12-13T00:00:00Z,11
Q115688794,The passion for life: a messianic lifestyle,96B01C93-0413-4C71-ACD9-708F5F681A1C,Q83505989,M Douglas Meeks,,245100ac7e6f8d1a619d79cb386c24ef56919eae,,Q114403967,cf86b73f-fe1f-4da6-8e05-8e89e35f434c,2022-12-13T00:00:00Z,11
Q115688797,Human Identity in Christian Faith,B5AB8154-95E1-493F-8BF0-31CEB3837CE6,Q83505989,M Douglas Meeks,,245100ac7e6f8d1a619d79cb386c24ef56919eae,,Q114403967,4a164ebf-41f6-4e3d-9d03-af4147fab1a8,2022-12-13T00:00:00Z,11
Q115688800,Introduction to Systematic Theology,47887B04-E818-45A8-A2B4-87E83899298D,Q83505989,M Douglas Meeks,,245100ac7e6f8d1a619d79cb386c24ef56919eae,,Q114403967,7dca2e42-dd20-4d78-81cf-07279acac351,2022-12-13T00:00:00Z,11
Q115688801,Our calling to fulfill: Wesleyan views of the church in mission,DD982A58-A8C9-456D-8C80-3FC0C0F69929,Q83505989,M Douglas Meeks,,245100ac7e6f8d1a619d79cb386c24ef56919eae,,Q114403967,6b9ab4e3-65c7-4997-845a-c7153af46730,2022-12-13T00:00:00Z,11
Q115688803,In essentials unity: reflections on the nature and purpose of the church: in honor of Frederick R. Trost,72C32B6A-5DFF-4713-8A98-B2CAB13A2D65,Q83505989,M Douglas Meeks,1,245100ac7e6f8d1a619d79cb386c24ef56919eae,,Q114403967,4ba7fb6a-0403-40c6-a330-54aed5f4fd17,2022-12-13T00:00:00Z,11
Q115688804,"Trinity, community, and power: mapping trajectories in Wesleyan theology",5E91CE4E-8E14-4455-8BED-D6487B38D8CA,Q83505989,M Douglas Meeks,,245100ac7e6f8d1a619d79cb386c24ef56919eae,,Q114403967,45a37cd2-9bd6-49a7-b6f9-95bf539b9c5a,2022-12-13T00:00:00Z,11
Q115688805,The portion of the poor: good news to the poor in the Wesleyan tradition,36561489-95E7-43C0-B061-B23AF9BB4430,Q83505989,M Douglas Meeks,,245100ac7e6f8d1a619d79cb386c24ef56919eae,,Q114403967,4619e22e-2e12-4f1b-8c29-701555e23c5b,2022-12-13T00:00:00Z,11
Q115688807,What should Methodists teach?: Wesleyan tradition and modern diversity,C26C7F55-866A-4007-91C2-5CB0339A45B0,Q83505989,M Douglas Meeks,,245100ac7e6f8d1a619d79cb386c24ef56919eae,,Q114403967,b7317d67-615b-4189-933d-609a843b0531,2022-12-13T00:00:00Z,11
Q115688808,Theology & corporate conscience: essays in honor of Frederick Herzog,4C2896B8-24FA-40AC-8B93-C8A2C71DED6E,Q83505989,M Douglas Meeks,1,245100ac7e6f8d1a619d79cb386c24ef56919eae,,Q114403967,79a55890-869d-4ce6-a3f1-47cab7517efe,2022-12-13T00:00:00Z,11
Q115688808,Theology & corporate conscience: essays in honor of Frederick Herzog,656C3507-FDCA-4D29-8509-EE7DE6AF6BA7,Q60278,Jurgen Moltmann,2,245100ac7e6f8d1a619d79cb386c24ef56919eae,,Q114403967,e49521ce-4f35-441c-99ab-0ae3a760b874,2022-12-13T00:00:00Z,11
Q115688808,Theology & corporate conscience: essays in honor of Frederick Herzog,34897B21-CD54-4970-BABA-CDAEAC119804,Q113717461,Frederick R Trost,3,245100ac7e6f8d1a619d79cb386c24ef56919eae,,Q114403967,77daa4e5-f878-4df7-ad57-e0d479348da1,2022-12-13T00:00:00Z,11
Q115688811,Love: the foundation of hope: the theology of Jürgen Moltmann and Elisabeth Moltmann-Wendel,0FE28329-2C85-4004-B186-B42FDEC74838,Q83505989,M Douglas Meeks,1,245100ac7e6f8d1a619d79cb386c24ef56919eae,,Q114403967,6b7d7d26-cabb-4de0-a155-6bad1eff4a5c,2022-12-13T00:00:00Z,11
Q115688828,Feminist and womanist pastoral theology,7FE7655E-1D9E-40E2-B94E-F4B2BE3BCB95,Q63038665,Bonnie J Miller-McLemore,1,245100ac7e6f8d1a619d79cb386c24ef56919eae,,Q114403967,e1fe72e7-f772-43df-8f9f-90f63936b854,2022-12-13T00:00:00Z,11
Q115689682,"Poverty, suffering and HIV-AIDS : international practical theological perspectives",4D1AAE7F-49D7-45A3-9813-6802E417317A,Q110504666,Pamela D Couture,1,245100ac7e6f8d1a619d79cb386c24ef56919eae,,Q114403967,4776e451-7c91-45b7-b7fe-41a87457d8e1,2022-12-13T00:00:00Z,11
Q115689682,"Poverty, suffering and HIV-AIDS : international practical theological perspectives",6EA086BA-A896-4D7E-9A56-44A980F66124,Q63038665,Bonnie J Miller-McLemore,2,245100ac7e6f8d1a619d79cb386c24ef56919eae,,Q114403967,36177c70-dc41-44e5-9794-647a4853b676,2022-12-13T00:00:00Z,11
Q115689689,"Mutuality matters: family, faith, and just love",689394AA-7DD0-46F4-95D4-902C6509F963,Q63183857,Herbert Anderson,1,245100ac7e6f8d1a619d79cb386c24ef56919eae,,Q114403967,e8315de1-e4da-4bd8-9365-77fc5bd24937,2022-12-13T00:00:00Z,11
Q115689689,"Mutuality matters: family, faith, and just love",10A3591B-BAA8-4794-96E2-5EF4C62D4C0C,Q63038665,Bonnie J Miller-McLemore,2,245100ac7e6f8d1a619d79cb386c24ef56919eae,,Q114403967,ec4db61d-17af-413d-b3ea-9a97f6476669,2022-12-13T00:00:00Z,11
Q115689689,"Mutuality matters: family, faith, and just love",72239C0A-F1CE-4C3A-98DD-7A0D96755156,Q93241995,Robert J Schreiter,4,245100ac7e6f8d1a619d79cb386c24ef56919eae,,Q114403967,538cfeb9-5d57-48fe-b653-488fe323363d,2022-12-13T00:00:00Z,11
Q115689713,Children and childhood in American religions,21F81E8F-068C-4964-AD0B-580D3E4E4AB4,Q30302655,Don S Browning,1,245100ac7e6f8d1a619d79cb386c24ef56919eae,,Q114403967,b8b9356f-cf2b-48f2-8355-2005fbc73e6c,2022-12-13T00:00:00Z,11
Q115689713,Children and childhood in American religions,78FAB512-278A-4081-AEBE-696AC1E867C1,Q63038665,Bonnie J Miller-McLemore,2,245100ac7e6f8d1a619d79cb386c24ef56919eae,,Q114403967,cad2292e-6c94-47b3-84c6-1093717124fd,2022-12-13T00:00:00Z,11
Q115690098,Religious institutions and issues of health care,02E8D56F-8F54-4731-A042-4FDF4419BCEE,Q63038665,Bonnie J Miller-McLemore,,245100ac7e6f8d1a619d79cb386c24ef56919eae,,Q114403967,16c0179c-148d-4426-a764-c37e7b163366,2022-12-13T00:00:00Z,11
Q115690112,Calling all years good: Christian vocation throughout life's seasons,94510806-E73E-408D-A918-6AACD0DB355E,Q63038665,Bonnie Miller-McLemore,1,245100ac7e6f8d1a619d79cb386c24ef56919eae,,Q114403967,500367e0-552b-466e-bd60-687f462635e9,2022-12-13T00:00:00Z,11
Q115690112,Calling all years good: Christian vocation throughout life's seasons,3D3942D4-CB6B-414F-9B90-713E13BD1E70,Q63183852,Kathleen A Cahalan,2,245100ac7e6f8d1a619d79cb386c24ef56919eae,,Q114403967,827aaede-1c9e-41e8-85a6-80ae69c54b82,2022-12-13T00:00:00Z,11
Q115690116,A graceful embrace: theological reflections on adopting children,BB350864-0BD3-415D-B5DD-8C9360B54AE7,Q63038665,Bonnie Miller-McLemore,,245100ac7e6f8d1a619d79cb386c24ef56919eae,,Q114403967,3dc1c21f-0ee8-45b5-9cdf-1eece999b08e,2022-12-13T00:00:00Z,11
Q115690148,City of desires - a place for God? : practical theological perspectives,777B0C49-7D46-443C-A279-17D3AAC9553F,Q63038665,Bonnie J Miller-McLemore,1,245100ac7e6f8d1a619d79cb386c24ef56919eae,,Q114403967,4e640585-7633-4cec-9384-84ba553d5fd5,2022-12-13T00:00:00Z,11
Q115690148,City of desires - a place for God? : practical theological perspectives,EA6093C1-F103-4A36-ACC5-93D3CA9E9A7F,Q1810168,R Ruard Ganzevoort,2,245100ac7e6f8d1a619d79cb386c24ef56919eae,,Q114403967,beb00be6-59ad-4c63-bbd8-bd8fb374e999,2022-12-13T00:00:00Z,11
Q115690530,Liturgy and the moral self,276E42DA-6995-4F48-BC6E-83A436F016E0,Q83505860,Bruce T Morrill,2,245100ac7e6f8d1a619d79cb386c24ef56919eae,,Q114403967,dbfde048-7eff-45c7-8e4f-b8da40b2329b,2022-12-13T00:00:00Z,11
Q115690532,Bodies of worship : explorations in theory and practice,07067B9D-8E5C-4B1B-B547-19E06EDD5A3E,Q83505860,Bruce T Morrill,,245100ac7e6f8d1a619d79cb386c24ef56919eae,,Q114403967,8341d794-1c22-40df-af30-dcb58b7a69ce,2022-12-13T00:00:00Z,11
Q115690558,"Practicing Catholic ritual, body, and contestation in Catholic faith",0C3000FA-348D-4A24-94EE-29DE2C7F1062,Q83505860,Bruce T Morrill,1,245100ac7e6f8d1a619d79cb386c24ef56919eae,,Q114403967,3ba97a00-9d90-4fde-ae3c-cdbb69f0cf65,2022-12-13T00:00:00Z,11
Q115690559,Sacraments : revelation of the humanity of God : engaging the fundamental theology of Louis-Marie Chauvet,0260A138-CBA1-49F9-A39B-B77BA443219A,Q21294582,Philippe Bordeyne,1,245100ac7e6f8d1a619d79cb386c24ef56919eae,,Q114403967,8216644c-4f84-40ca-9ff6-fc0b9cadd342,2022-12-13T00:00:00Z,11
Q115690559,Sacraments : revelation of the humanity of God : engaging the fundamental theology of Louis-Marie Chauvet,F128B492-7767-4B30-9ACF-6AE229E66A32,Q83505860,Bruce T Morrill,2,245100ac7e6f8d1a619d79cb386c24ef56919eae,,Q114403967,687c576f-e980-45a7-b1c0-c4f755afa2a4,2022-12-13T00:00:00Z,11
Q115691527,The Many Bodies of Worship: Locating the Spirit's Work,8DAA7C7C-4868-402E-86D2-1F2F76309CC3,Q83505860,Bruce T Morrill,1,4b013fac3b479374ab45ebf2e416cd72a5e7a2b0,,Q114403967,87c42724-9d84-49d7-a1ad-20220e06136c,2022-12-14T00:00:00Z,11
Q115691527,The Many Bodies of Worship: Locating the Spirit's Work,D0B888F3-E128-4C1F-927B-73F6DD24650F,Q104618706,Bernard J Cooke,2,4b013fac3b479374ab45ebf2e416cd72a5e7a2b0,,Q114403967,f07fb21f-efe8-4fe1-94e0-ffea27934202,2022-12-14T00:00:00Z,11
Q115691528,Initial Consideration: Theory and Practice of the Body in Liturgy Today,B51029D4-6806-4BE3-A7E0-1AC597864329,Q83505860,Bruce T Morrill,1,4b013fac3b479374ab45ebf2e416cd72a5e7a2b0,,Q114403967,c31d0eb3-a668-43e4-a297-6cc4851edd3c,2022-12-14T00:00:00Z,11
Q115691528,Initial Consideration: Theory and Practice of the Body in Liturgy Today,371682A6-5A34-4645-9F0D-8D8BC8A257E4,Q104618706,Bernard J Cooke,2,4b013fac3b479374ab45ebf2e416cd72a5e7a2b0,,Q114403967,57bbdce9-9aad-4135-b85d-8641a085e20a,2022-12-14T00:00:00Z,11
Q115691529,"Time, Absence, and Otherness: Divine-Human Paradoxes Bonding Liturgy and Ethics",47456357-63AE-44A5-9F50-B5C47FF19B20,Q21294582,Philippe Bordeyne,,4b013fac3b479374ab45ebf2e416cd72a5e7a2b0,,Q114403967,5819a1f5-54e5-44fa-a7e2-e6e11c7667d8,2022-12-14T00:00:00Z,11
Q115691536,Building Appreciatively on Chauvet’s Work: An Overview,23F32532-C521-41A3-9EA6-582684A3F085,Q21294582,Philippe Bordeyne,,4b013fac3b479374ab45ebf2e416cd72a5e7a2b0,,Q114403967,6fe1aeac-6992-4ef2-80a5-a400fbbb9a41,2022-12-14T00:00:00Z,11
Q115708238,Karl Barth,EAA68A72-BCE2-4AF2-BA8D-CAEA82148A62,Q6844375,Miguel A de la Torre,1,263f3ec26329383c50164ad47f706e9c12561922,,Q114403967,5c48aa41-7c2e-4aa5-95d8-ee46b04b50c6,2022-12-15T00:00:00Z,11
Q115708238,Karl Barth,6EA37A5A-0168-4AA3-AE55-0A0434B86689,Q7595851,Stacey M Floyd-Thomas,2,263f3ec26329383c50164ad47f706e9c12561922,,Q114403967,f58280b1-c93f-47e4-8399-39ef8d521069,2022-12-15T00:00:00Z,11
Q115712819,Methodist and radical: rejuvenating a tradition,52EC4769-53EF-4DA2-A9D7-873E20E250DF,Q27643173,Joerg Rieger,1,263f3ec26329383c50164ad47f706e9c12561922,,Q114403967,923500a8-83d5-43d4-bfc1-09a64b127c38,2022-12-15T00:00:00Z,11
