qid,label_en,depicts_uuid,depicts,depicts_ref1_hash,depicts_ref1_statedIn,depicts_ref1_referenceUrl,depicts_ref1_retrieved_nodeId,depicts_ref1_retrieved_val,depicts_ref1_retrieved_prec
Q102305506,The Christ of the Breadlines,,,,,,,,
Q102315563,Seated female funerary figure,,,,,,,,
Q102315787,Head of a Young Girl or a Goddess,,,,,,,,
Q102949359,"""I Hate You For Hitting My Mother,"" Minneapolis",,,,,,,,
Q102958387,"(An Imaginary) Night Attack in the War Between the Hogen, Heiji, Minamoto, Yoshitomo, and Shirakawa [Forces]",,,,,,,,
Q102958390,"#1, Scenes from a Marriage, Garth and Lisa",,,,,,,,
Q102961140,#109,,,,,,,,
Q102961146,#116,,,,,,,,
Q102961155,#117,,,,,,,,
Q102961164,"#2, Scenes from a Marriage, Lisa and Garth",,,,,,,,
Q102961170,"#3, Scenes from a Marriage, Lisa and Garth",,,,,,,,
Q102961180,"#IX, from the Series of Lithographs I To IX",,,,,,,,
Q102961187,1 Sekunde artist's book,,,,,,,,
Q102961197,19th Century Representations of 17th-Century Fireplaces of the Louis XIV Period,,,,,,,,
Q102961202,19th-Century Representations of 17th-Century Fireplaces of the Louis XIV Period,,,,,,,,
Q102961211,A Cloudless Walk,,,,,,,,
Q102961219,"A collection of approx. 180 architectural plans for the Woolworth Building (New York, NY)",,,,,,,,
Q102961225,"A Conversation with Guido di Brettinoro, (Purgatorio, Canto 14) from Illustrations to Dante's Divine Comedy",,,,,,,,
Q102961230,A Craggy Landscape,,,,,,,,
Q102961239,A Famous View of Ise - The Marriage Rocks at Futami-ga-ura at Sunrise,,,,,,,,
Q102961245,"A Ghost Painting Coming to Life in the Studio of the Painter Okyō, from the series Yoshitoshi ryakuga (Sketches by Yoshitoshi)",,,,,,,,
Q102961253,A group of muffs and other articles of dress on a table,,,,,,,,
Q102961265,A Harlot's Progress: Scene in Bridewell,,,,,,,,
Q102961272,A Harlot's Progress: The Funeral,,,,,,,,
Q102961288,A Meeting in a Forest,,,,,,,,
Q102961293,A Mexican woman stands next to the Mexican/US border,,,,,,,,
Q102961299,A Mother Holding a Child,,,,,,,,
Q102961305,A Mountain Pass,,,,,,,,
Q102961312,A Philosopher,,,,,,,,
Q102961315,A Picture from an Outline of Women's Manners - The Wedding Ceremony,,,,,,,,
Q102961327,A Puppet Play in the Inner Palace of Edo Castle (from the series The Inner Palace of Chiyoda Castle),,,,,,,,
Q102961335,"A Scene from Virgil's Aeneid, Book IV",,,,,,,,
Q102961344,"A Scene from Virgil's Aeneid, Book IX",,,,,,,,
Q102961349,"A Scene from Virgil's Aeneid, Book VI",,,,,,,,
Q102961359,"A Scene from Virgil's Aeneid, Book VIII",,,,,,,,
Q102961367,A Senseless After Dinner Custom,,,,,,,,
Q102961376,A Storm at Sea after Claude Lorrain,,,,,,,,
Q102961387,A toutes les personnes qui ont des capitaux a perdre,,,,,,,,
Q102961393,A Train of Wagons with Goods,,,,,,,,
Q102961400,"A tympanum with Madonna, St. Ephanus, St. Petrus, St. Paulus, St. Agata",,,,,,,,
Q102961406,"A victim of landmines, Kabul, Afghanistan",,,,,,,,
Q102961416,a Yuri G,,,,,,,,
Q102961421,A-Fuchi (Sword Handle Ferrule) and B-Kashira (Sword Handle Pommel) with a Design of a Dragon,,,,,,,,
Q102961432,A-Fuchi (Sword Handle Ferrule) and B-Kashira (Sword Handle Pommel) with a Design of a Landscape in the Rain,,,,,,,,
Q102961438,A-Fuchi (Sword Handle Ferrule) and B-Kashira (Sword Handle Pommel) with a Design of Clouds and Lightning,,,,,,,,
Q102961447,A-Fuchi (Sword Handle Ferrule) and B-Kashira (Sword Handle Pommel) with a Design of Four Geese Flying in the Rain Over Fishnets,,,,,,,,
Q102961454,"AARKA, from American Abstract Artists 50th Anniversary Print Portfolio",,,,,,,,
Q102961461,Abigail before David,,,,,,,,
Q102961468,Abondantia,,,,,,,,
Q102961474,About a Cat,,,,,,,,
Q102961480,"Abraham and Isaac, after a ceiling design by Titian in the Santa Maria della Salute Church, Venice",,,,,,,,
Q102961486,"Abstract-Impressionism - After Seurat, from American Abstract Artists 75th Anniversary Print Portfolio",,,,,,,,
Q102961491,Abstraction (from Derriere le Miroìr),,,,,,,,
Q102961498,"Across, from American Abstract Artists 60th Anniversary Print Portfolio",,,,,,,,
Q102961508,Adoration of the Sheperds,,,,,,,,
Q102961514,African Daisy (reproduction),,,,,,,,
Q102961521,"Afterglow (also called Geddington, England)",,,,,,,,
Q102961533,Airplane,,,,,,,,
Q102961549,"Album du Siége, Title page from Recueil de Caricatures Publieé Pendant le Siége dans Le Charivari",,,,,,,,
Q102961559,"Album of 19 Reproductions of Paintings, Illustrating the Kabuki juhachiban  (18 Kabuki Plays)",,,,,,,,
Q102961566,Album painting of two men in a cottage in a mountain landscape,,,,,,,,
Q102961573,"Alla Sicilia (In Sicily), from Paesaggi (Landscapes)",,,,,,,,
Q102961587,Allegory of Morbidity (after Raphael),,,,,,,,
Q102961594,"American Flag, from ""America: Now + Here"" a portfolio",,,,,,,,
Q102961601,"American Gothic, from ""America: Now + Here"" a portfolio",,,,,,,,
Q102961610,American Homestead Autumn,,,,,,,,
Q102961616,American Homestead Spring,,,,,,,,
Q102961621,American Homestead Summer,,,,,,,,
Q102961627,American Homestead Winter,,,,,,,,
Q102961636,"An American soldier stands on top of a destroyed Iraqi tank. Kuwaiti oil wells, ignited by Saddam's retreating forces, burn in the distance, Kuwait",,,,,,,,
Q102961640,An Old Water Mill,,,,,,,,
Q102961645,Anatolian amulet with an eye design,,,,,,,,
Q102961649,"Ancient Excavations at Carli, India",,,,,,,,
Q102961655,Animal vase,,,,,,,,
Q102961661,Annamese ware dish with blue underglaze painting,,,,,,,,
Q102961667,Ansicht der Stodt Braunau am Innfluss,,,,,,,,
Q102961675,Ante Bellum #2,,,,,,,,
Q102961681,"Antinova Remembers, from the Revolutions Per Minute (The Art Record)",,,,,,,,
Q102961684,Antioch Coin in irregular ovoid shape,,,,,,,,
Q102961692,Antioch coin in irregular ovoid shape,,,,,,,,
Q102961701,Antique scene after David,,,,,,,,
Q102961707,Aqua (the second from a suite of four prints entitled les Quatres Eléments (The Four Elements)),,,,,,,,
Q102961714,Aquarelle #21,,,,,,,,
Q102961720,"Arachne, from American Abstract Artists 50th Anniversary Print Portfolio",,,,,,,,
Q102961727,Arita ware sake cup with a design in blue underglaze of three fish,,,,,,,,
Q102961734,Arita ware tea cup with a design in blue underglaze of bamboo,,,,,,,,
Q102961744,Arita ware tea cup with a design in overglaze enamel of flowers and vines,,,,,,,,
Q102961750,Arita ware tea cup with design in blue underglaze of figures and buildings in a landscape,,,,,,,,
Q102961755,Arita ware water dropper (suiteki) with a design in blue underglaze of a crane and pine trees,,,,,,,,
Q102961763,"Arm Rest with a Design of a Crane, Chinese Characters, & Sacred Fungus",,,,,,,,
Q102961768,Arm Rest With a Design of a Persimmon,,,,,,,,
Q102961772,Arm Rest with a Design of a Table with a Basket of Fruit & Buddha's Hand Fruit,,,,,,,,
Q102961781,Arm rest with a design of man in boat with inscription,,,,,,,,
Q102961790,Arm rest with a landscape design and inscription,,,,,,,,
Q102961795,Arm Rest with a Peony Design,,,,,,,,
Q102961804,Arm rest with Chinese inscription,,,,,,,,
Q102961809,Armer vetter und hoher Herr 2 (Poor cousin and high master 2),,,,,,,,
Q102961816,Assentamento #4,,,,,,,,
Q102961820,"August, Août (August), from a suite of allegorical prints illustrating the months of the year with text in German and French",,,,,,,,
Q102961830,Autumn River,,,,,,,,
Q102961843,"Autumn, Sowing of Grain",,,,,,,,
Q102961856,Bacchantenzug (Bacchanalian Procession),,,,,,,,
Q102961862,Bacchus au Festin,,,,,,,,
Q102961870,Bahba,,,,,,,,
Q102961883,Balance,,,,,,,,
Q102961894,Bamboo #1,,,,,,,,
Q102961901,Bamboo #2,,,,,,,,
Q102961911,Bamboo container with carved inscription,,,,,,,,
Q102961918,Bartolomeus Spranger and His Wife Christina Müller,,,,,,,,
Q102961924,Bath Ford,,,,,,,,
Q102961936,Bathers,,,,,,,,
Q102961943,"Bats in the Fifth Act of Chūshingura, from the series Yoshitoshi ryakuga (Sketches by Yoshitoshi)",,,,,,,,
Q102961953,"Battered Woman & Cop, Philadelphia",,,,,,,,
Q102961960,Battersea Bridge,,,,,,,,
Q102961969,Battle Scene,,,,,,,,
Q102961975,"Battle Scene, the second from a suite of six prints entitled Varii Capricci Militari (Various Military Caprices)",,,,,,,,
Q102961983,"Battle Scene, the sixth from a suite of six prints entitled Varii Capricci Militari (Various Military Caprices)",,,,,,,,
Q102961990,Beached Boat,,,,,,,,
Q102961996,"Beaded Circle, from American Abstract Artists 75th Anniversary Print Portfolio",,,,,,,,
Q102962001,Beaker,,,,,,,,
Q102962009,"Beggar with Dog, from Les Gueux (The Beggars), a series of 25 etchings",,,,,,,,
Q102962014,"Beggar Woman Holding Coins, from Les Gueux (The Beggars), a series of 25 etchings",,,,,,,,
Q102962018,"Beggar Woman with a Bowl, from Les Gueux (The Beggars), a series of 25 etchings",,,,,,,,
Q102962026,"Behind the Door, from American Abstract Artists 60th Anniversary Print Portfolio",,,,,,,,
Q102962035,Being in the Moment,,,,,,,,
Q102962043,Being in the Moment,,,,,,,,
Q102962048,Bellum,,,,,,,,
Q102962054,Belt buckle with a design of a beast,,,,,,,,
Q102962062,Belt hook in the shape of two facing dragons,,,,,,,,
Q102962070,"Benkei and Others Around a Bell, from the series Yoshitoshi ryakuga (Sketches by Yoshitoshi)",,,,,,,,
Q102962078,Bent bowl with a fish design,,,,,,,,
Q102962087,Beppu ware incense container (Kogo) in the shape of an ox,,,,,,,,
Q102962100,Between the Acts,,,,,,,,
Q102962106,Between the Lines,,,,,,,,
Q102962116,Bi disc,,,,,,,,
Q102962130,Big Reclining Nude,,,,,,,,
Q102962140,Big Yellow,,,,,,,,
Q102962145,"Bingata Cloth With Design of Camellia, a Stream, and Two Other Flowers",,,,,,,,
Q102962150,Bird feeder with a design in blue underglaze of chrysanthemums,,,,,,,,
Q102962162,Bird feeder with wooden fastener with a design in blue under glaze of birds,,,,,,,,
Q102962171,Bird Head Bowl,,,,,,,,
Q102962176,Bird on a Branch,,,,,,,,
Q102962180,Bird on a Fruit Tree Branch (Lychee),,,,,,,,
Q102962187,Bird sitting on a medallion,,,,,,,,
Q102962195,Birds on a Branch,,,,,,,,
Q102962200,Bizen ware Chawan (tea bowl),,,,,,,,
Q102962205,Bizen ware figurine of a kappa,,,,,,,,
Q102962213,Bizen ware sake bottle (Tokkuri),,,,,,,,
Q102962219,Bizen ware vase with two simulated handles on shoulders,,,,,,,,
Q102962225,Black bowl with serpentine bands,,,,,,,,
Q102962233,"Black Square Reflection, from American Abstract Artists 60th Anniversary Print Portfolio",,,,,,,,
Q102962245,Black teapot,,,,,,,,
Q102962251,"Black, yellow, and blue glass beads with geometric designs",,,,,,,,
Q102962260,Blackburn,,,,,,,,
Q102962270,Blanc de chine quatrefoil cup with applied plums (the end of winter; the coming of spring),,,,,,,,
Q102962276,"Block with Three Rice Cake Molds; On One Side, a Lotus Blossom and a Lotus Petal, and on the Other, a Lotus Leaf",,,,,,,,
Q102962281,Block with Two Circular Rice Cake Molds (See Notes),,,,,,,,
Q102962287,"Blowup Doll Jay St, from the series Tribeca, 10013",,,,,,,,
Q102962297,Blue and white bowl,,,,,,,,
Q102962303,Blue and white hexagonal cup,,,,,,,,
Q102962309,Blue and white incense burner,,,,,,,,
Q102962315,Blue and white porcelain plate with a blue under-glaze of a wagtail perched on a rock,,,,,,,,
Q102962318,Blue Cat,,,,,,,,
Q102962324,Blue glazed pottery mug,,,,,,,,
Q102962331,Blue gray jar with design of mountainous harbor scene,,,,,,,,
Q102962339,Blue Ovals,,,,,,,,
Q102962347,"Boat Building, from American Abstract Artists 60th Anniversary Print Portfolio",,,,,,,,
Q102962350,Boat Landing,,,,,,,,
Q102962356,Bok Choy (Chinese Cabbage),,,,,,,,
Q102962361,"Bondo Mitsugoro (on the right), Nakamura Rikan (on the left)",,,,,,,,
Q102962367,Bonfire,,,,,,,,
Q102962379,Book Illustration & Text on The Life of the 9th-Century Poetess,,,,,,,,
Q102962384,"Bosnian-Muslim Displaced Refugees, Croatia",,,,,,,,
Q102962390,Boston Harbor,,,,,,,,
Q102962398,Bottle shaped vase with painted design of willow tree and grass orchids,,,,,,,,
Q102962404,Bottle vase with design of flowers,,,,,,,,
Q102962409,Bound book of unknown title with designs for transoms over fusuma (sliding interior panels),,,,,,,,
Q102962419,Bowl,,,,,,,,
Q102962426,Bowl with a brown and white motif,,,,,,,,
Q102962433,"Bowl with a design in blue under glaze of medallions, Lung-shan seal, and interior scene of a scholar in landscape",,,,,,,,
Q102962439,Bowl with a design in blue under-glaze of buildings and mountains,,,,,,,,
Q102962447,Bowl with a design in blue underglaze of two dragons,,,,,,,,
Q102962456,Bowl with a design of a landscape in blue underglaze,,,,,,,,
Q102962463,Bowl with a design of bamboo in blue underglaze,,,,,,,,
Q102962469,Bowl with a design of flowers and arabesques (Export ware),,,,,,,,
Q102962477,Bowl with a design of Japanese women and girls,,,,,,,,
Q102962482,Bowl with a Design of Japanese Women and Girls and 500 Rakan (Sanskrit: Arhats),,,,,,,,
Q102962489,Bowl with a design of landscape in the center of mountains and ocean (Ao-Kutani ware),,,,,,,,
Q102962504,Bowl with a design of plum blossoms on the interior and blue-green glaze over brown on the exterior,,,,,,,,
Q102962509,Bowl with a lotus motif,,,,,,,,
Q102962517,Bowl with a lotus motif (celadon ware),,,,,,,,
Q102962526,Bowl with an abstract design in blue under glaze,,,,,,,,
Q102962532,Bowl with an interior design in blue under glaze of a bird and exterior design of a landscape with fishermen in boats and a scholar figure,,,,,,,,
Q102962540,Bowl with crackle glaze with an abstract design in blue underglaze  with a silver rim,,,,,,,,
Q102962547,Bowl with design in blue under glaze of two phoenixes and three flowers and two concentric rings with four abstract designs on the underside,,,,,,,,
Q102962556,Bowl with design of a rabbit in the center,,,,,,,,
Q102962565,"Bowl with designs of cranes, flowers and pines (Imari ware)",,,,,,,,
Q102962573,Bowl with floral motif,,,,,,,,
Q102962581,Bowl with foliate rim with a design of blue and green clouds with inscription,,,,,,,,
Q102962591,Bowl with glossy-black glaze with wax-resist and matte blue glaze and brown interior glaze,,,,,,,,
Q102962597,Bowl with green crackle glaze,,,,,,,,
Q102962602,Bowl with guan-type white crackle glaze,,,,,,,,
Q102962608,Bowl with incised faces and geometric designs on underside,,,,,,,,
Q102962620,Bowl With Inlay Design on Interior and Exterior,,,,,,,,
Q102962626,Bowl with landscape design,,,,,,,,
Q102962632,"Bowl with lip and foot (Ko style, Celadon ware)",,,,,,,,
Q102962640,Bowl with red decoration; from the Imperial kiln,,,,,,,,
Q102962651,Bowl with red medallion design of landscape with pheasant (Kutani ware),,,,,,,,
Q102962660,Bowl with scholars objects and precious things,,,,,,,,
Q102962667,Bowl with three handles in the shape of leopards,,,,,,,,
Q102962676,Bowl with three written characters for the number 2,,,,,,,,
Q102962685,Bowl with under glaze blue border and flower design in center with four leaf designs on the underside,,,,,,,,
Q102962696,Box,,,,,,,,
Q102962703,"Boxed Lightning, from American Abstract Artists 75th Anniversary Print Portfolio",,,,,,,,
Q102962711,"Brachmonat, Juin (June), from a suite of allegorical prints illustrating the months of the year with text in German and French",,,,,,,,
Q102962716,Brass figurine,,,,,,,,
Q102962721,Brawl with Knives,,,,,,,,
Q102962729,Break of Day (Vermont),,,,,,,,
Q102962736,Bright blue pottery vase,,,,,,,,
Q102962742,Bright Green Bowl,,,,,,,,
Q102962750,Bronze dragon handled vessel,,,,,,,,
Q102962760,Bronze gong,,,,,,,,
Q102962766,Bronze mirror with a design of phoenix and bamboo,,,,,,,,
Q102962772,Brooklyn Bridge,,,,,,,,
Q102962779,Brown and cream glazed pitcher,,,,,,,,
Q102962786,Brown bottle,,,,,,,,
Q102962796,Brown ceramic pitcher,,,,,,,,
Q102962805,Brown Glazed Pottery Pitcher,,,,,,,,
Q102962810,Brown one handled pottery pot,,,,,,,,
Q102962815,Brown pot with rim,,,,,,,,
Q102962823,Brown Pottery Bowl,,,,,,,,
Q102962829,Brown Pottery Pitcher,,,,,,,,
Q102962834,Brush washer in the design of a dragon with the bowl portion in the shape of a peach with an incised design on the bottom of a fish and moon,,,,,,,,
Q102962840,Brush washer with a design in blue underglaze of abstract patterns,,,,,,,,
Q102962844,"Brush washer with design of snail, cicada, peaches, and leaves",,,,,,,,
Q102962850,Brush washer with marble pattern in brown and beige,,,,,,,,
Q102962856,Brush-washer,,,,,,,,
Q102962863,Buddhist bell,,,,,,,,
Q102962868,Buddhist shrine with gold lacquer,,,,,,,,
Q102962876,Bulbous vase with black animal motif,,,,,,,,
Q102962882,Burial of Dead in the Snow,,,,,,,,
Q102962889,"Burza (The Tempest), William Shakespeare",,,,,,,,
Q102962896,Butter Pot,,,,,,,,
Q102962907,"Cain and Abel, after a ceiling design by Titian in the Santa Maria della Salute Church, Venice",,,,,,,,
Q102962914,Cake dish with a design in blue under glaze of fish and seaweed,,,,,,,,
Q102962917,Calligraphy,,,,,,,,
Q102962924,"Cambridge, London & North Eastern Railway of England and Scotland",,,,,,,,
Q102962934,Candle stick,,,,,,,,
Q102962942,Caney Fork Cabin,,,,,,,,
Q102962948,Capítulo III de Apocalypse de St. Jean (Chapter III of the Apocalypse of St. John),,,,,,,,
Q102962954,"Capt. Sterrett in the Schr Enterprise paying tribute to Tripoli, August 1801",,,,,,,,
Q102962958,Captain Coram,,,,,,,,
Q102962971,Captivity,,,,,,,,
Q102962978,"Card game counter device for European game with a design of pheasant and wisteria,  birds and insects",,,,,,,,
Q102962984,"Card game counter device for European game with a design of trailing vine, birds and insects",,,,,,,,
Q102962992,Carmi,,,,,,,,
Q102962997,Carnival,,,,,,,,
Q102963004,Carpenter's plumb line,,,,,,,,
Q102963012,Carved Architectural Detail in the Shape of a Phoenix,,,,,,,,
Q102963018,Carved box with lid,,,,,,,,
Q102963026,Carved Container with a Ceremonial Tea Scoop,,,,,,,,
Q102963031,Carved ochre-colored bowl with a design of birds and flowers,,,,,,,,
Q102963038,Carved rhinoceros horn with a design of plants and Mandarin ducks,,,,,,,,
Q102963043,"Casper (also called Casper, Son of Chenil)",,,,,,,,
Q102963048,Cassone from the Colonna family,,,,,,,,
Q102963052,Cassone with Mannerist Design Elements,,,,,,,,
Q102963058,Cast iron wine server with simulated ray skin texture,,,,,,,,
Q102963068,Cat Asleep,,,,,,,,
Q102963075,Cat in the Night,,,,,,,,
Q102963082,"Cat Looking Up, Facing Front",,,,,,,,
Q102963087,"Cat Looking Up, Facing Left",,,,,,,,
Q102963093,"Catching Kittens with Bonito - A Bride Receiving a Gift of Dried Bonito, from the series Yoshitoshi ryakuga (Sketches by Yoshitoshi)",,,,,,,,
Q102963099,Catherine nue se coiffant,,,,,,,,
Q102963106,"Ce pauver henri iv voyant, from Album du Siége",,,,,,,,
Q102963113,Ceci a tué cela. (This has done away with that.) from Album du Siége,,,,,,,,
Q102963120,Celadon ware dish with a molded design of spiral and cherry blossoms,,,,,,,,
Q102963128,Celebrating the Birth of the Buddha in the Inner Palace of Edo Castle (from the series The Inner Palace of Chiyoda Castle),,,,,,,,
Q102963138,Censer in the shape of a duck with a hinged lid (dark patina),,,,,,,,
Q102963144,Ceramic bowl,,,,,,,,
Q102963149,Ceramic Bowl,,,,,,,,
Q102963155,Ceramic Plate,,,,,,,,
Q102963161,Ceramic platter (plaque) with boar hunting scene,,,,,,,,
Q102963166,Chance and Order IV,,,,,,,,
Q102963173,Chant des Girondius,,,,,,,,
Q102963179,Charger with a design of musicians and flowers in a landscape (Kutani ware),,,,,,,,
Q102963183,Charger with designs of court life and scenes from nature,,,,,,,,
Q102963188,Charminster near Dorchester (Peasant Houses),,,,,,,,
Q102963196,Chashaku (tea scoop) with a design of a cricket,,,,,,,,
Q102963201,Chawan (tea bowl) with green glaze,,,,,,,,
Q102963212,Chawan (tea bowl) with with white underglaze and red overglaze,,,,,,,,
Q102963216,Chest of Drawers,,,,,,,,
Q102963225,Chicken effigy figurine,,,,,,,,
Q102963231,"Children who Witness Abuse, Ernie and Brianna",,,,,,,,
Q102963235,"Children who Witness Abuse, Ernie and Brianna's Doll",,,,,,,,
Q102963242,Chimbote vessel,,,,,,,,
Q102963250,Chinese Boat,,,,,,,,
Q102963263,Chinese Winter Landscape,,,,,,,,
Q102963272,"Chiriyu, from ""The Fifty-three Stations of the Tokaido""",,,,,,,,
Q102963279,Christ Before Pilate,,,,,,,,
Q102963287,"Christ child in a basket, after Giovanni Francesco Barbieri (Guercino)",,,,,,,,
Q102963299,Christ Healing the Lepers (after Parmigianino),,,,,,,,
Q102963306,Christ Preaching,,,,,,,,
Q102963314,"Christmonat, Decembre (December), from a suite of allegorical prints illustrating the months of the year with text in German and French",,,,,,,,
Q102963321,Cigar,,,,,,,,
Q102963326,"Cio ch'erse il fasto, or cuopre arena ed erba",,,,,,,,
Q102963334,Circular mirror with unreadable design,,,,,,,,
Q102963338,Circular Suiteki (Water Dropper),,,,,,,,
Q102963344,"City scene with Seggio Nuovo, Chiesa di S. Guiseppe, L'Ospedaletto, and Convento di S. Maria la nuova",,,,,,,,
Q102963350,"Civilization Marches On (Die Zivilisation marschiert), from the series Interregnum",,,,,,,,
Q102963356,Clay fragment,,,,,,,,
Q102963366,Cloisonné ashtray,,,,,,,,
Q102963369,Cloisonné bowl,,,,,,,,
Q102963374,Cloisonne Box,,,,,,,,
Q102963378,Cloth Stencil with a Bamboo Design,,,,,,,,
Q102963382,Cloth Stencil with a Design of a Cloud or Wave Pattern,,,,,,,,
Q102963387,"Cloth Stencil with a Design of a Landscape with a Boat, Building, Pine Trees, & Mt. Fuji",,,,,,,,
Q102963395,Cloth Stencil with a Design of a Landscape with a Building and Trees,,,,,,,,
Q102963401,"Cloth Stencil with a Design of a Single Flower and Lines, Indicating Water or Rain",,,,,,,,
Q102963406,Cloth Stencil with a Design of Bamboo,,,,,,,,
Q102963412,"Cloth Stencil with a Design of Chrysanthemums, Pine Needles, and Flowers",,,,,,,,
Q102963417,Cloth Stencil with a Design of Circles Containing Floral Motifs,,,,,,,,
Q102963425,Cloth Stencil with a Design of Circles with Geometrical Motifs and Flowers,,,,,,,,
Q102963433,Cloth Stencil with a Design of Cranes and Pines,,,,,,,,
Q102963441,Cloth Stencil with a Design of Diamond Shapes and Squared Spirals,,,,,,,,
Q102963448,Cloth Stencil with a Design of Diamond-Like Shapes,,,,,,,,
Q102963454,Cloth Stencil with a Design of Fans and Flowers in the Shape of Butterflies,,,,,,,,
Q102963467,"Cloth Stencil with a Design of Gaming Pieces, for the Game of shogi, Decorated with Cherry Trees or Bamboo",,,,,,,,
Q102963479,Cloth Stencil with a Design of Pine Branches in the Rain,,,,,,,,
Q102963494,Cloth Stencil with a Design of Plum Blossoms and Stylized Birds,,,,,,,,
Q102963511,Cloth Stencil with a Design of Punched Flowers and Double-Coin Designs,,,,,,,,
Q102963523,"Cloth Stencil with a Design of Six-Pointed Stars, Cubes, and Sprays of Flowers",,,,,,,,
Q102963531,Cloth Stencil with a Design of Snow-Covered Bamboo,,,,,,,,
Q102963536,"Cloth Stencil with a Design of Squares with Pine, Plum, and Bamboo",,,,,,,,
Q102963541,Cloth Stencil with a Design of Stylized Fishnets and Sea Plovers,,,,,,,,
Q102963548,Cloth Stencil with a Design of Stylized Leaves and Flowers,,,,,,,,
Q102963553,Cloth Stencil with a Design of Trefoils,,,,,,,,
Q102963558,Cloth Stencil with a Design of Two Stylized Leaves on a Vine,,,,,,,,
Q102963563,Cloth Stencil with a Design of Two Sun Symbols and Geometrical Designs,,,,,,,,
Q102963568,Cloth Stencil with a Design of Vines and Circles,,,,,,,,
Q102963575,Cloth Stencil with a Design of Vines and Leaves with Wavy Vertical Lines (Rain),,,,,,,,
Q102963581,Cloth Stencil with a Design of Wisteria,,,,,,,,
Q102963587,"Cloth Stencil with a Design of Zigzag Lines, Flowers, and Symbols for the Chapters of The Tale of Genji",,,,,,,,
Q102963592,Cloth Stencil with a Landscape Design,,,,,,,,
Q102963597,Cloth Stencil with a Pattern of Leaves on Water,,,,,,,,
Q102963606,Cloth Stencil with an Abstract Design of Grass Blades,,,,,,,,
Q102963615,Cloth Stencil with Columns of Writing and Random Short Lines,,,,,,,,
Q102963621,"Cloth Stencil with Designs of Circles with Wave Patterns, Leaves, Random Hexagons, etc.",,,,,,,,
Q102963628,Cloth Stencil with Diamond Designs and Borders of Cherry Blossoms,,,,,,,,
Q102963633,Cloth Stencil with Diamond Shapes and Double-Circles with a Lattice Background,,,,,,,,
Q102963640,Cloth Stencil with Diamond-Shaped Leaves and Floral Forms,,,,,,,,
Q102963648,Cloth Stencil with Squares and Diamond Shapes,,,,,,,,
Q102963654,Cloth with a Design of an Elephant and a Decorative Border,,,,,,,,
Q102963665,Clothed figure of a boar,,,,,,,,
Q102963673,Coast Scene in Italy,,,,,,,,
Q102963683,Coasters (six in total),,,,,,,,
Q102963693,Coin (reproduction),,,,,,,,
Q102963698,Collage of Burned Nevelson,,,,,,,,
Q102963702,Compass with circular design on lid,,,,,,,,
Q102963708,Composition,,,,,,,,
Q102963717,"Composition in Yellow, Green and Orange",,,,,,,,
Q102963723,"Concentric II, from American Abstract Artists 60th Anniversary Print Portfolio 1997",,,,,,,,
Q102963729,Concrete Ammunition; Second Line Defense,,,,,,,,
Q102963736,Cone shaped vessel with human face design on neck,,,,,,,,
Q102963749,Conspirators,,,,,,,,
Q102963753,Container,,,,,,,,
Q102963763,Container in the form of a Buddhist god's head on three legs with inlaid semi-precious red stones (incense burner),,,,,,,,
Q102963769,Container in the shape of a squatting figure with broad face and goggles on his head,,,,,,,,
Q102963776,Container with a strap handle and human head,,,,,,,,
Q102963782,Container with swastika design and inscription for Buddhist effigy with drawstring bead (ojime),,,,,,,,
Q102963786,Copy of Orpheus and Eurydice by Nicolas Poussin,,,,,,,,
Q102963795,Cordoba,,,,,,,,
Q102963806,Corrugated (1 of 8),,,,,,,,
Q102963816,Corrugated (2 of 8),,,,,,,,
Q102963822,Corrugated (3 of 8),,,,,,,,
Q102963828,Corrugated (4 of 8),,,,,,,,
Q102963839,Corrugated (5 of 8),,,,,,,,
Q102963848,Corrugated (6 of 8),,,,,,,,
Q102963856,Corrugated (7 of 8),,,,,,,,
Q102963866,Corrugated (8 of 8),,,,,,,,
