qid,act_id,label,description,image_filename
Q108611782,56649,Christ and the young rich ruler,painting by Heinrich Hofmann in 1889,Hoffman-ChristAndTheRichYoungRuler.jpg
Q23929472,56652,Sunset Landscape with a Shepherd and his Flock,painting by Attributed to Sir Anthony van Dyck,"Van Dyck, Sir Anthony - Sunset Landscape with a Shepherd and his Flock - Google Art Project.jpg"
Q28805928,56654,The immigrants' ship,painting by John C. Dollman,John C. Dollman - The immigrants' ship - Google Art Project.jpg
Q28532821,56655,Jesus Washing Peter’s Feet,painting by Ford Madox Brown,Jesus washing Peter's feet.jpg
Q26678230,56662,Jesus opens the Eyes of a Man born Blind,painting by Duccio,Duccio di Buoninsegna 037.jpg
Q19858748,56665,The Widow's Mite,painting by James Tissot,Brooklyn Museum - The Widow's Mite (Le denier de la veuve) - James Tissot.jpg
Q20355351,56668,The Prophet Elijah with the Widow of Zarephath and her Son,painting by Abraham van Dijck,Abraham van Dijck - The Prophet Elijah with the Widow of Zarephath and her Son - KMS3578 - Statens Museum for Kunst.jpg
Q110561891,56672,Hannah before Eli the High Priest,manuscript by Malnazar and Aghap'ir,Malnazar - Hannah before Eli the High Priest - Google Art Project.jpg
Q3172259,56674,The Oxbow,painting by Thomas Cole,Cole Thomas The Oxbow (The Connecticut River near Northampton 1836).jpg
Q19925470,56676,Snap the Whip,painting by Winslow Homer in the  Metropolitan Museum of Art,Snap the Whip 1872 Winslow Homer.jpg
Q28777022,56687,Waterlilies,painting by Claude Monet,Claude Monet - Waterlilies - Google Art Project.jpg
Q3874376,56689,The Millinery Shop,"painting by Edgar Degas, 1885",Edgar Degas - The Millinery Shop - Google Art Project.jpg
Q20392130,56692,Wheat,painting by John Linnell,John Linnell - Wheat - Google Art Project.jpg
Q20178539,56693,Still Life with Figs and Bread,painting by Luis Melendez,Luis Meléndez - Still Life with Figs and Bread - Google Art Project.jpg
Q18686003,56694,Meadowland (The Pasture),painting by Henri Rousseau,Henri Rousseau - Meadowland - Google Art Project.jpg
Q110561956,56696,Poste Camino de Santiago,guide marker for pilgrims,Poste Camino de Santiago.jpg
Q17780704,56703,Woman scrubbing a kettle,painting by Adriaan de Lelie,SA 1831-Ketelschuurster.jpg
Q783215,56715,Saint John the Baptist,painting by Leonardo da Vinci,Leonardo da Vinci - Saint John the Baptist C2RMF retouched.jpg
Q28781995,56719,Annunciation,"painting by El Greco（Domenikos Theotokopoulos), now at Ohara Museum of Art",El GRECO (Domenikos Theotokopoulos) - Annunciation - Google Art Project.jpg
Q18685777,56753,Adoration of the Child,painting by Gerard van Honthorst,Gherardo delle Notti o Gheritt van Hontorst - Adorazione del Bambino - Google Art Project.jpg
Q27980614,56756,Jesus among the Doctors,painting by David Teniers d. J.,David Teniers after Ribera - Jesus among the Doctors GG 9801.jpg
Q3636745,56767,Baptism of Christ,fresco by Giotto di Bondone,Giotto di Bondone - No. 23 Scenes from the Life of Christ - 7. Baptism of Christ - WGA09201.jpg
Q603751,56768,The Peasant Wedding,painting by Pieter Brueghel the Elder,Pieter Bruegel the Elder - Peasant Wedding - Google Art Project 2.jpg
Q19858258,56774,Jesus Unrolls the Book in the Synagogue,painting by James Tissot,Brooklyn Museum - Jesus Unrolls the Book in the Synagogue (Jésus dans la synagogue déroule le livre) - James Tissot - overall.jpg
Q46941334,56775,Sunday Morning in Virginia,painting by Winslow Homer,Winslow Homer - Sunday Morning in Virginia - Google Art Project.jpg
Q102355566,56783,The marriage at Cana,painting by Winifred Knights,'The Marriage at Cana' by Winifred Knights.jpg
Q18600956,56784,The Marriage in Cana,painting by Anders Eriksson,The Marriage in Cana (Anders Eriksson) - Nationalmuseum - 22422.tif
Q3697606,56795,Christ before Caiaphas,painting by Giotto di Bondone,Giotto di Bondone - No. 32 Scenes from the Life of Christ - 16. Christ before Caiaphas - WGA09217.jpg
Q3615314,56796,The Road to Calvary,painting by Pietro Lorenzetti,Pietro Lorenzetti - The Road to Calvary - WGA13511.jpg
Q19925099,56798,The Three Crosses,painting by Peter Paul Rubens,Peter Paul Rubens The Three Crosses.jpg
Q20179805,56799,Christ on the Cross,painting by El Greco (Domenico Theotocopuli),El Greco (Domenico Theotocopuli) - Christ on the Cross - Google Art Project.jpg
Q18574395,56814,Reflection in Blue,painting by Eva Bonnier,Reflection in Blue (Eva Bonnier) - Nationalmuseum - 18706.tif
Q3713983,56817,Women miners,painting by Vincent van Gogh,Women miners.jpg
Q110561981,56825,Snowstorm of Stars,photograph by NASA and ESA,A snowstorm of stars.jpg
Q7721749,56827,The Catskills,painting by Asher Brown Durand,Asher Brown Durand - The Catskills - Walters 37122.jpg
Q19858261,56832,The Healing of Peter's Mother-in-law,painting by James Tissot,Brooklyn Museum - The Healing of Peter's Mother-in-law (La guérison de la belle-mère de Pierre) - James Tissot - overall.jpg
Q28541587,56840,The Prodigal Son,painting by John Macallan Swan,"John Macallan Swan - The Prodigal Son, 1888.jpg"
Q51078405,56842,Departure of the Prodigal Son,painting by Jan Miense Molenaer,Jan Miense Molenaer - Departure of the Prodigal Son.jpg
Q85839383,56844,Return from the Harvest,painting by William-Adolphe Bouguereau,William-Adolphe Bouguereau (1825-1905) - Return from the Harvest (1878).jpg
Q19858750,56847,The Ointment of the Magdalene,painting by James Tissot,Brooklyn Museum - The Ointment of the Magdalene (Le parfum de Madeleine) - James Tissot.jpg
Q23948082,56848,The Lamentation,painting by Govaert Flinck,Govaert Flinck - The Lamentation - Google Art Project.jpg
Q108612297,56863,Miriam,mosaic created by Radbod Commandeur,Miriam IMG 28071.JPG
Q50598938,56865,Entry of Christ into Jerusalem,painting by Pieter Coecke van Aelst and/or workshop,Entry of Christ into Jerusalem by Pieter Coecke van Aelst Bonnefantenmuseum 1246.jpg
Q19858822,56871,Mary Magdalene questions the Angels in the Tomb,painting by James Tissot,Brooklyn Museum - Mary Magdalene Questions the Angels in the Tomb (Madeleine dans le tombeau interroge les anges) - James Tissot.jpg
Q26522395,56879,The Walk to Emmaus,painting by Lelio Orsi,Lelio Orsi Camino de Emaús.jpg
Q20177807,56880,Christ on the Road to Emmaus,painting by American 18th Century,Christ on the Road to Emmaus G-001552-20120605.jpg
Q19859035,56884,"The Disciples at Emmaus, or The Pilgrims at Emmaus",painting by Eugène Delacroix,Brooklyn Museum - The Disciples at Emmaus or The Pilgrims at Emmaus (Les disciples d'Emmaüs ou Les pèlerins d'Emmaüs) - Eugène Delacroix.jpg
Q23758352,56900,The Pool of Bethesda,painting by Robert Bateman,Robert Bateman - The Pool of Bethesda - Google Art Project.jpg
Q27990845,56901,Christ Healing the Sick at the Pool of Bethesda,painting by Pedro de Orrente,Pedro Orrente - Christ Healing the Sick at the Pool of Bethesda.jpg
Q27990845,56901,Christ Healing the Sick at the Pool of Bethesda,painting by Pedro de Orrente,Pedro Orrente - Christ Healing the Sick at the Pool of Bethesda - KHM Vienna.jpg
Q28797804,56933,Paradise Landscape with Animals,painting by Jan Breughel Ii,Jan Breughel Ii - Paradise Landscape with Animals - Google Art Project.jpg
Q19928329,56934,"Un verger au printemps, By",painting by Alfred Sisley,"Alfred Sisley - Orchard in Spring, By - Google Art Project.jpg"
Q82119559,56936,Animals at the Bottom of the Sea,painting by Odilon Redon,Odilon Rendon Animals-of-the-Bottom-of-the-Sea.jpg
Q28796194,56939,Sunlight on the Coast,painting by Winslow Homer,Winslow Homer - Sunlight on the Coast - Google Art Project.jpg
Q15293656,56948,The Tower of Babel,painting by Pieter Bruegel the Elder in the Kunsthistorisches Museum in Vienna,"Pieter Bruegel d. Ä., , Kunsthistorisches Museum Wien, Gemäldegalerie - Turmbau zu Babel - GG 1026 - Kunsthistorisches Museum.jpg"
Q15293656,56948,The Tower of Babel,painting by Pieter Bruegel the Elder in the Kunsthistorisches Museum in Vienna,Pieter Bruegel the Elder - The Tower of Babel (Vienna) - Google Art Project - edited.jpg
Q110561945,56949,Pentecost,relief sculpture,Pallottihaus 03.jpg
Q67204173,56957,"Waterfall on the Clyde River, Tasmania",painting by Eugene von GUÉRard,"Eugene von GUÉRard - Waterfall on the Clyde River, Tasmania - Google Art Project.jpg"
Q29169570,56958,The prayer before the meal,painting by Jan Steen,Jan Steen - The Prayer before the Meal 272L12036 6LMH7.jpg
Q29169570,56958,The prayer before the meal,painting by Jan Steen,"Jan Steen - The Prayer Before the Meal, 1660.jpg"
Q19858271,56960,Healing of the Lepers at Capernaum,work by James Tissot,Brooklyn Museum - Healing of the Lepers at Capernaum (Guérison des lépreux à Capernaum) - James Tissot - overall.jpg
Q18683338,56970,A Woman Nursing a Child,painting by Pierre-Auguste Renoir,Pierre-Auguste Renoir - A Woman Nursing a Child - Google Art Project.jpg
Q110561943,56974,"Patrobulus, Hermas, Linus, Caius, Philologus of the 70 Disciples",manuscript by artist unknown,"Patrobulus, Hermas, Linus, Caius, Philologus of 70 disciples (Menologion of Basil II).jpg"
Q21558277,56981,The Good Samaritan,painting by Rembrandt,Rembrandt Harmensz. van Rijn 033.jpg
Q104836934,56998,The Thankful Poor,painting by Henry Ossawa Tanner,"The Thankful Poor, 1894. Henry Ossawa Tanner.jpg"
Q20490987,57002,Parable of the Rich Man and Lazarus,painting by Lawrence W. Ladd,Parable of the Rich Man and Lazarus (Lawrence W. Ladd).jpg
Q20891364,57013,The Artist's Mother Opening a Door,painting by Edouard Vuillard,Edouard Vuillard - The Artist’s Mother Opening a Door - Google Art Project.jpg
Q18685564,57014,The Mealtime Prayer,painting by Fritz von Uhde,The Mealtime Prayer - Fritz von Uhde - Google Cultural Institute.jpg
Q2666439,57022,Morning in a Pine Forest,painting by Russian artists Ivan Shishkin and Konstantin Savitsky,"Shishkin, Ivan - Morning in a Pine Forest.jpg"
Q55422682,57030,Low Church Devotion (1852),painting by Adolph Tidemand,Adolph Tidemand - Low Church Devotion - Google Art Project (9QGXjFzX4Caijw).jpg
Q55422682,57030,Low Church Devotion (1852),painting by Adolph Tidemand,"Adolph Tidemand - Low Church Devotion - NG.M.00197 - National Museum of Art, Architecture and Design.jpg"
Q19912862,57037,Among the Humble,painting by Léon-Augustin Lhermitte,Among the Humble MET ep05.38.bw.R.jpg
Q17301597,57038,Archangel Michael,,Pedro García de Benabarre and workshop - Herod's Banquet - Google Art Project.jpg
Q17301597,57038,Archangel Michael,,Pere Garcia - Archangel Michael.jpg
Q110561992,57041,Sweet Honey in the Rock live at Ravinia,photograph by singitonline,Sweet Honey in the Rock.jpg
Q29965648,57047,Reading Woman,painting by Pieter Janssens Elinga,Pieter Janssens Elinga - Reading Woman - WGA7482.jpg
Q23941672,57048,Picnic,painting by Maurice Prendergast,Maurice Prendergast - Picnic - Google Art Project.jpg
Q20985031,57049,Herman Kähler in his Workshop,painting by Laurits Andersen Ring,Herman Kähler i sit værksted.jpg
Q19858342,57053,The Pharisees Question Jesus,work by James Tissot,Brooklyn Museum - The Pharisees Question Jesus (Les pharisiens questionnent Jésus) - James Tissot.jpg
Q20178568,57057,Pictorial Quilt,quilt by Harriet Powers,Harriet Powers - Pictorial quilt - Google Art Project.jpg
Q97732594,57071,Lazarus and the Rich Man,"Print by Anonymous, British, 19th century (MET, 1976.602.56)",Lazarus and the Rich Man MET DP818354.jpg
Q19858614,57156,Shepherd Tending His Flock,painting by Jean-François Millet,Jean-François Millet - Shepherd Tending His Flock - Google Art Project.jpg
Q16913580,57167,Old Woman Reading,painting by Gerard Dou,Gerard Dou 005.jpg
Q22912333,57169,Mountain of the Holy Cross,watercolor painting by Thomas Moran,"Thomas Moran, Mountain of the Holy Cross, 1890. Watercolor, National Gallery of Art, Washington,.jpg"
Q60323117,57173,The siesta,painting by José Malhoa,"José Malhoa - A sesta, 1909.JPG"
Q17331263,57187,The Pharisee and the publican,painting by Barent Fabritius,De Farizeeër en de tollenaar Rijksmuseum SK-A-2959.jpeg
Q17026086,57192,"A Storm in the Rocky Mountains, Mt. Rosalie",oil painting by Albert Bierstadt,"Albert Bierstadt - A Storm in the Rocky Mountains, Mt. Rosalie - Google Art Project.jpg"
Q78076035,57195,The raising of souls to Heaven,illumination from a book of hours (NLW MS 15537C),De Grey Hours f.188.v The raising of souls to Heaven.png
Q19018954,57223,Heavy Sea at Pourville,painting by Claude Monet,Claude Monet - Heavy Sea at Pourville - Google Art Project.jpg
Q19858344,57226,The Prophecy of the Destruction of the Temple,work by James Tissot,Brooklyn Museum - The Prophecy of the Destruction of the Temple (La prédication de la ruine du Temple) - James Tissot.jpg
Q60740308,57233,Christ and Saint John the Evangelist,sculpture by unknown artist (1928.753),Clevelandart 1928.753.jpg
Q60740308,57233,Christ and Saint John the Evangelist,sculpture by unknown artist (1928.753),"Germany, Swabia, near Bodenese (Lake Constance), early 14th century - Christ and Saint John the Evangelist - 1928.753 - Cleveland Museum of Art.tif"
Q29480576,57236,Christ Crucified between the Two Thieves,"painting by Lucas Cranach the Elder, Alte Pinakothek","Cranach il vecchio, calvario, 1515-20.JPG"
Q110561842,57247,Bell Tower Clock,architectural structure,Todtnau - St. Jakobus der Ältere3.jpg
Q1698794,57249,The Altar of St. John,triptych by Rogier van der Weyden,Rogier van der Weyden - The Altar of St. John - Google Art Project.jpg
Q19928795,57251,"""Wretched are the legs that must bear the burden of poverty""",painting by Adriaen Pietersz. van de Venne,Adriaen Pietersz. van de Venne 003.jpg
Q27897400,57254,The Valley in the Sea,painting by Edward Moran,"Moran, Edward - The Valley in the Sea - Google Art Project.jpg"
Q84448006,57263,Giaele kills Sisara,painting by Gregorio Lazzarini,Gregorio Lazzarini 001.jpg
Q59490546,57269,Dream of Solomon,painting by Luca Giordano,Luca Giordano - Dream of Solomon - WGA09004.jpg
Q20396156,57273,The Judgement of Solomon,painting by workshop of Peter Paul Rubens,Workshop of Peter Paul Rubens -The Judgement of Solomon.jpg
Q110561867,57280,David the Prophet - King David in Prayer,painting by Pieter de Grebber,5201-king-david-in-prayer-pieter-de-grebber.jpg
Q110561934,57284,Michal lets David escape from the window,print by Gustave Doré,Michal Gustave Doré.jpg
Q110561864,57285,David and Abigail,painting by Antonio Molinari,Antonio Molinari David y Abigail.jpg
Q59684856,57286,David and Abigail,painting by Juan Antonio de Frías y Escalante,Escalante-abigail.jpg
Q22675382,57303,Blind Kristian minding a child,painting by Michael Peter Ancher,Michael Ancher - Blind Kristian minding a child - Google Art Project.jpg
Q19858723,57306,The Blind Man Washes in the Pool of Siloam,work by James Tissot,Brooklyn Museum - The Blind Man Washes in the Pool of Siloam (Le aveugle-né se lave à la piscine de Siloë) - James Tissot.jpg
Q23936093,57307,Healing the Man Born Blind,painting by Annibale Carracci,Annibale Carracci - Healing the Man Born Blind - Google Art Project.jpg
Q18889383,57311,At the Deathbed,painting by Edvard Munch,"'At the Deathbed' by Edvard Munch, 1895, Bergen Kunstmuseum.JPG"
Q27979344,57314,Landscape with the temptation of Christ,painting by Jan Brueghel d. Ä.,Jan Brueghel (I) - Mountain Landscape with the Temptation of Christ.jpg
Q9068317,57320,The Raising of Lazarus,painting by Duccio di Buoninsegna,"'The Raising of Lazarus', tempera and gold on panel by Duccio di Buoninsegna, 1310–11, Kimbell Art Museum.jpg"
Q9378388,57322,The Raising of Lazarus,painting by Vincent van Gogh,De opwekking van Lazarus (naar Rembrandt) - s0169V1962 - Van Gogh Museum.jpg
Q3726352,57328,Entry of Christ into Jerusalem,painting by Pietro Lorenzetti,Pietro Lorenzetti - Entry of Christ into Jerusalem - WGA13502.jpg
Q21618758,57333,Mary Magdalene anointing Christ’s feet,illuminated miniature from the Vaux Passional,Mary Magdalen anointing Christ’s feet (f. 15v).jpg
Q18430656,57343,Crucifixion of Scheut,"A painting masterpiece from Rogier van der Weyden, now in Monastery of Escorial",Weyden Christ on the Cross with Mary and St John.jpg
Q3504778,57346,Kiss of Judas,fresco by Giotto di Bondone,Giotto di Bondone - No. 31 Scenes from the Life of Christ - 15. The Arrest of Christ (Kiss of Judas) - WGA09216.jpg
Q430069,57347,Ecce Homo,painting by Hieronymus Bosch in the collection of the Städel museum,Ecce homo by Hieronymus Bosch.jpg
Q23948008,57354,Christ Carried Down to the Tomb,painting by Eugène Delacroix,Eugène Delacroix - Christ Carried Down to the Tomb - Google Art Project.jpg
Q12404907,57358,Valley of the Shadow of Death,photograph by Roger Fenton,Valley of the shadow of death.jpg
Q28797650,57364,Christ in Prayer,painting by Doménikos Theotokópulos (called El Greco),Doménikos Theotokópulos (called El Greco) - Christ in Prayer - Google Art Project.jpg
Q110561895,57368,Holy Spirit Seminary,architectural structure,Holy Spirit Seminary.JPG
Q3203172,57370,Christ's Entry Into Brussels in 1889,painting by James Ensor,Christ's Entry into Brussels in 1889.jpg
Q20741594,57383,Brazilian Forest,painting by Martin Johnson Heade,Brazilian Forest.jpg
Q110561845,57399,Cathedral of Our Lady of Peace,architectural structure by artist unknown,"Church in Fort Lamy, Chad.jpg"
Q20182055,57405,The Good Shepherd,painting by Henry Ossawa Tanner (1902),Henry Ossawa Tanner - The Good Shepherd - Google Art Project.jpg
Q19820166,57410,Eliezer and Rebecca,painting by Nicolas Poussin,Éliézer et Rebecca-Nicolas Poussin-musée du Louvre.jpg
Q766782,57411,The Jewish Bride,painting by Rembrandt,"Rembrandt Harmensz. van Rijn - Portret van een paar als oudtestamentische figuren, genaamd 'Het Joodse bruidje' - Google Art Project.jpg"
Q110561924,57412,"Manche Masemola, South African Martyr",sculpture,WestminsterAbbey-Martyrs.jpg
Q110561880,57420,Mount Lushan Fog,photograph by Pfctdayelise,Mount Lushan - fog.JPG
Q17630850,57425,Jacob's Ladder,painting by William Blake,Blake jacobsladder.jpg
Q65648494,57431,Jacob and Rachel at the Well,painting by Francisco Antolinez y Sarabia,"Francisco Antolinez y Sarabia - 'Jacob and Rachel at the Well', oil on canvas, 1670, El Paso Museum of Art.jpg"
Q110561994,57433,The Promised Land,painting by Lette Valeska,The Promised Land.jpg
Q110561898,57436,Icon of Christ Feeding the Multitude,painting by artist unknown,Christ feeding the multitude.jpg
Q110561618,57440,2009 world map showing countries by prevalence of female trafficking,garment by WomanStats Project,Map3.3Trafficking compressed.jpg
Q61890442,57540,Moses and his Ethiopian wife Zipporah,painting by Jacob Jordaens,Jacob Jordaens - Moses and his Ethiopian wife Sephora.jpg
Q110562003,57552,Thrush Nest,print by Philip Henry Gosse,"Natural History, Birds - Thrush nest.jpg"
Q20537606,57590,"A Rocky Mountain Sheep, Ovis, Montana",painting by Albert Bierstadt,Bierstadt Albert A Rocky Mountain Sheep Ovis Montana.jpg
Q18685622,57597,Jonah,painting by George Frederic Watts,George Frederic Watts - Jonah - Google Art Project.jpg
Q65025502,57605,The Sleeping Shepherd; Early Morning,print in the National Gallery of Art (NGA 9505),"Samuel Palmer, The Sleeping Shepherd; Early Morning, 1857, NGA 9505.jpg"
Q22008851,57617,Noli me tangere,painting by Jehan Bellegambe,Bellegambe Noli me tangere.jpg
Q98549607,57620,Job and His Friends,painting by Ilya Repin,Job and his friends.jpg
Q14940735,57624,Job Mocked by his Wife,painting by Georges de La Tour,Georges de La Tour 044.jpg
Q3764872,57632,Job,painting by Fra Bartolomeo,"Fra bartolomeo, giobbe.jpg"
Q3428032,57635,Jabach Altarpiece,painting by Albrecht Dürer,Jarbach Altarpiece 01.jpg
Q110561913,57646,Job and His Friends,manuscript by artist unknown,Kievskaya psaltir iov 02.jpg
Q20009111,57678,Righteous Job,manuscript by artist unknown,MARC538fol5.jpg
Q59484249,57738,"Armistice Day, Munitions Centre",painting by Frederick Etchells,"Frederick Etchells - Armistice Day, Munitions Centre.jpg"
Q18601322,57739,Praying Woman,painting by unknown painter,Praying Woman - Nationalmuseum - 23609.tif
Q21177097,57743,Christening in Tanum Church,painting by Harriet Backer,Harriet Backer - Christening in Tanum Church - Google Art Project.jpg
Q18600222,57747,The Tribute Money,painting by Jacob Adriaensz. Backer,The Tribute Money (Jacob Adriaensz. Backer) - Nationalmuseum - 17634.tif
Q24064675,57763,King David Playing the Harp,painting by Gerard van Honthorst,Gerard van Honthorst - King David Playing the Harp - Google Art Project.jpg
Q28093574,57764,Saint Joseph and the Christ Child,painting by Guido Reni,Guido Reni - Saint Joseph and the Christ Child - 96.1565 - Museum of Fine Arts.jpg
Q28093574,57764,Saint Joseph and the Christ Child,painting by Guido Reni,Guido Reni - Saint Joseph and the Christ Child - Google Art Project.jpg
Q110561989,57773,Sunday School,architectural structure,Korean Central Presbyterian Church.jpg
Q110561974,57774,"Sanctuary of the Divine Works of Mercy, Window",stained glass window by Jorge Luis Narea,Santuario de la Divina Misericordia de Guayaquil (17613500314).jpg
Q20891346,57812,Picking Cotton,painting by Clementine Hunter,Clementine Hunter - Picking Cotton - 91.88.1 - Minneapolis Institute of Arts.jpg
Q21764197,57832,Elijah,sculpture by Marc Arcis,Augustins - Le Prophète Élie by Marc Arcis.jpg
Q110561824,57836,Abbie Sweetwine Treating Injured,drawing by Air Force Medical Service Art,Drawing of Abbie Sweetwine treating injured.jpg
Q26161645,57875,Saint Maurice,painting by Theodoric of Prague,Meister Theoderich von Prag 024.jpg
Q110561929,57882,Mary Eliza Mahoney,photograph by artist unknown,Mary Eliza Mahoney.jpg
Q21530716,57911,Portrait of an Old Woman (Prophetess Hannah),painting by Rembrandt,Rembrandt Harmensz. van Rijn 085.jpg
Q21530716,57911,Portrait of an Old Woman (Prophetess Hannah),painting by Rembrandt,"Rembrandt Harmensz van Rijn, , Kunsthistorisches Museum Wien, Gemäldegalerie - Die Prophetin Hanna - GG 408 - Kunsthistorisches Museum.jpg"
Q20643496,57913,Snow-covered Landscape,painting by Pierre-Auguste Renoir,Auguste Renoir - Snow-covered Landscape - Google Art Project.jpg
Q22235777,57923,Nicodemus (Figure of an Entombment),,"Wiki Loves Art - Gent - Museum voor Schone Kunsten - Figuur van een graflegging, Nicodemus (Q22235777) (1).JPG"
Q22235777,57923,Nicodemus (Figure of an Entombment),,"Wiki Loves Art - Gent - Museum voor Schone Kunsten - Figuur van een graflegging, Nicodemus (Q22235777) (2).JPG"
Q20180001,57924,Nicodemus,painting by Henry Ossawa Tanner,Henry Ossawa Tanner - Jesus and nicodemus.jpg
Q20539930,57929,Madonna of Humility,"painting by Giovanni di Paolo in Museum of Fine Arts, Boston",Madonna of Humility.Giovanni di Paolo. Boston MFA.jpg
Q23756462,57933,The Harvest Moon,painting by Samuel Palmer,Samuel Palmer - The Harvest Moon - Google Art Project.jpg
Q19858275,57938,The Man with the Withered Hand,painting by James Tissot,Brooklyn Museum - The Man with the Withered Hand (L'homme à la main desséchée) - James Tissot - overall.jpg
Q17522671,57945,Regentesses of the Children's Orphanage in Haarlem,painting by Jan Salomonsz de Bray,Jan de Bray - Tending Children at the Orphanage in Haarlem - WGA03131.jpg
Q21807895,57948,Pilgrimage to the Cedars of Lebanon,painting by Tivadar Csontváry Kosztka,"Csontváry Kosztka, Tivadar - Pilgrimage to the Cedars of Lebanon - Google Art Project.jpg"
Q27701893,57951,Sea storm,painting by Eduard Hildebrandt,Eduard Hildebrandt - Sea tempest - M.Ob.2204 - National Museum in Warsaw.jpg
Q27701893,57951,Sea storm,painting by Eduard Hildebrandt,Hildebrandt Sea storm.jpg
Q2246489,57953,The Storm on the Sea of Galilee,stolen painting by Rembrandt,Rembrandt Christ in the Storm on the Lake of Galilee.jpg
Q2246489,57953,The Storm on the Sea of Galilee,stolen painting by Rembrandt,Rembrandt van Rijn - Christ in the Storm on the Sea of Galilee - P21s24 - private collection.jpg
Q19858281,57954,Jesus Stilling the Tempest,painting by James Tissot,Brooklyn Museum - Jesus Stilling the Tempest (Jésus calmant la tempête) - James Tissot - overall.jpg
Q2670127,57956,Agape feast,communal meal shared among Christians,Agape feast 02.jpg
Q19858284,57958,The Daughter of Jairus,painting by James Tissot,Brooklyn Museum - The Daughter of Jairus (La fille de Zäire) - James Tissot - overall.jpg
Q19858690,57960,The Woman with an Issue of Blood,painting by James Tissot,Brooklyn Museum - The Woman with an Issue of Blood (L'hémoroïsse) - James Tissot.jpg
Q21993237,57964,"Scorned as Timber, Beloved of the Sky",painting by Emily Carr,"Carr,Emily - Scorned as timber.jpg"
Q72544122,57971,Saint John the Baptist Preaching Before Herod,painting by Pieter de Grebber,Musée de Lille P. F. de Grebber.jpg
Q64350172,57978,Forest Scene (Path from Mas Jolie to Château noir),painting by Paul Cézanne,Paul Cézanne - Forest Scene (Path from Mas Jolie to Château noir) - Google Art Project.jpg
Q18588766,57986,The miracle of the five loaves and two fish,painting by Lucas Cranach the Elder,The miracle of the five loaves and two fish (Lucas Cranach d.ä.) - Nationalmuseum - 34936.tif
Q9191534,57989,Christ at the Sea of Galilee,painting,"Tintoretto, Jacopo - Christ at the Sea of Galilee.jpg"
Q11930181,57990,Apperance of Jesus to his Disciples at Sea,sculpture by Maître de Cabestany,Mestre de cabestany.jpg
Q83742678,57991,Christ Healing the Blind,painting by Philippe de Champaigne,"Christ Healing the Blind by Philippe de Champaigne, Timken Museum of Art.JPG"
Q110561938,57992,Naomi entreating Ruth and Orpah to return to the land of Moab,watercolor by William Blake,1795-William-Blake-Naomi-entreating-Ruth-Orpah.jpg
Q19858312,57994,The Scribe Stood to Tempt Jesus,painting by James Tissot,Brooklyn Museum - The Scribe Stood to Tempt Jesus (Le scribe se leva pour tenter Jésus) - James Tissot - overall.jpg
Q28840319,57998,The Nativity of Christ,painting by anonymous painter,The Nativity of Christ - Google Art Project.jpg
Q64572422,58040,Aunt Hannah,painting by Thomas Pollock Anshutz,Thomas P. Anshutz - Aunt Hannah.jpg
